data,tag,timestamp,user_id
"","start","2024-08-12 06:04:20","4"
"{""user_input"": ""부적절한 콘텐츠의 기준이 무엇인가요?"", ""category"": [{""sentence"": ""부적절한 콘텐츠의 기준이 무엇인가요?"", ""categories"": ""Question"", ""type"": ""Low-Level""}], ""new_knowledge"": [""Understanding the criteria for inappropriate content is crucial for effective filtering.""], ""new_actionPlan"": [""Research and define clear criteria for what constitutes inappropriate content for children.""], ""new_thinking"": ""부적절한 콘텐츠의 기준이 무엇인지 명확히 이해하는 것이 중요하구나."", ""evaluation"": {""sentences"": [{""sentence"": ""부적절한 콘텐츠의 기준이 무엇인가요?"", ""categories"": ""Question"", ""type"": ""Low-Level"", ""knowledge"": ""Clarification on what constitutes inappropriate content."", ""evaluation"": {""timely"": 5, ""relevance"": 6, ""high-level"": 1, ""specificity"": 0, ""justification"": 0, ""active"": 0, ""sentiment"": 0}}]}, ""response"": {""answer"": ""부적절한 콘텐츠 기준은 폭력성, 선정성, 욕설 등을 포함한 콘텐츠로 설정하고 있습니다. AI가 이런 요소를 검출하고 차단하게 설계할 계획이에요.""}}","user_feedaback","2024-08-12 06:05:10","4"
"{""user_input"": ""부적절한 콘텐츠를 객관적으로 판단할 수 있도록 공신력있는 자료를 참고하면 좋을 것 같아요"", ""category"": [{""sentence"": ""부적절한 콘텐츠를 객관적으로 판단할 수 있도록 공신력있는 자료를 참고하면 좋을 것 같아요"", ""categories"": ""Statement"", ""type"": ""Recommendation""}], ""new_knowledge"": [""Using objective and reliable data sources can enhance the accuracy of content filtering.""], ""new_actionPlan"": [""Research and integrate credible data sources to improve the objectivity and reliability of the content filtering criteria.""], ""new_thinking"": ""객관적이고 신뢰할 수 있는 데이터 소스를 활용하면 콘텐츠 필터링의 정확성을 높일 수 있겠어."", ""evaluation"": {""sentences"": [{""sentence"": ""부적절한 콘텐츠를 객관적으로 판단할 수 있도록 공신력있는 자료를 참고하면 좋을 것 같아요"", ""categories"": ""Statement"", ""type"": ""Recommendation"", ""knowledge"": ""Referencing credible sources can help objectively determine inappropriate content."", ""evaluation"": {""specificity"": 5, ""justification"": 5, ""active"": 4, ""sentiment"": 1}}]}, ""response"": {""answer"": ""알겠습니다. 공신력 있는 자료로는 방송통신심의위원회 가이드라인이나 국제적으로 인정받는 아동 보호 기준을 참고할 수 있을 것 같아요.""}}","user_feedaback","2024-08-12 06:06:10","4"
"{""user_input"": ""또한 연령대에 따라서 콘텐츠 노출을 바꾼다고 했는데 어떤 기준인지 더 구체적으로 말해주세요"", ""category"": [{""sentence"": ""또한 연령대에 따라서 콘텐츠 노출을 바꾼다고 했는데 어떤 기준인지 더 구체적으로 말해주세요"", ""categories"": ""Question"", ""type"": ""Low-Level""}], ""new_knowledge"": [""Clearly defining criteria for content filtering is essential for effective implementation.""], ""new_actionPlan"": [""Specify detailed criteria for each age group to ensure accurate content filtering.""], ""new_thinking"": ""연령대에 따른 콘텐츠 노출 기준을 구체적으로 설정해야겠어."", ""evaluation"": {""sentences"": [{""sentence"": ""또한 연령대에 따라서 콘텐츠 노출을 바꾼다고 했는데 어떤 기준인지 더 구체적으로 말해주세요"", ""categories"": ""Question"", ""type"": ""Low-Level"", ""knowledge"": ""Clarify the criteria for content exposure based on age groups."", ""evaluation"": {""timely"": 5, ""relevance"": 6, ""high-level"": 2, ""specificity"": 0, ""justification"": 0, ""active"": 0, ""sentiment"": 0}}]}, ""response"": {""answer"": ""연령대 기준은 방송통신심의위원회의 연령 등급 지침을 참고하려 해요. 예를 들면, 0세부터 7세, 8세부터 12세 이런 식으로 나눌 수 있을 것 같아요.""}}","user_feedaback","2024-08-12 06:06:42","4"
"{""title"": ""Safeview - 아동 안전 콘텐츠 필터링 익스텐션"", ""problem"": ""현대 가정에서 아이들이 유튜브, 넷플릭스 등 다양한 스트리밍 플랫폼을 통해 콘텐츠를 접하는 것은 일상적인 일이 되었습니다. 그러나 이러한 플랫폼들에는 부적절한 콘텐츠가 포함되어 있어, 아이들이 이를 접할 위험이 존재합니다. 이로 인해 아동의 심리적, 정서적 건강 문제를 일으킬 수 있어, 효과적인 콘텐츠 필터링 도구가 절실하게 필요합니다."", ""idea"": ""Safeview는 부모들이 브라우저에 설치할 수 있는 익스텐션으로, 유튜브, 넷플릭스 등의 스트리밍 플랫폼에서 요구되는 연령대와 적합한 콘텐츠만을 노출시키도록 설계되었습니다. 이 익스텐션은 AI 기반의 분석 기술을 활용하여, 방송통신심의위원회 가이드라인 및 국제 아동 보호 기준에 근거한 콘텐츠 필터링 기준을 적용합니다. 예를 들어, 폭력, 선정성, 욕설 등의 요소를 포함하는 콘텐츠는 자동으로 차단됩니다. 부적절한 콘텐츠의 정의와 기준화를 위해 공신력있는 자료를 바탕으로 하여, 각 연령대별로 정밀하게 조정된 필터링 기준을 적용하여 0세부터 7세, 8세부터 12세 등 각 연령브라켓을 대상으로 맞춤형 필터링을 제공합니다. 부모는 익스텐션을 통해 이 설정들을 쉽게 조정할 수 있으며, 아이들이 적합한 콘텐츠만 접할 수 있도록 지원합니다.""}","update_idea","2024-08-12 06:07:07","4"
"","finish","2024-08-12 06:07:22","4"
"","start","2024-08-12 06:07:39","4"
"{""user_input"": ""입양대상이 되는 동물은 무엇이 있나요?"", ""category"": [{""sentence"": ""입양대상이 되는 동물은 무엇이 있나요?"", ""categories"": ""Question"", ""type"": ""Low-Level""}], ""new_knowledge"": [""Understanding the target audience is crucial for designing an effective service.""], ""new_actionPlan"": [""Clearly define the target audience for the service and tailor the design to meet their specific needs.""], ""new_thinking"": ""서비스의 타겟 대상을 명확히 정의하는 것이 중요하구나."", ""evaluation"": {""sentences"": [{""sentence"": ""입양대상이 되는 동물은 무엇이 있나요?"", ""categories"": ""Question"", ""type"": ""Low-Level"", ""knowledge"": ""Clarification on the types of animals available for adoption."", ""evaluation"": {""timely"": 5, ""relevance"": 4, ""high-level"": 1, ""specificity"": 0, ""justification"": 0, ""active"": 0, ""sentiment"": 0}}]}, ""response"": {""answer"": ""주로 개와 고양이를 입양 대상으로 생각하고 있습니다.""}}","user_feedaback","2024-08-12 06:08:55","4"
"{""user_input"": ""유기된 동물들을 위주로 진행하나요?"", ""category"": [{""sentence"": ""유기된 동물들을 위주로 진행하나요?"", ""categories"": ""Question"", ""type"": ""Low-Level""}], ""new_knowledge"": [""Considering the specific needs of different types of animals can enhance the effectiveness of a service.""], ""new_actionPlan"": [""Evaluate the specific needs and challenges of different types of animals to tailor the service accordingly.""], ""new_thinking"": ""다양한 동물의 특정 요구 사항을 고려하면 서비스의 효과를 높일 수 있겠어."", ""evaluation"": {""sentences"": [{""sentence"": ""유기된 동물들을 위주로 진행하나요?"", ""categories"": ""Question"", ""type"": ""Low-Level"", ""knowledge"": ""The mentor is asking if the platform focuses on abandoned animals."", ""evaluation"": {""timely"": 5, ""relevance"": 5, ""high-level"": 1, ""specificity"": 0, ""justification"": 0, ""active"": 0, ""sentiment"": 0}}]}, ""response"": {""answer"": ""네, 주로 유기된 동물들을 입양 대상으로 고려하고 있습니다.""}}","user_feedaback","2024-08-12 06:09:22","4"
"{""user_input"": ""입양대상이 되기 전 대상 동물들은 어떻게 보호, 관리되나요?"", ""category"": [{""sentence"": ""입양대상이 되기 전 대상 동물들은 어떻게 보호, 관리되나요?"", ""categories"": ""Question"", ""type"": ""Low-Level""}], ""new_knowledge"": [""Understanding the current care and management of the target animals can inform better service design.""], ""new_actionPlan"": [""Research how the target animals are currently being cared for and managed to identify areas for improvement in the service design.""], ""new_thinking"": ""입양 대상 동물들이 현재 어떻게 보살핌을 받고 관리되는지 이해하는 것이 중요하구나."", ""evaluation"": {""sentences"": [{""sentence"": ""입양대상이 되기 전 대상 동물들은 어떻게 보호, 관리되나요?"", ""categories"": ""Question"", ""type"": ""Low-Level"", ""knowledge"": ""The feedback asks about the protection and management of animals before they become eligible for adoption."", ""evaluation"": {""timely"": 5, ""relevance"": 4, ""high-level"": 1, ""specificity"": 0, ""justification"": 0, ""active"": 0, ""sentiment"": 0}}]}, ""response"": {""answer"": ""입양 전에는 보호소나 구조 단체와 협력하여 대상 동물들을 안전하게 보호하고, 건강 검진 및 필요한 치료를 제공하려 해요.""}}","user_feedaback","2024-08-12 06:09:57","4"
"{""user_input"": ""입양 희망자의 자격을 평가하는 것이 주 서비스인 것 같은데, 희망자들이 경제적 능력 평가, 가정방문 평가 등의 과정에서 기분이 나빠지거나 과하다고 생각하지는 않을까요?"", ""category"": [{""sentence"": ""입양 희망자의 자격을 평가하는 것이 주 서비스인 것 같은데,"", ""categories"": ""Statement"", ""type"": ""Evaluation""}, {""sentence"": ""희망자들이 경제적 능력 평가, 가정방문 평가 등의 과정에서 기분이 나빠지거나 과하다고 생각하지는 않을까요?"", ""categories"": ""Question"", ""type"": ""Deep Reasoning""}], ""new_knowledge"": [""Evaluating the qualifications of potential adopters is crucial for ensuring responsible pet ownership."", ""Evaluating the emotional readiness of potential adopters is as important as assessing their economic and environmental suitability.""], ""new_actionPlan"": [""Incorporate a thorough evaluation process to assess the qualifications and readiness of potential adopters."", ""Incorporate an emotional readiness assessment into the adoption process to ensure potential adopters are fully prepared for the responsibilities of pet ownership.""], ""new_thinking"": ""입양 희망자의 자격을 평가하는 것이 책임감 있는 반려동물 입양을 보장하는 데 중요하구나. 입양 희망자의 경제적, 환경적 적합성뿐만 아니라 정서적 준비 상태도 평가해야 해."", ""evaluation"": {""sentences"": [{""sentence"": ""입양 희망자의 자격을 평가하는 것이 주 서비스인 것 같은데,"", ""categories"": ""Statement"", ""type"": ""Evaluation"", ""knowledge"": ""The main service seems to be evaluating the qualifications of adoption applicants."", ""evaluation"": {""specificity"": 5, ""justification"": 4, ""active"": 3, ""sentiment"": 0}}, {""sentence"": ""희망자들이 경제적 능력 평가, 가정방문 평가 등의 과정에서 기분이 나빠지거나 과하다고 생각하지는 않을까요?"", ""categories"": ""Question"", ""type"": ""Deep Reasoning"", ""knowledge"": ""Applicants might feel uncomfortable or think the evaluations are excessive."", ""evaluation"": {""timely"": 5, ""relevance"": 5, ""high-level"": 5, ""sentiment"": 0}}]}, ""response"": {""answer"": ""네, 그럴 수도 있겠네요. 금융 평가나 가정방문 평가가 부담스러울 수 있겠죠. 그래도 반려동물의 잘못된 입양을 막기 위해서는 꼭 필요한 과정이라서, 최대한 친절하고 공정하게 진행해야겠어요.""}}","user_feedaback","2024-08-12 06:11:26","4"
"{""user_input"": ""반려동물을 키울 때 경제적 능혁, 동물에 대한 이해도가 꼭 필요하다는 사실이 일반 대중에게 잘 알려지지 않은 것 같아요. 입양 희망자에게 이런 사실을 알려주는 단계도 있나요?"", ""category"": [{""sentence"": ""반려동물을 키울 때 경제적 능혁, 동물에 대한 이해도가 꼭 필요하다는 사실이 일반 대중에게 잘 알려지지 않은 것 같아요."", ""categories"": ""Statement"", ""type"": ""Evaluation""}, {""sentence"": ""입양 희망자에게 이런 사실을 알려주는 단계도 있나요?"", ""categories"": ""Question"", ""type"": ""Low-Level""}], ""new_knowledge"": [""Communicating the importance of economic capability and understanding of pet care to the general public is essential."", ""Providing clear and transparent information to users can help manage their expectations and improve their experience.""], ""new_actionPlan"": [""Develop a communication strategy to effectively convey the importance of economic capability and understanding of pet care to potential adopters."", ""Ensure that all steps and requirements of the adoption process are clearly communicated to potential adopters to manage their expectations and reduce any potential discomfort.""], ""new_thinking"": ""경제적 능력과 반려동물 돌봄에 대한 이해의 중요성을 일반 대중에게 효과적으로 전달하는 것이 중요하구나. 입양 희망자에게 모든 절차와 요구사항을 명확하게 전달하는 것이 중요하구나."", ""evaluation"": {""sentences"": [{""sentence"": ""반려동물을 키울 때 경제적 능혁, 동물에 대한 이해도가 꼭 필요하다는 사실이 일반 대중에게 잘 알려지지 않은 것 같아요."", ""categories"": ""Statement"", ""type"": ""Evaluation"", ""knowledge"": ""General public may not be aware of the financial and understanding requirements for pet ownership."", ""evaluation"": {""specificity"": 5, ""justification"": 5, ""active"": 4, ""sentiment"": 0}}, {""sentence"": ""입양 희망자에게 이런 사실을 알려주는 단계도 있나요?"", ""categories"": ""Question"", ""type"": ""Low-Level"", ""knowledge"": ""Is there a stage to inform potential adopters about the financial and understanding requirements?"", ""evaluation"": {""timely"": 5, ""relevance"": 5, ""high-level"": 2, ""specificity"": 0, ""justification"": 0, ""active"": 0, ""sentiment"": 0}}]}, ""response"": {""answer"": ""네, 입양 전 온라인 교육 프로그램에 그런 내용을 포함할 거예요. 경제적 부담, 시간 관리, 동물의 기본적인 필요사항 등을 충분히 설명하려 합니다.""}}","user_feedaback","2024-08-12 06:12:15","4"
"{""question"": ""경제적 능력 평가나 가정방문 평가를 도입할 때, 입양 희망자들이 부담을 덜 느끼게 하는 방법이 있을까요?""}","student_question","2024-08-12 06:12:17","4"
"{""user_input"": ""반려동물을 키워보지 않은 사람들도 한번에 납득할 수 있게 공신력 있는 자료와 함께 설명하면 좋을 것 같아요. 또한 평가자가 충분히 전문성 있는 사람인지도 보여주어야 할 것 같아요."", ""category"": [{""sentence"": ""반려동물을 키워보지 않은 사람들도 한번에 납득할 수 있게 공신력 있는 자료와 함께 설명하면 좋을 것 같아요."", ""categories"": ""Statement"", ""type"": ""Recommendation""}, {""sentence"": ""또한 평가자가 충분히 전문성 있는 사람인지도 보여주어야 할 것 같아요."", ""categories"": ""Statement"", ""type"": ""Recommendation""}], ""new_knowledge"": [""Providing comprehensive and accessible information can help attract and educate potential users."", ""Ensuring evaluators are sufficiently qualified is crucial for maintaining the credibility of the evaluation process.""], ""new_actionPlan"": [""Develop a detailed and user-friendly information resource to educate potential adopters about pet care responsibilities."", ""Verify that evaluators have the necessary expertise and qualifications to assess potential adopters effectively.""], ""new_thinking"": ""포괄적이고 접근하기 쉬운 정보를 제공하면 잠재적인 사용자들을 끌어들이고 교육하는 데 도움이 될 수 있겠어. 평가자가 충분히 전문성을 갖추고 있는지 확인하는 것이 중요하구나."", ""evaluation"": {""sentences"": [{""sentence"": ""반려동물을 키워보지 않은 사람들도 한번에 납득할 수 있게 공신력 있는 자료와 함께 설명하면 좋을 것 같아요."", ""categories"": ""Statement"", ""type"": ""Recommendation"", ""knowledge"": ""Use credible sources to explain to those who have never raised pets."", ""evaluation"": {""specificity"": 5, ""justification"": 5, ""active"": 5, ""sentiment"": 1}}, {""sentence"": ""또한 평가자가 충분히 전문성 있는 사람인지도 보여주어야 할 것 같아요."", ""categories"": ""Statement"", ""type"": ""Recommendation"", ""knowledge"": ""Show that the evaluator is sufficiently professional."", ""evaluation"": {""specificity"": 4, ""justification"": 4, ""active"": 4, ""sentiment"": 1}}]}, ""response"": {""answer"": ""네, 그럴 것 같아요. 평가 과정에서 공신력 있는 자료나 통계를 제공하고, 평가자의 전문성을 강조하는 게 중요해요. 이런 방법으로 입양 희망자들이 평가를 더 신뢰하고 받아들일 수 있을 것 같아요.""}}","user_feedaback","2024-08-12 06:13:14","4"
"{""user_input"": ""계약서는 어떻게 구성되어있나요? 법적 효력이 있는 계약서인가요?"", ""category"": [{""sentence"": ""계약서는 어떻게 구성되어있나요?"", ""categories"": ""Question"", ""type"": ""Low-Level""}, {""sentence"": ""법적 효력이 있는 계약서인가요?"", ""categories"": ""Question"", ""type"": ""Low-Level""}], ""new_knowledge"": [""Ensuring clarity and comprehensiveness in documentation is essential for user understanding."", ""Ensuring legal effectiveness of agreements is crucial for maintaining trust and compliance.""], ""new_actionPlan"": [""Review and refine the adoption contract to ensure it is clear, comprehensive, and easily understandable for adopters."", ""Consult with legal experts to draft legally binding and effective agreements for the adoption process.""], ""new_thinking"": ""계약서는 입양자들이 쉽게 이해할 수 있도록 명확하고 포괄적으로 작성해야 해. 계약서의 법적 효력을 확실히 해야 신뢰와 준수를 유지할 수 있겠구나."", ""evaluation"": {""sentences"": [{""sentence"": ""계약서는 어떻게 구성되어있나요?"", ""categories"": ""Question"", ""type"": ""Low-Level"", ""knowledge"": ""The mentor is asking about the structure of the contract."", ""evaluation"": {""timely"": 5, ""relevance"": 5, ""high-level"": 1, ""specificity"": 0, ""justification"": 0, ""active"": 0, ""sentiment"": 0}}, {""sentence"": ""법적 효력이 있는 계약서인가요?"", ""categories"": ""Question"", ""type"": ""Low-Level"", ""knowledge"": ""The mentor is inquiring about the legal validity of the contract."", ""evaluation"": {""timely"": 5, ""relevance"": 5, ""high-level"": 1, ""specificity"": 0, ""justification"": 0, ""active"": 0, ""sentiment"": 0}}]}, ""response"": {""answer"": ""계약서는 동물의 건강 상태, 필요한 돌봄 사항, 그리고 입양자의 의무와 책임을 명시할 거예요. 법적 효력이 있도록 법률 자문을 받을 예정이에요.""}}","user_feedaback","2024-08-12 06:13:54","4"
"{""user_input"": ""법적 효력이 있다면 입양 희망자가 큰 부담을 느낄수도 있을 것 같아요. 왜 법적효력이 있도록 하고싶은 거죠?"", ""category"": [{""sentence"": ""법적 효력이 있다면 입양 희망자가 큰 부담을 느낄수도 있을 것 같아요."", ""categories"": ""Statement"", ""type"": ""Evaluation""}, {""sentence"": ""왜 법적효력이 있도록 하고싶은 거죠?"", ""categories"": ""Question"", ""type"": ""Deep Reasoning""}], ""new_knowledge"": [""Ensuring legal effectiveness of agreements can help mitigate user concerns."", ""Ensuring legal effectiveness of agreements is crucial for maintaining trust and compliance.""], ""new_actionPlan"": [""Consult with legal experts to ensure that all agreements are legally binding and clearly communicate this to potential adopters."", ""Consult with legal experts to draft agreements that are legally binding and clear to all parties involved.""], ""new_thinking"": ""법적 효력이 있으면 입양 희망자가 큰 부담을 느낄 수도 있겠구나. 계약서의 법적 효력이 신뢰와 준수를 유지하는 데 중요하구나."", ""evaluation"": {""sentences"": [{""sentence"": ""법적 효력이 있다면 입양 희망자가 큰 부담을 느낄수도 있을 것 같아요."", ""categories"": ""Statement"", ""type"": ""Evaluation"", ""knowledge"": ""Legal enforceability might cause significant stress for potential adopters."", ""evaluation"": {""specificity"": 5, ""justification"": 5, ""active"": 4, ""sentiment"": -1}}, {""sentence"": ""왜 법적효력이 있도록 하고싶은 거죠?"", ""categories"": ""Question"", ""type"": ""Deep Reasoning"", ""knowledge"": ""The mentor is inquiring about the rationale behind making the contract legally binding."", ""evaluation"": {""timely"": 5, ""relevance"": 5, ""high-level"": 5, ""sentiment"": 0}}]}, ""response"": {""answer"": ""법적 효력이 있는 계약서로 함으로써 입양자의 책임감을 더 확실히 할 수 있어요. 부주의한 입양을 방지하고, 정말로 동물을 돌볼 준비가 되어 있는 사람만이 입양할 수 있게 하는 게 목표입니다.""}}","user_feedaback","2024-08-12 06:15:19","4"
"{""user_input"": ""정기방문에 대해서도 이야기해보고 싶어요. 정기 방문은 누가 주체가 되는 것인가요? 어떤 절차로 구성되나요?"", ""category"": [{""sentence"": ""정기방문에 대해서도 이야기해보고 싶어요."", ""categories"": ""Statement"", ""type"": ""Evaluation""}, {""sentence"": ""정기 방문은 누가 주체가 되는 것인가요?"", ""categories"": ""Question"", ""type"": ""Low-Level""}, {""sentence"": ""어떤 절차로 구성되나요?"", ""categories"": ""Question"", ""type"": ""Low-Level""}], ""new_knowledge"": [""Regular follow-ups are essential for ensuring ongoing compliance and support."", ""Identifying the responsible party for regular check-ins is crucial for maintaining accountability."", ""Understanding the structure of a process is essential for clarity and efficiency.""], ""new_actionPlan"": [""Implement a system for regular follow-ups to monitor and support users continuously."", ""Clearly define and communicate who will be responsible for conducting regular check-ins with adopters."", ""Clearly define and document the structure of each step in the adoption process to ensure clarity and efficiency.""], ""new_thinking"": ""정기적인 팔로우업이 지속적인 준수와 지원을 보장하는 데 필수적이구나. 정기 방문은 누가 주체가 되는 것이 중요하구나. 과정의 구조를 명확히 이해하는 것이 중요하구나."", ""evaluation"": {""sentences"": [{""sentence"": ""정기방문에 대해서도 이야기해보고 싶어요."", ""categories"": ""Statement"", ""type"": ""Evaluation"", ""knowledge"": ""The mentor wants to discuss the regular visits aspect of the design."", ""evaluation"": {""specificity"": 4, ""justification"": 3, ""active"": 3, ""sentiment"": 0}}, {""sentence"": ""정기 방문은 누가 주체가 되는 것인가요?"", ""categories"": ""Question"", ""type"": ""Low-Level"", ""knowledge"": ""The mentor is asking who will be responsible for the regular visits."", ""evaluation"": {""timely"": 4, ""relevance"": 5, ""high-level"": 1, ""sentiment"": 0}}, {""sentence"": ""어떤 절차로 구성되나요?"", ""categories"": ""Question"", ""type"": ""Low-Level"", ""knowledge"": ""The mentor is asking about the procedures involved in the regular visits."", ""evaluation"": {""timely"": 4, ""relevance"": 5, ""high-level"": 1, ""sentiment"": 0}}]}, ""response"": {""answer"": ""정기 방문은 전문 상담사가 주체가 될 거예요. 주기적으로 가정 방문해서 반려동물의 건강과 생활 환경을 체크할 거예요. 절차는 사전 일정 조율, 현장 방문, 상담, 평가 순으로 진행됩니다.""}}","user_feedaback","2024-08-12 06:16:09","4"
"{""question"": ""정기 방문을 통해 반려동물의 건강과 생활 환경을 체크할 때, 평가자와 입양자가 신뢰 관계를 형성하는 데 도움이 될 만한 접근 방법이 있을까요?""}","student_question","2024-08-12 06:16:11","4"
