data,tag,timestamp,user_id
"{""user_input"": ""그렇다면 학생들이 확실히 체감할 수 있게 어떤 복지사업에 얼만큼 사용되었는지 알려주어야할 것 같아요. 또한 학생들이 원하는 사업에 사용해야되겠죠"", ""category"": [{""sentence"": ""그렇다면 학생들이 확실히 체감할 수 있게 어떤 복지사업에 얼만큼 사용되었는지 알려주어야할 것 같아요."", ""categories"": ""Statement"", ""type"": ""Recommendation""}, {""sentence"": ""또한 학생들이 원하는 사업에 사용해야되겠죠"", ""categories"": ""Statement"", ""type"": ""Recommendation""}], ""new_knowledge"": [""Communicate the tangible impact of the system to users."", ""Consider aligning the design with user preferences and needs.""], ""new_actionPlan"": [""Develop a communication strategy to inform users about the specific benefits and impacts of the system on sustainability and community welfare."", ""Conduct surveys or interviews to understand what services or features users would find beneficial and incorporate those into the design.""], ""new_thinking"": ""사용자들에게 시스템의 구체적인 혜택과 영향을 명확히 전달해야겠어. 사용자들이 원하는 서비스에 맞춰 디자인을 조정해야겠어."", ""evaluation"": {""sentences"": [{""sentence"": ""그렇다면 학생들이 확실히 체감할 수 있게 어떤 복지사업에 얼만큼 사용되었는지 알려주어야할 것 같아요."", ""categories"": ""Statement"", ""type"": ""Recommendation"", ""knowledge"": ""Students should be informed about how much of the saved electricity is used for welfare projects."", ""evaluation"": {""specificity"": 6, ""justification"": 5, ""active"": 6, ""sentiment"": 1}}, {""sentence"": ""또한 학생들이 원하는 사업에 사용해야되겠죠"", ""categories"": ""Statement"", ""type"": ""Recommendation"", ""knowledge"": ""The saved electricity should be used for projects that students want."", ""evaluation"": {""specificity"": 5, ""justification"": 4, ""active"": 5, ""sentiment"": 1}}]}, ""response"": {""answer"": ""네, 맞아요. 학생들이 원하는 복지사업에 투표를 통해 결정하고, 사용 내역을 투명하게 공개하면 참여 동기부여가 될 것 같아요.""}}","user_feedaback","2024-08-12 06:38:19","4"
"{""user_input"": ""그런데 아까 학생증 태깅을 통해 외출여부를 판단한다고 했어요. 개인정보 침해 문제는 생기지 않을까요? "", ""category"": [{""sentence"": ""그런데 아까 학생증 태깅을 통해 외출여부를 판단한다고 했어요."", ""categories"": ""Statement"", ""type"": ""Information""}, {""sentence"": ""개인정보 침해 문제는 생기지 않을까요?"", ""categories"": ""Question"", ""type"": ""Deep Reasoning""}], ""new_knowledge"": [""Consider the reliability of using access cards for system activation and deactivation."", ""Consider the privacy implications of your design.""], ""new_actionPlan"": [""Evaluate alternative methods for detecting room occupancy to ensure system reliability."", ""Evaluate the privacy concerns and ensure that the system complies with data protection regulations.""], ""new_thinking"": ""학생증 태그만으로 외출 여부를 판단하는 것이 신뢰할 수 있을까? 개인정보 침해 문제는 어떻게 해결할 수 있을까?"", ""evaluation"": {""sentences"": [{""sentence"": ""그런데 아까 학생증 태깅을 통해 외출여부를 판단한다고 했어요."", ""categories"": ""Statement"", ""type"": ""Information"", ""knowledge"": ""The system uses student ID tagging to determine if a student is out."", ""evaluation"": {""specificity"": 5, ""justification"": 4, ""active"": 3, ""sentiment"": 0}}, {""sentence"": ""개인정보 침해 문제는 생기지 않을까요?"", ""categories"": ""Question"", ""type"": ""Deep Reasoning"", ""knowledge"": ""There may be privacy concerns with using student ID tagging."", ""evaluation"": {""timely"": 6, ""relevance"": 7, ""high-level"": 5, ""specificity"": 0, ""justification"": 0, ""active"": 0, ""sentiment"": 0}}]}, ""response"": {""answer"": ""음, 그 부분은 좀 더 고민해봐야겠네요. 학생증 데이터는 출입 여부만 체크하는 용도로 최소한으로 사용하고, 외부로 유출되지 않도록 보안에 신경쓰면 좋을 것 같아요.""}}","user_feedaback","2024-08-12 06:38:56","4"
"{""user_input"": ""기숙사 방 주인이 아닌 다른 학생의 학생증으로는 에어컨을 켤 수 없나ㅏ요?"", ""category"": [{""sentence"": ""기숙사 방 주인이 아닌 다른 학생의 학생증으로는 에어컨을 켤 수 없나요?"", ""categories"": ""Question"", ""type"": ""Low-Level""}], ""new_knowledge"": [""Consider the potential for unauthorized use of the system.""], ""new_actionPlan"": [""Implement additional security measures to ensure only authorized users can control the system.""], ""new_thinking"": ""다른 학생의 학생증으로 에어컨을 조작할 수 있는 가능성도 고려해야겠어."", ""evaluation"": {""sentences"": [{""sentence"": ""기숙사 방 주인이 아닌 다른 학생의 학생증으로는 에어컨을 켤 수 없나요?"", ""categories"": ""Question"", ""type"": ""Low-Level"", ""knowledge"": ""The feedback questions whether a non-resident student's ID can control the air conditioner."", ""evaluation"": {""timely"": 5, ""relevance"": 4, ""high-level"": 1, ""specificity"": 0, ""justification"": 0, ""active"": 0, ""sentiment"": 0}}]}, ""response"": {""answer"": ""그럴 경우 방 주인만이 에어컨을 제어할 수 있도록 학생증을 방 디바이스와 연동하면 될 것 같아요. 다른 학생증으로는 에어컨이 작동하지 않게 하는 식이죠.""}}","user_feedaback","2024-08-12 06:39:31","4"
"{""title"": ""기숙사 탄소배출 저감 시스템"", ""problem"": ""기숙사의 공간에서 학생들이 전기세 부담이 없기 때문에 에어컨과 조명을 필요 이상으로 사용하는 문제가 있습니다. 이로 인해 과도한 에너지 소비와 탄소 배출이 발생하고 있습니다."", ""idea"": ""학생증을 활용하여 기숙사의 에어컨과 조명 제어 시스템을 구현하고자 합니다. 1. 학생들의 출입을 감지하여 불필요한 전력 소비를 절감합니다. 각 방에 출입할 때 학생이 학생증을 태깅하면, 에어컨과 조명이 자동으로 활성화되고, 방을 나설 때 자동으로 꺼집니다. 2. 전력 소비량을 모니터링할 수 있는 스마트 미터를 설치하여 각 방의 전력 사용량을 정밀하게 측정하고, 절감량에 따라 인센티브를 제공합니다. 예를 들어, 특정 비율 이상 전력을 절감한 학생에게는 학비의 일부를 할인해주는 제도를 마련합니다. 3. 분실된 학생증에 대비하여 임시 학생증을 발급하는 시스템과 출입카드를 분실한 경우에도 방에 출입할 수 있는 비상 절차를 수립합니다. 학생들의 동의를 얻어 이 시스템을 이용하는 대신, 절감된 에너지 비용은 학생들이 원하는 학교 복지 서비스에 재투자됩니다. 4. 학생들이 이 시스템의 혜택과 학교 커뮤니티에 미치는 긍정적인 영향을 쉽게 이해할 수 있도록 적극적인 커뮤니케이션을 진행합니다. 이 시스템은 학생들에게 직접적인 이익과 학교의 지속 가능한 발전을 동시에 도모하는 것을 목표로 합니다.""}","update_idea","2024-08-12 06:40:02","4"
"{""user_input"": ""학생증을 태깅하고 들어온 후 나갈때는 태깅하지 않으면 학생이 외출을 한것인지 안한것인지 구별하기 힘들지않나요?"", ""category"": [{""sentence"": ""학생증을 태깅하고 들어온 후 나갈때는 태깅하지 않으면 학생이 외출을 한것인지 안한것인지 구별하기 힘들지않나요?"", ""categories"": ""Question"", ""type"": ""Deep Reasoning""}], ""new_knowledge"": [""Consider the challenges in accurately detecting user presence and absence.""], ""new_actionPlan"": [""Explore alternative methods to reliably detect when users are present or absent in a room.""], ""new_thinking"": ""사용자의 존재 여부를 정확하게 감지하는 것이 어려울 수 있겠구나."", ""evaluation"": {""sentences"": [{""sentence"": ""학생증을 태깅하고 들어온 후 나갈때는 태깅하지 않으면 학생이 외출을 한것인지 안한것인지 구별하기 힘들지않나요?"", ""categories"": ""Question"", ""type"": ""Deep Reasoning"", ""knowledge"": ""It may be difficult to determine if a student has left the room if they do not tag their student ID when exiting."", ""evaluation"": {""timely"": 6, ""relevance"": 7, ""high-level"": 5, ""specificity"": 0, ""justification"": 0, ""active"": 0, ""sentiment"": 0}}]}, ""response"": {""answer"": ""음, 그럴 수도 있겠네요. 예를 들어 출입문에 센서를 설치해 문이 열리고 학생증 태깅이 없다면 자동으로 외출로 인식하게 만드는 방법도 있을 것 같아요.""}}","user_feedaback","2024-08-12 06:40:35","4"
"{""user_input"": ""휴게실이나 화장실등을 사용하는 경우에는 혼란이 생길 수 있지않을까요?"", ""category"": [{""sentence"": ""휴게실이나 화장실등을 사용하는 경우에는 혼란이 생길 수 있지않을까요?"", ""categories"": ""Question"", ""type"": ""Deep Reasoning""}], ""new_knowledge"": [""Consider the potential for confusion in shared or common spaces.""], ""new_actionPlan"": [""Develop a clear protocol for managing shared spaces to avoid confusion and ensure system effectiveness.""], ""new_thinking"": ""공용 공간에서는 혼란이 생길 수 있다는 점을 고려해야겠어."", ""evaluation"": {""sentences"": [{""sentence"": ""휴게실이나 화장실등을 사용하는 경우에는 혼란이 생길 수 있지않을까요?"", ""categories"": ""Question"", ""type"": ""Deep Reasoning"", ""knowledge"": ""Using common areas like restrooms or lounges might cause confusion in the system."", ""evaluation"": {""timely"": 6, ""relevance"": 6, ""high-level"": 5, ""specificity"": 0, ""justification"": 0, ""active"": 0, ""sentiment"": 0}}]}, ""response"": {""answer"": ""잠깐 나가는 경우도 감지할 수 있는 단기 타이머를 설정하는 건 어떨까요? 예를 들어, 10분 이상 방을 비웠을 때만 에어컨이 꺼지도록요.""}}","user_feedaback","2024-08-12 06:41:08","4"
"{""user_input"": ""휴게실에서 밥을 먹는 경우도 있으니 시간을 설정하는 것은 많은 혼란이 일어날 것 같아요."", ""category"": [{""sentence"": ""휴게실에서 밥을 먹는 경우도 있으니 시간을 설정하는 것은 많은 혼란이 일어날 것 같아요."", ""categories"": ""Statement"", ""type"": ""Evaluation""}], ""new_knowledge"": [""Consider the potential for confusion in shared or common spaces when implementing time-based controls.""], ""new_actionPlan"": [""Reevaluate the use of time-based controls and explore alternative methods to accurately detect user presence in shared or common spaces.""], ""new_thinking"": ""공용 공간에서 시간 기반 제어를 사용하면 혼란이 생길 수 있겠구나."", ""evaluation"": {""sentences"": [{""sentence"": ""휴게실에서 밥을 먹는 경우도 있으니 시간을 설정하는 것은 많은 혼란이 일어날 것 같아요."", ""categories"": ""Statement"", ""type"": ""Evaluation"", ""knowledge"": ""Setting a timer for short absences may cause confusion."", ""evaluation"": {""specificity"": 5, ""justification"": 5, ""active"": 3, ""sentiment"": -1}}]}, ""response"": {""answer"": ""음, 복잡하네요. 다른 방법으로는, 실내 센서를 설치해 일정 시간 동안 움직임이 없을 때 에어컨을 자동으로 꺼지게 하는 방법도 있을 것 같아요.""}}","user_feedaback","2024-08-12 06:41:49","4"
"{""user_input"": ""아니면 학생들이 자주 외출하는 특정시간대에 일괄적으로 에어컨을 끄고 방에 남아있는 학생이 에어컨을 다시 키게하는 방법은 어떤가요?"", ""category"": [{""sentence"": ""아니면 학생들이 자주 외출하는 특정시간대에 일괄적으로 에어컨을 끄고 방에 남아있는 학생이 에어컨을 다시 키게하는 방법은 어떤가요?"", ""categories"": ""Question"", ""type"": ""Generate Design""}], ""new_knowledge"": [""Consider the patterns of user behavior to optimize system activation and deactivation.""], ""new_actionPlan"": [""Analyze common times when users are likely to leave and return to their rooms to optimize the system's activation and deactivation schedules.""], ""new_thinking"": ""사용자 행동 패턴을 고려하여 시스템 활성화 및 비활성화 일정을 최적화해야겠어."", ""evaluation"": {""sentences"": [{""sentence"": ""아니면 학생들이 자주 외출하는 특정시간대에 일괄적으로 에어컨을 끄고 방에 남아있는 학생이 에어컨을 다시 키게하는 방법은 어떤가요?"", ""categories"": ""Question"", ""type"": ""Generate Design"", ""knowledge"": ""Consider turning off air conditioners at specific times when students are likely to be out and allowing those who remain to turn them back on."", ""evaluation"": {""timely"": 6, ""relevance"": 6, ""high-level"": 4, ""specificity"": 0, ""justification"": 0, ""active"": 0, ""sentiment"": 0}}]}, ""response"": {""answer"": ""좋은 아이디어 같아요! 학생들이 빈 방에 에어컨을 켜두는 걸 방지할 수 있겠네요. 다만, 계절이나 시험 기간 같은 변수들을 고려해 탄력적으로 운영하면 좋을 것 같아요.""}}","user_feedaback","2024-08-12 06:42:40","4"
"{""user_input"": ""네 기숙사 문 앞에 있는 게이트의 정보를 바탕으로 유연하게 조정하면 될 것 같아요"", ""category"": [{""sentence"": ""네 기숙사 문 앞에 있는 게이트의 정보를 바탕으로 유연하게 조정하면 될 것 같아요"", ""categories"": ""Statement"", ""type"": ""Recommendation""}], ""new_knowledge"": [""Consider the importance of clear and consistent communication in design implementation.""], ""new_actionPlan"": [""Ensure that all information related to the system's operation and benefits is clearly communicated to users.""], ""new_thinking"": ""시스템 운영과 혜택에 대한 정보를 명확하게 전달하는 것이 중요하구나."", ""evaluation"": {""sentences"": [{""sentence"": ""네 기숙사 문 앞에 있는 게이트의 정보를 바탕으로 유연하게 조정하면 될 것 같아요"", ""categories"": ""Statement"", ""type"": ""Recommendation"", ""knowledge"": ""Adjust the system flexibly based on the information from the gate in front of the dormitory room."", ""evaluation"": {""specificity"": 5, ""justification"": 4, ""active"": 5, ""sentiment"": 1}}]}, ""response"": {""answer"": ""네, 동감합니다. 게이트 정보를 활용하면 외출 여부 파악이 더 정확할 것 같아요. ""}}","user_feedaback","2024-08-12 06:43:07","4"
"{""title"": ""기숙사 탄소배출 저감 시스템"", ""problem"": ""기숙사에서 학생들이 전기세 부담이 없기 때문에 외출 시에도 에어컨을 하루 종일 켜둠으로써 과도한 에너지 소비가 발생합니다. 또한, 잠시 외출하는 경우에도 시스템이 방을 비웠다고 인식하여 에너지 사용에 혼란을 줄 수 있습니다."", ""idea"": ""1. 각 방에 실내 움직임을 감지하는 센서를 설치하여 사용자의 실제 존재 여부를 정확하게파악할 수 있도록 합니다. 이 센서는 일정 시간 동안 움직임이 감지되지 않을 시 자동으로 에어컨과 조명을 꺼서 에너지를 절약합니다. \n2. 공동 공간 관리를 위한 명확한 규약을 개발하여, 공용 공간 사용 시 시스템의 효율성을 보장하고 혼란을 방지합니다. 예를 들어, 공용 공간에는 짧은 시간 동안의 이용에도 서비스가 중단되지 않도록 설정합니다. \n3. 일정 시간 기반의 제어를 재평가하고 첨단 센서 기술을 활용하여 사용자의 실제 존재 여부만을 기준으로 시스템이 작동하도록 합니다. \n4. 학생들의 주요 외출 시간을 분석하여, 시스템의 활성화와 비활성화 시간을 최적화합니다. 예를 들어, 수업 시간이나 식사 시간 등에 맞추어 시스템의 작동 방식을 조정합니다. \n5. 시스템의 작동 원리와 학교 커뮤니티에 미치는 이점을 명확하고 투명하게 커뮤니케이션하여 학생들이 적극적으로 참여하도록 동기를 부여합니다. 사용된 에너지 절감 비용은 학생들이 투표로 선택한 학교 복지 사업에 사용되며, 해당 사업의 세부 사용 내역을 학생들에게 정기적으로 공개합니다.""}","update_idea","2024-08-12 06:44:17","4"
"{""user_input"": ""아니면 게이트 정보를 활용해서 방 주인들이 모두 나갔을 때는 에어컨이 꺼지고 한명이라도 들어오면 방의 에어컨이 켜지는 것은 어떤가요? "", ""category"": [{""sentence"": ""아니면 게이트 정보를 활용해서 방 주인들이 모두 나갔을 때는 에어컨이 꺼지고 한명이라도 들어오면 방의 에어컨이 켜지는 것은 어떤가요?"", ""categories"": ""Question"", ""type"": ""Generate Design""}], ""new_knowledge"": [""Consider using gate information to dynamically control system activation based on user presence.""], ""new_actionPlan"": [""Integrate gate information to ensure the system accurately detects when users leave or enter the dormitory.""], ""new_thinking"": ""게이트 정보를 활용해서 사용자의 출입 여부를 정확히 파악해야겠어."", ""evaluation"": {""sentences"": [{""sentence"": ""아니면 게이트 정보를 활용해서 방 주인들이 모두 나갔을 때는 에어컨이 꺼지고 한명이라도 들어오면 방의 에어컨이 켜지는 것은 어떤가요?"", ""categories"": ""Question"", ""type"": ""Generate Design"", ""knowledge"": ""Using gate information to control air conditioning based on room occupancy."", ""evaluation"": {""timely"": 6, ""relevance"": 7, ""high-level"": 5, ""specificity"": 0, ""justification"": 0, ""active"": 0, ""sentiment"": 1}}]}, ""response"": {""answer"": ""네, 게이트 정보를 활용해서 방 주인들이 모두 나갔을 때 에어컨이 자동으로 꺼지고, 한 명이라도 들어오면 자동으로 켜지는 방안도 괜찮을 것 같아요. 이렇게 하면 더 효율적으로 에너지를 절약할 수 있을 것 같아요. 말씀하신 대로 시스템의 정확성을 높이기 위해 게이트와 실내 센서 기술을 함께 활용하면 좋을 것 같습니다.""}}","user_feedaback","2024-08-12 06:44:59","4"
"{""user_input"": ""실내 센서는 사생활이 노출되는 것 같다는 느낌을 줄 수도 있을 것 같아요"", ""category"": [{""sentence"": ""실내 센서는 사생활이 노출되는 것 같다는 느낌을 줄 수도 있을 것 같아요"", ""categories"": ""Statement"", ""type"": ""Evaluation""}], ""new_knowledge"": [""Consider the potential for sensors to misinterpret environmental factors as user activity.""], ""new_actionPlan"": [""Evaluate and test the accuracy of sensors in detecting actual user presence versus environmental factors.""], ""new_thinking"": ""센서가 환경 요인을 사용자 활동으로 오인할 가능성을 고려해야겠어."", ""evaluation"": {""sentences"": [{""sentence"": ""실내 센서는 사생활이 노출되는 것 같다는 느낌을 줄 수도 있을 것 같아요"", ""categories"": ""Statement"", ""type"": ""Evaluation"", ""knowledge"": ""Indoor sensors might give a feeling of privacy invasion."", ""evaluation"": {""specificity"": 5, ""justification"": 4, ""active"": 3, ""sentiment"": -1}}]}, ""response"": {""answer"": ""실내 센서가 정말 사생활 침해로 느껴질 수 있겠네요. 그러면, 출입문이나 방 입구 쪽에만 센서를 설치해서 센싱 범위를 제한하는 게 좋을 것 같아요. 보안과 프라이버시를 동시에 고려할 수 있는 방법이죠.""}}","user_feedaback","2024-08-12 06:45:30","4"
"{""user_input"": ""좋아요 센서등과 같은 경우는 학생들도 익숙하니까 이와 비슷하다고 안내하면 될 것 같아요"", ""category"": [{""sentence"": ""좋아요 센서등과 같은 경우는 학생들도 익숙하니까"", ""categories"": ""Statement"", ""type"": ""Evaluation""}, {""sentence"": ""이와 비슷하다고 안내하면 될 것 같아요"", ""categories"": ""Statement"", ""type"": ""Recommendation""}], ""new_knowledge"": [""Consider the user acceptance and comfort when implementing sensor-based systems."", ""Ensure that the system's benefits are clearly communicated to users.""], ""new_actionPlan"": [""Ensure that the sensor-based system is designed to be unobtrusive and user-friendly to increase acceptance."", ""Develop a communication strategy to effectively convey the benefits of the system to users.""], ""new_thinking"": ""센서 기반 시스템을 구현할 때 사용자 수용성과 편안함을 고려해야겠어. 시스템의 혜택을 사용자에게 명확하게 전달해야겠어."", ""evaluation"": {""sentences"": [{""sentence"": ""좋아요 센서등과 같은 경우는 학생들도 익숙하니까"", ""categories"": ""Statement"", ""type"": ""Evaluation"", ""knowledge"": ""Students are familiar with sensors."", ""evaluation"": {""specificity"": 3, ""justification"": 2, ""active"": 2, ""sentiment"": 1}}, {""sentence"": ""이와 비슷하다고 안내하면 될 것 같아요"", ""categories"": ""Statement"", ""type"": ""Recommendation"", ""knowledge"": ""Informing students that the system is similar to familiar sensors might be effective."", ""evaluation"": {""specificity"": 3, ""justification"": 3, ""active"": 3, ""sentiment"": 1}}]}, ""response"": {""answer"": ""맞아요, 학생들에게 친숙한 센서들을 예로 들면 더 쉽게 이해할 수 있을 것 같아요. 그러면 더 많은 학생들이 이 시스템을 편안하게 받아들일 수 있겠죠.""}}","user_feedaback","2024-08-12 06:46:01","4"
"{""user_input"": ""학생들이 매년 여름 에어컨에 대해 불만을 내비치는 것 만큼 이 서비스의 필요성에 대해 확실하게 알려주어야할 것 같아요. 어떤식으로 안내할 예정인가요?"", ""category"": [{""sentence"": ""학생들이 매년 여름 에어컨에 대해 불만을 내비치는 것 만큼 이 서비스의 필요성에 대해 확실하게 알려주어야할 것 같아요."", ""categories"": ""Statement"", ""type"": ""Recommendation""}, {""sentence"": ""어떤식으로 안내할 예정인가요?"", ""categories"": ""Question"", ""type"": ""Generate Design""}], ""new_knowledge"": [""Clearly communicate the necessity and benefits of the design to the users."", ""Consider how to effectively communicate the system's functionality to users.""], ""new_actionPlan"": [""Develop a communication strategy to effectively convey the importance and advantages of the system to the users."", ""Develop a clear and engaging communication strategy to explain the system's functionality and benefits to users.""], ""new_thinking"": ""학생들에게 시스템의 필요성과 이점을 명확하게 전달해야겠어. 시스템의 기능을 사용자에게 효과적으로 전달하는 방법을 고민해야겠어."", ""evaluation"": {""sentences"": [{""sentence"": ""학생들이 매년 여름 에어컨에 대해 불만을 내비치는 것 만큼 이 서비스의 필요성에 대해 확실하게 알려주어야할 것 같아요."", ""categories"": ""Statement"", ""type"": ""Recommendation"", ""knowledge"": ""The necessity of the service should be clearly communicated to students."", ""evaluation"": {""specificity"": 5, ""justification"": 5, ""active"": 4, ""sentiment"": 0}}, {""sentence"": ""어떤식으로 안내할 예정인가요?"", ""categories"": ""Question"", ""type"": ""Generate Design"", ""knowledge"": ""The method of communication about the service needs to be clarified."", ""evaluation"": {""timely"": 5, ""relevance"": 5, ""high-level"": 4, ""specificity"": 0, ""justification"": 0, ""active"": 0, ""sentiment"": 0}}]}, ""response"": {""answer"": ""학생들에게 설문조사를 진행하고, 불편 사항과 개선 요구를 수집합니다. 이를 바탕으로 학생 커뮤니티 게시판과 SNS를 통해 시스템의 필요성과 효과를 알릴 계획입니다.""}}","user_feedaback","2024-08-12 06:46:51","4"
