data,tag,timestamp,user_id
"{""user_input"": ""입양자의 자격을 심사하던 평가자라면 쉽게 신뢰를 쌓을 수 있을거에요. 또한 평가자는 바꾸지 않고 오래 유지해야 입양자의 상황을 더 잘 이해할 수 있을 것이에요. 정기방문 평가 기준을 다 똑같이 적용하지 말고 입양자의 상황에 맞게 한다면 좋을 것 같은데 가능할까요?"", ""category"": [{""sentence"": ""입양자의 자격을 심사하던 평가자라면 쉽게 신뢰를 쌓을 수 있을거에요."", ""categories"": ""Statement"", ""type"": ""Evaluation""}, {""sentence"": ""또한 평가자는 바꾸지 않고 오래 유지해야 입양자의 상황을 더 잘 이해할 수 있을 것이에요."", ""categories"": ""Statement"", ""type"": ""Recommendation""}, {""sentence"": ""정기방문 평가 기준을 다 똑같이 적용하지 말고 입양자의 상황에 맞게 한다면 좋을 것 같은데 가능할까요?"", ""categories"": ""Question"", ""type"": ""Generate Design""}], ""new_knowledge"": [""Ensuring evaluators are sufficiently qualified is crucial for maintaining the credibility of the evaluation process."", ""Building long-term relationships with evaluators can enhance understanding of user situations."", ""Tailoring evaluation criteria to individual circumstances can improve the relevance and effectiveness of the assessment.""], ""new_actionPlan"": [""Ensure that evaluators have the necessary qualifications and expertise to conduct assessments credibly."", ""Develop strategies to ensure evaluators maintain long-term relationships with adopters to better understand their situations."", ""Consider customizing the evaluation criteria based on the specific circumstances of each adopter to ensure a more relevant and effective assessment process.""], ""new_thinking"": ""평가자가 충분한 자격을 갖추는 것이 평가 과정의 신뢰성을 유지하는 데 중요하구나. 평가자와의 장기적인 관계 형성이 입양자의 상황을 더 잘 이해하는 데 도움이 될 수 있겠구나. 평가 기준을 입양자의 상황에 맞게 조정하면 더 효과적일 수 있겠어."", ""evaluation"": {""sentences"": [{""sentence"": ""입양자의 자격을 심사하던 평가자라면 쉽게 신뢰를 쌓을 수 있을거에요."", ""categories"": ""Statement"", ""type"": ""Evaluation"", ""knowledge"": ""An evaluator who has previously assessed the adopter's qualifications can easily build trust."", ""evaluation"": {""specificity"": 5, ""justification"": 4, ""active"": 3, ""sentiment"": 1}}, {""sentence"": ""또한 평가자는 바꾸지 않고 오래 유지해야 입양자의 상황을 더 잘 이해할 수 있을 것이에요."", ""categories"": ""Statement"", ""type"": ""Recommendation"", ""knowledge"": ""Keeping the same evaluator for a long time helps in better understanding the adopter's situation."", ""evaluation"": {""specificity"": 5, ""justification"": 5, ""active"": 4, ""sentiment"": 1}}, {""sentence"": ""정기방문 평가 기준을 다 똑같이 적용하지 말고 입양자의 상황에 맞게 한다면 좋을 것 같은데 가능할까요?"", ""categories"": ""Question"", ""type"": ""Generate Design"", ""knowledge"": ""It might be beneficial to tailor regular visit evaluation criteria to the adopter's situation."", ""evaluation"": {""timely"": 5, ""relevance"": 5, ""high-level"": 4, ""sentiment"": 1}}]}, ""response"": {""answer"": ""네, 그럴 수 있도록 평가 기준을 입양자별 상황에 맞게 유연하게 적용할 계획이에요. 입양자의 생활 환경과 능력에 맞춘 맞춤형 지원을 제공할 수 있도록 노력할게요. 평가자가 지속적으로 같은 사람으로 유지되는 것도 반영하겠습니다.""}}","user_feedaback","2024-08-12 06:18:04","4"
"{""user_input"": ""입양자가 반려동물의 상태를 온라인으로 보고할 수 있다고 했는데 그럼 앱이나 웹사이트가 있는것인가요?"", ""category"": [{""sentence"": ""입양자가 반려동물의 상태를 온라인으로 보고할 수 있다고 했는데 그럼 앱이나 웹사이트가 있는것인가요?"", ""categories"": ""Question"", ""type"": ""Low-Level""}, {""sentence"": ""그럼 앱이나 웹사이트가 있는것인가요?"", ""categories"": ""Question"", ""type"": ""Feature Specification""}], ""new_knowledge"": [""Providing online tools for monitoring can enhance user engagement and accountability."", ""Providing a digital platform can enhance accessibility and user engagement.""], ""new_actionPlan"": [""Develop an app or website feature that allows adopters to report their pet's status regularly."", ""Develop a user-friendly app or website to facilitate the adoption process and provide ongoing support.""], ""new_thinking"": ""온라인 도구를 제공하면 사용자 참여와 책임감을 높일 수 있겠어. 디지털 플랫폼을 제공하면 접근성과 사용자 참여를 높일 수 있겠구나."", ""evaluation"": {""sentences"": [{""sentence"": ""입양자가 반려동물의 상태를 온라인으로 보고할 수 있다고 했는데 그럼 앱이나 웹사이트가 있는것인가요?"", ""categories"": ""Question"", ""type"": ""Low-Level"", ""knowledge"": ""The mentor is asking if there is an app or website for reporting the pet's status online."", ""evaluation"": {""timely"": 5, ""relevance"": 5, ""high-level"": 1, ""specificity"": 0, ""justification"": 0, ""active"": 0, ""sentiment"": 0}}, {""sentence"": ""그럼 앱이나 웹사이트가 있는것인가요?"", ""categories"": ""Question"", ""type"": ""Feature Specification"", ""knowledge"": ""The mentor is inquiring about the existence of an app or website."", ""evaluation"": {""timely"": 5, ""relevance"": 5, ""high-level"": 1, ""specificity"": 0, ""justification"": 0, ""active"": 0, ""sentiment"": 0}}]}, ""response"": {""answer"": ""네, 반려동물의 상태를 보고하기 위한 전용 앱과 웹사이트를 운영할 계획이에요. 입양자는 언제든지 쉽게 접근할 수 있도록 사용자 친화적으로 디자인할 겁니다.""}}","user_feedaback","2024-08-12 06:18:56","4"
"{""user_input"": ""어떤 문제들을 보고할 수 있나요?"", ""category"": [{""sentence"": ""어떤 문제들을 보고할 수 있나요?"", ""categories"": ""Question"", ""type"": ""Low-Level""}], ""new_knowledge"": [""Identifying potential issues early can help in designing more effective solutions.""], ""new_actionPlan"": [""Conduct a thorough analysis to identify potential issues that may arise in the service design.""], ""new_thinking"": ""잠재적인 문제를 미리 파악하는 것이 더 효과적인 솔루션을 설계하는 데 도움이 될 수 있겠어."", ""evaluation"": {""sentences"": [{""sentence"": ""어떤 문제들을 보고할 수 있나요?"", ""categories"": ""Question"", ""type"": ""Low-Level"", ""knowledge"": ""The mentor is asking about the types of issues that can be reported."", ""evaluation"": {""timely"": 5, ""relevance"": 5, ""high-level"": 1, ""specificity"": 0, ""justification"": 0, ""active"": 0, ""sentiment"": 0}}]}, ""response"": {""answer"": ""입양자는 반려동물의 건강 상태, 행동 변화, 돌봄의 어려움 등 다양한 문제를 보고할 수 있어요. 이렇게 하면 문제가 발생했을 때 신속하게 정보 공유하고 해결할 수 있어요.""}}","user_feedaback","2024-08-12 06:19:14","4"
"{""question"": ""온라인 교육 프로그램에서 입양 희망자에게 정보를 충분히 제공하는 것 외에도 감정적인 준비 상태를 누구와 어떻게 평가하는 것이 좋을 지 조언을 주실 수 있을까요?""}","student_question","2024-08-12 06:19:18","4"
"{""user_input"": ""감정적인 준비 상태가 정확히 어떤 것을 말하는 것일까요?"", ""category"": [{""sentence"": ""감정적인 준비 상태가 정확히 어떤 것을 말하는 것일까요?"", ""categories"": ""Question"", ""type"": ""Low-Level""}, {""sentence"": ""What does X mean?"", ""categories"": ""Question"", ""type"": ""Definition""}], ""new_knowledge"": [""Evaluating the emotional readiness of users is crucial for ensuring their suitability for a service."", ""Clarifying terminology is essential for effective communication.""], ""new_actionPlan"": [""Develop a method to assess the emotional readiness of potential adopters as part of the evaluation process."", ""Ensure all terms and concepts used in the design are clearly defined and understood by all stakeholders.""], ""new_thinking"": ""입양 희망자의 감정적 준비 상태를 평가하는 것이 중요하구나. 용어를 명확히 정의하는 것이 효과적인 소통에 필수적이구나."", ""evaluation"": {""sentences"": [{""sentence"": ""감정적인 준비 상태가 정확히 어떤 것을 말하는 것일까요?"", ""categories"": ""Question"", ""type"": ""Low-Level"", ""knowledge"": ""Clarification of emotional readiness is needed."", ""evaluation"": {""timely"": 5, ""relevance"": 5, ""high-level"": 1, ""specificity"": 0, ""justification"": 0, ""active"": 0, ""sentiment"": 0}}, {""sentence"": ""What does X mean?"", ""categories"": ""Question"", ""type"": ""Definition"", ""knowledge"": ""Clarification of a term is needed."", ""evaluation"": {""timely"": 5, ""relevance"": 5, ""high-level"": 1, ""specificity"": 0, ""justification"": 0, ""active"": 0, ""sentiment"": 0}}]}, ""response"": {""answer"": ""감정적인 준비 상태는 반려동물을 돌보는 데 필요한 감정적 안정성과 책임감을 뜻해요. 예를 들어, 스트레스 상황에서의 대응이나 돌봄의 지속성 같은 부분을 평가할 수 있을 것 같아요.""}}","user_feedaback","2024-08-12 06:19:52","4"
"{""user_input"": ""실제로 반려동물을 키우는 사람들의 경험담이 도움될 수 있을 것 같아요. 사람들이 흔히 생각하지 못하는 병원비 문제나 반려동물이 주는 단점들을 실감있게 알 수 있을 것이에요. 그럼에도 불구하고 반려동물이 주는 장점도 알 수있을것같아요"", ""category"": [{""sentence"": ""실제로 반려동물을 키우는 사람들의 경험담이 도움될 수 있을 것 같아요."", ""categories"": ""Statement"", ""type"": ""Recommendation""}, {""sentence"": ""사람들이 흔히 생각하지 못하는 병원비 문제나 반려동물이 주는 단점들을 실감있게 알 수 있을 것이에요."", ""categories"": ""Statement"", ""type"": ""Information""}, {""sentence"": ""그럼에도 불구하고 반려동물이 주는 장점도 알 수있을것같아요"", ""categories"": ""Statement"", ""type"": ""Information""}], ""new_knowledge"": [""Leveraging the experiences of current pet owners can provide valuable insights for new adopters."", ""Understanding the hidden challenges and costs associated with a service can improve user preparedness."", ""Understanding the benefits of pet ownership can enhance user engagement.""], ""new_actionPlan"": [""Incorporate testimonials or case studies from experienced pet owners into the educational materials to provide practical insights for new adopters."", ""Incorporate detailed information about hidden challenges and costs in the educational materials to better prepare users."", ""Include information about the benefits of pet ownership in the educational materials to motivate potential adopters.""], ""new_thinking"": ""현재 반려동물을 키우는 사람들의 경험담이 큰 도움이 될 수 있겠구나. 사람들이 흔히 생각하지 못하는 병원비 문제나 반려동물이 주는 단점들을 실감있게 알 수 있을 것이에요. 반려동물이 주는 장점도 알려주면 좋겠어."", ""evaluation"": {""sentences"": [{""sentence"": ""실제로 반려동물을 키우는 사람들의 경험담이 도움될 수 있을 것 같아요."", ""categories"": ""Statement"", ""type"": ""Recommendation"", ""knowledge"": ""Experience from actual pet owners can be helpful."", ""evaluation"": {""specificity"": 5, ""justification"": 4, ""active"": 5, ""sentiment"": 1}}, {""sentence"": ""사람들이 흔히 생각하지 못하는 병원비 문제나 반려동물이 주는 단점들을 실감있게 알 수 있을 것이에요."", ""categories"": ""Statement"", ""type"": ""Information"", ""knowledge"": ""People can realistically understand the issues like vet bills and downsides of owning pets."", ""evaluation"": {""specificity"": 5, ""justification"": 5, ""active"": 4, ""sentiment"": 1}}, {""sentence"": ""그럼에도 불구하고 반려동물이 주는 장점도 알 수있을것같아요"", ""categories"": ""Statement"", ""type"": ""Information"", ""knowledge"": ""Despite the downsides, people can also understand the benefits of owning pets."", ""evaluation"": {""specificity"": 4, ""justification"": 4, ""active"": 4, ""sentiment"": 1}}]}, ""response"": {""answer"": ""경험담을 통해 입양 준비와 감정적 안정성을 설득력 있게 전달할 수 있을 것 같아요. 병원비 문제나 부정적인 측면도 솔직히 알려주되, 반려동물이 주는 긍정적인 효과도 강조하면 될 것 같습니다.""}}","user_feedaback","2024-08-12 06:21:13","4"
"{""title"": ""Petit - 책임감 있는 반려동물 입양 플랫폼"", ""problem"": ""반려동물을 입양한 후 돌볼 능력이나 책임감이 부족해 유기동물로 전락하는 사례가 많은 문제를 해결하기 위해, 입양 과정에서 충분한 교육과 입양 준비 절차를 지원하고, 입양 후 지속적인 지원을 제공하는 서비스 개선이 필요합니다."", ""idea"": ""Petit은 반려동물 입양 과정을 개선하여 입양 전, 후의 종합적인 지원을 통해 입양자들이 반려동물을 책임지고 돌볼 수 있도록 돕습니다. 첫째, 반려동물의 종류와 특성에 맞춘 맞춤 교육을 포함하는 온라인 교육 프로그램을 개발하여 입양 희망자가 동물의 건강 관리, 행동 교정 방법 등을 학습할 수 있도록 합니다. 둘째, 입양 희망자의 경제적 상태, 거주 환경, 감정적 준비 상태를 평가하는 과정을 통합하여 입양자의 적합성을 종합적으로 평가합니다. 이 평가 과정은 전문적인 평가자가 관리하며, 입양자는 이 평가 과정을 통해 자신이 진정으로 준비되었는지 스스로 확인할 수 있습니다. 셋째, 법적 효력이 있는 계약서를 작성하여 입양 후의 의무와 책임을 명확히 합니다. 이 계약서는 입양자가 반려동물을 돌보는데 있어서 법적인 지원을 받을 수 있도록 구성됩니다. 넷째, 정기적인 방문 및 상황에 맞는 평가 기준을 적용하여 입양 후에도 지속적인 지원과 모니터링을 실시합니다. 다섯째, 전용 앱과 웹사이트를 통해 입양자가 반려동물의 상태를 정기적으로 보고할 수 있도록 하고, 이를 통해 문제가 발생했을 때 신속한 대책을 수립할 수 있게 합니다. 마지막으로, 교육 자료에는 실제 반려동물을 돌보는 사람들의 경험담을 포함하여, 입양 희망자가 현실적인 돌봄의 어려움과 기쁨을 모두 이해할 수 있도록 합니다.""}","update_idea","2024-08-12 06:21:50","4"
"{""user_input"": ""다른 입양 희망자와 교류할 수 있는 방법이 있으면 좋을 것 같은데 어떻게 생각하나요"", ""category"": [{""sentence"": ""다른 입양 희망자와 교류할 수 있는 방법이 있으면 좋을 것 같은데 어떻게 생각하나요"", ""categories"": ""Question"", ""type"": ""Generate Design""}], ""new_knowledge"": [""Facilitating peer interaction can enhance user experience and support.""], ""new_actionPlan"": [""Implement a feature that allows adopters to connect and share experiences with each other.""], ""new_thinking"": ""다른 입양 희망자와 교류할 수 있는 방법이 있으면 좋겠어."", ""evaluation"": {""sentences"": [{""sentence"": ""다른 입양 희망자와 교류할 수 있는 방법이 있으면 좋을 것 같은데 어떻게 생각하나요"", ""categories"": ""Question"", ""type"": ""Generate Design"", ""knowledge"": ""Considering ways for adopters to interact with each other could be beneficial."", ""evaluation"": {""timely"": 5, ""relevance"": 5, ""high-level"": 5, ""specificity"": 0, ""justification"": 0, ""active"": 0, ""sentiment"": 1}}]}, ""response"": {""answer"": ""좋은 생각인 것 같아요. 입양 희망자들이 커뮤니티를 통해 서로 경험을 공유하고, 조언을 얻을 수 있도록 포럼이나 채팅 기능을 추가하면 좋겠어요.""}}","user_feedaback","2024-08-12 06:22:34","4"
"{""user_input"": ""입양희망자가 자격을 갖춘 후에는 어떤식으로 반려동물과 매칭되나요?"", ""category"": [{""sentence"": ""입양희망자가 자격을 갖춘 후에는 어떤식으로 반려동물과 매칭되나요?"", ""categories"": ""Question"", ""type"": ""Low-Level""}], ""new_knowledge"": [""Understanding the post-adoption relationship between users and the service is crucial for long-term success.""], ""new_actionPlan"": [""Develop a strategy to maintain and support the relationship between adopters and the service after the adoption process.""], ""new_thinking"": ""입양 후에도 입양자와 서비스 간의 관계를 유지하는 것이 중요하구나."", ""evaluation"": {""sentences"": [{""sentence"": ""입양희망자가 자격을 갖춘 후에는 어떤식으로 반려동물과 매칭되나요?"", ""categories"": ""Question"", ""type"": ""Low-Level"", ""knowledge"": ""The mentor is asking about the process of matching qualified adopters with pets."", ""evaluation"": {""timely"": 5, ""relevance"": 5, ""high-level"": 1, ""specificity"": 0, ""justification"": 0, ""active"": 0, ""sentiment"": 0}}]}, ""response"": {""answer"": ""입양 희망자가 자격을 갖춘 후에는 그들의 생활 환경과 반려동물의 특성을 고려해 매칭합니다. 예를 들어, 활기찬 성격의 애완동물은 적극적인 라이프스타일을 가진 사람과, 조용한 성격의 동물은 침착한 성향의 사람과 매칭하는 식으로 진행될 거예요.""}}","user_feedaback","2024-08-12 06:23:05","4"
"{""user_input"": ""입양희망자가 선택할 수는 없나요"", ""category"": [{""sentence"": ""입양희망자가 선택할 수는 없나요"", ""categories"": ""Question"", ""type"": ""Generate Design""}], ""new_knowledge"": [""Providing options for users can enhance their engagement and satisfaction.""], ""new_actionPlan"": [""Incorporate a feature that allows adopters to choose from a variety of pets based on their preferences and lifestyle.""], ""new_thinking"": ""사용자에게 선택권을 제공하면 참여도와 만족도가 높아질 수 있겠어."", ""evaluation"": {""sentences"": [{""sentence"": ""입양희망자가 선택할 수는 없나요"", ""categories"": ""Question"", ""type"": ""Generate Design"", ""knowledge"": ""The mentor is asking if the adopters have the option to choose their pets."", ""evaluation"": {""timely"": 5, ""relevance"": 6, ""high-level"": 4, ""specificity"": 0, ""justification"": 0, ""active"": 0, ""sentiment"": 0}}]}, ""response"": {""answer"": ""입양 희망자가 선택할 수도 있어요. 반려동물의 특성을 바탕으로 추천 리스트를 제공하고, 그 중에서 선택할 수 있는 옵션을 주는 방향으로 생각하고 있어요.""}}","user_feedaback","2024-08-12 06:23:34","4"
"{""question"": ""입양 희망자가 반려동물을 선택할 때, 어떤 정보나 자료가 제공되면 선택 과정이 더 신뢰성 있게 느껴질까요?""}","student_question","2024-08-12 06:23:35","4"
"{""user_input"": ""단순히 성격등이 나와있는 프로필을 보기보다는 입양희망자와 반려동물이 직접 만나는 단계가 있었으면 좋겠어요. 실제로 살아있는 생명인만큼 직접 만나서 겪어보고 판단해야한다고 생각해요"", ""category"": [{""sentence"": ""단순히 성격등이 나와있는 프로필을 보기보다는 입양희망자와 반려동물이 직접 만나는 단계가 있었으면 좋겠어요."", ""categories"": ""Statement"", ""type"": ""Recommendation""}, {""sentence"": ""실제로 살아있는 생명인만큼 직접 만나서 겪어보고 판단해야한다고 생각해요"", ""categories"": ""Statement"", ""type"": ""Evaluation""}], ""new_knowledge"": [""Facilitating direct interaction between users and the service can enhance user engagement and satisfaction."", ""Direct interaction with the subject can provide valuable insights for decision-making.""], ""new_actionPlan"": [""Incorporate a stage in the adoption process where potential adopters can directly interact with the animals."", ""Incorporate opportunities for potential adopters to interact with animals before making a final decision.""], ""new_thinking"": ""입양 희망자와 반려동물이 직접 만나는 단계를 추가하면 사용자 참여와 만족도가 높아질 수 있겠어. 직접 만나서 경험해보는 것이 중요한가봐."", ""evaluation"": {""sentences"": [{""sentence"": ""단순히 성격등이 나와있는 프로필을 보기보다는 입양희망자와 반려동물이 직접 만나는 단계가 있었으면 좋겠어요."", ""categories"": ""Statement"", ""type"": ""Recommendation"", ""knowledge"": ""Direct interaction between adopters and pets is recommended."", ""evaluation"": {""specificity"": 6, ""justification"": 5, ""active"": 6, ""sentiment"": 1}}, {""sentence"": ""실제로 살아있는 생명인만큼 직접 만나서 겪어보고 판단해야한다고 생각해요"", ""categories"": ""Statement"", ""type"": ""Evaluation"", ""knowledge"": ""Direct interaction is necessary for making an informed decision about pet adoption."", ""evaluation"": {""specificity"": 5, ""justification"": 6, ""active"": 5, ""sentiment"": 1}}]}, ""response"": {""answer"": ""알겠습니다. 입양 희망자가 반려동물을 선택하기 전에 직접 만나는 기회를 제공하는 단계도 추가하면 좋겠어요. 실제로 만나서 서로의 성격과 호흡을 맞춰 보는 것이 중요하겠네요.""}}","user_feedaback","2024-08-12 06:24:46","4"
"{""user_input"": ""성격에 따라 매칭한다고 하였는데 반려동물의 성격은 어떻게 판단하나요?"", ""category"": [{""sentence"": ""성격에 따라 매칭한다고 하였는데 반려동물의 성격은 어떻게 판단하나요?"", ""categories"": ""Question"", ""type"": ""Low-Level""}, {""sentence"": ""반려동물의 성격은 어떻게 판단하나요?"", ""categories"": ""Question"", ""type"": ""Feature Specification""}], ""new_knowledge"": [""Understanding the criteria for evaluating characteristics is essential for making informed decisions."", ""Understanding the characteristics of the subject is crucial for making informed decisions.""], ""new_actionPlan"": [""Define clear criteria for evaluating the characteristics of the subjects involved in the service."", ""Develop a clear and detailed method for assessing the characteristics of the animals to ensure accurate matching with adopters.""], ""new_thinking"": ""평가 기준을 명확히 정의하는 것이 중요하구나. 반려동물의 성격을 정확히 파악하는 것이 중요하구나."", ""evaluation"": {""sentences"": [{""sentence"": ""성격에 따라 매칭한다고 하였는데 반려동물의 성격은 어떻게 판단하나요?"", ""categories"": ""Question"", ""type"": ""Low-Level"", ""knowledge"": ""The mentor is asking how the personality of the pet is assessed."", ""evaluation"": {""timely"": 5, ""relevance"": 5, ""high-level"": 1, ""specificity"": 0, ""justification"": 0, ""active"": 0, ""sentiment"": 0}}, {""sentence"": ""반려동물의 성격은 어떻게 판단하나요?"", ""categories"": ""Question"", ""type"": ""Feature Specification"", ""knowledge"": ""The mentor is inquiring about the method used to determine the pet's personality."", ""evaluation"": {""timely"": 5, ""relevance"": 5, ""high-level"": 1, ""specificity"": 0, ""justification"": 0, ""active"": 0, ""sentiment"": 0}}]}, ""response"": {""answer"": ""반려동물의 성격은 보호소와 협력하여 전문가들이 객관적으로 평가합니다. 동물의 행동 패턴, 반응 등을 관찰하고 기록하여 성격을 판단합니다.""}}","user_feedaback","2024-08-12 06:25:17","4"
