data,tag,timestamp,user_id
"{""user_input"": ""요즘에는 특정 종의 동물을 과시하고싶어하는 사람들이 많다고 들었어요. 특정 종만을 원하는 입양희망자는 어떻게 대처할것인가요?"", ""category"": [{""sentence"": ""요즘에는 특정 종의 동물을 과시하고싶어하는 사람들이 많다고 들었어요."", ""categories"": ""Statement"", ""type"": ""Information""}, {""sentence"": ""특정 종만을 원하는 입양희망자는 어떻게 대처할것인가요?"", ""categories"": ""Question"", ""type"": ""Generate Design""}], ""new_knowledge"": [""Understanding current trends and user preferences can inform better service design."", ""Understanding user preferences can help tailor the service to meet their needs.""], ""new_actionPlan"": [""Research current trends and user preferences to tailor the service to meet their needs."", ""Incorporate a feature that allows users to specify their preferred pet characteristics during the adoption process.""], ""new_thinking"": ""요즘에는 특정 종류의 동물을 과시하고 싶어하는 사람들이 많다고 들었어. 사용자의 선호도를 이해하면 서비스가 그들의 요구에 맞게 조정될 수 있겠구나."", ""evaluation"": {""sentences"": [{""sentence"": ""요즘에는 특정 종의 동물을 과시하고싶어하는 사람들이 많다고 들었어요."", ""categories"": ""Statement"", ""type"": ""Information"", ""knowledge"": ""Many people nowadays want to show off specific breeds of animals."", ""evaluation"": {""specificity"": 3, ""justification"": 2, ""active"": 1, ""sentiment"": 0}}, {""sentence"": ""특정 종만을 원하는 입양희망자는 어떻게 대처할것인가요?"", ""categories"": ""Question"", ""type"": ""Generate Design"", ""knowledge"": ""How to handle adopters who only want specific breeds."", ""evaluation"": {""timely"": 5, ""relevance"": 5, ""high-level"": 4, ""sentiment"": 0}}]}, ""response"": {""answer"": ""특정 종만을 원할 경우, 그 종에 대한 입양 조건을 더 엄격히 할 필요가 있어요. 과시용이 아닌 진지한 의도를 확인하기 위해 심층인터뷰와 추가 교육을 진행하는 것도 검토하세요.""}}","user_feedaback","2024-08-12 06:26:09","4"
"{""title"": ""Petit - 책임감 있는 반려동물 입양 플랫폼"", ""problem"": ""반려동물을 입양한 후에 돌볼 능력이나 책임감이 부족해 유기동물로 전락하는 문제가 많으며, 실제로 반려동물을 돌보는 과정에서 예상치 못한 비용과 시간 소모, 그리고 건강 관리 소홀로 인해 동물의 건강이 나빠져 돌봄을 포기하게 되는 것이 주요 원인입니다. 이러한 문제를 해결하기 위해 입양 과정에서 충분한 교육과 입양 준비 절차를 지원하고, 입양 후에도 지속적인 지원이 필요합니다."", ""idea"": ""Petit은 다음과 같은 방법으로 반려동물 입양 과정을 개선하여 입양 전, 후의 종합적인 지원을 통해 입양자들이 반려동물을 책임지고 돌볼 수 있도록 돕습니다. 첫째, 반려동물의 종류와 특성에 맞춘 맞춤 교육을 포함하는 온라인 교육 프로그램을 개발합니다. 둘째, 입양 희망자의 경제적 상태, 거주 환경, 감정적 준비 상태를 포괄적으로 평가합니다. 셋째, 법적 효력이 있는 계약서를 작성하여 입양 후의 의무와 책임을 명확히 합니다. 넷째, 입양자와 반려동물이 서로를 직접 만나볼 수 있는 기회를 제공하고, 입양 희망자들이 반려동물을 선택할 수 있는 방법을 다양화합니다. 입양자가 직접 반려동물과 상호작용하는 단계도 포함됩니다. 다섯째, 판단력 향상을 위해 실제 반려동물을 돌보는 사람들의 경험담을 포함하여 경제적, 감정적 부담과 반려동물이 주는 장점을 설명합니다. 여섯째, 입양자 간의 교류를 가능하게 하는 커뮤니티 기능을 추가하여 지속적인 지원과 경험 공유를 장려합니다. 마지막으로, 입양 후 정기적인 방문 및 상황에 맞는 평가를 통해 지속적인 모니터링을 실시하고 입양자와 반려동물 모두에게 최적의 상황을 제공할 수 있도록 노력합니다.""}","update_idea","2024-08-12 06:27:00","4"
"{""user_input"": ""유기된 동물을 케어하고, 전문인력을 섭외하여 입양 희망자를 평가하고 입양후에도 케어하려면 많은 자본이 필요할 것 같아요. petit의 수익구조는 이를 감당할 수 있을까요?"", ""category"": [{""sentence"": ""유기된 동물을 케어하고, 전문인력을 섭외하여 입양 희망자를 평가하고 입양후에도 케어하려면 많은 자본이 필요할 것 같아요."", ""categories"": ""Statement"", ""type"": ""Evaluation""}, {""sentence"": ""petit의 수익구조는 이를 감당할 수 있을까요?"", ""categories"": ""Question"", ""type"": ""Deep Reasoning""}], ""new_knowledge"": [""Ensuring the involvement of experts in both pre-adoption and post-adoption phases is crucial for maintaining the quality of care."", ""Understanding the financial structure of a service is crucial for its sustainability.""], ""new_actionPlan"": [""Collaborate with experts to provide comprehensive care and evaluation both before and after adoption."", ""Analyze and establish a clear financial structure for the service to ensure its sustainability.""], ""new_thinking"": ""입양 전후로 전문가의 참여가 중요하구나. 서비스의 재정 구조를 명확히 이해하는 것이 지속 가능성을 위해 중요하구나."", ""evaluation"": {""sentences"": [{""sentence"": ""유기된 동물을 케어하고, 전문인력을 섭외하여 입양 희망자를 평가하고 입양후에도 케어하려면 많은 자본이 필요할 것 같아요."", ""categories"": ""Statement"", ""type"": ""Evaluation"", ""knowledge"": ""The proposed service will require significant capital to care for abandoned animals, hire professionals to evaluate potential adopters, and provide post-adoption care."", ""evaluation"": {""specificity"": 6, ""justification"": 6, ""active"": 5, ""sentiment"": 0}}, {""sentence"": ""petit의 수익구조는 이를 감당할 수 있을까요?"", ""categories"": ""Question"", ""type"": ""Deep Reasoning"", ""knowledge"": ""The mentor is questioning whether the revenue model of Petit can support the significant capital required for the proposed services."", ""evaluation"": {""timely"": 6, ""relevance"": 7, ""high-level"": 5, ""sentiment"": 0}}]}, ""response"": {""answer"": ""네, 자본이 많이 필요하겠죠. Petit의 수익구조는 입양 수수료, 교육 프로그램 수강료, 그리고 후원 등을 통해 마련할 계획이에요. 또한 제휴된 동물 관련 제품과 서비스를 판매하여 추가 수익을 창출하려고 합니다.""}}","user_feedaback","2024-08-12 06:28:20","4"
"{""user_input"": ""최근 동물을 내세워 제품을 판매하다가 잠적한 사기꾼 등의 사례를 많이 봤어요. 동물은 어떻게 선정할 것인가요? "", ""category"": [{""sentence"": ""최근 동물을 내세워 제품을 판매하다가 잠적한 사기꾼 등의 사례를 많이 봤어요."", ""categories"": ""Statement"", ""type"": ""Information""}, {""sentence"": ""동물은 어떻게 선정할 것인가요?"", ""categories"": ""Question"", ""type"": ""Low-Level""}], ""new_knowledge"": [""Understanding current trends and user preferences can inform better service design."", ""Understanding the criteria for selecting subjects is crucial for making informed decisions.""], ""new_actionPlan"": [""Research current trends and user preferences to tailor the service design accordingly."", ""Clearly define and document the criteria for selecting subjects to ensure informed and consistent decision-making.""], ""new_thinking"": ""현재 트렌드와 사용자 선호도를 이해하면 더 나은 서비스 디자인을 할 수 있겠어. 선정 기준을 명확히 정의하고 문서화하는 것이 중요하구나."", ""evaluation"": {""sentences"": [{""sentence"": ""최근 동물을 내세워 제품을 판매하다가 잠적한 사기꾼 등의 사례를 많이 봤어요."", ""categories"": ""Statement"", ""type"": ""Information"", ""knowledge"": ""There have been many cases of scammers using animals to sell products and then disappearing."", ""evaluation"": {""specificity"": 5, ""justification"": 4, ""active"": 2, ""sentiment"": -1}}, {""sentence"": ""동물은 어떻게 선정할 것인가요?"", ""categories"": ""Question"", ""type"": ""Low-Level"", ""knowledge"": ""The method of selecting animals is questioned."", ""evaluation"": {""timely"": 3, ""relevance"": 4, ""high-level"": 1, ""sentiment"": 0}}]}, ""response"": {""answer"": ""동물을 선별할 때, 보호소와 구조 단체의 추천을 받을 계획이에요. 또한, 각 동물의 건강 상태와 성격을 면밀하게 평가하여 입양에 적합한 동물을 선정할 거예요.""}}","user_feedaback","2024-08-12 06:29:21","4"
"{""question"": ""최근 반려동물 입양과 관련된 새로운 트렌드나 기술이 있을까요?""}","student_question","2024-08-12 06:29:22","4"
"{""title"": ""Petit - 책임감 있는 반려동물 입양 플랫폼"", ""problem"": ""반려동물 입양 후 적절한 돌봄이 이루어지지 못해 유기동물로 전락하는 사례가 많습니다. 이는 입양 과정에서의 충분한 교육과 지원의 부재와 입양자의 준비 부족에서 기인합니다."", ""idea"": ""Petit은 입양 전후의 종합적인 지원과 체계적인 관리를 통해 반려동물과 입양자 모두에게 최적의 환경을 제공하고자 합니다. 첫째, 전문가와 협력하여 입양 전후로 종합적인 돌봄과 평가를 제공합니다. 이를 통해 반려동물의 건강과 입양자의 준비 상태를 철저히 관리하며, 문제가 발생했을 경우 즉시 해결할 수 있는 체계를 마련합니다. 둘째, 서비스의 지속 가능성을 보장하기 위해 명확한 재정 구조를 분석하고 설정합니다. 입양 수수료, 교육 프로그램 수강료, 후원금 및 관련 제품과 서비스 매출을 포함한 다각적인 수익 구조를 구성합니다. 셋째, 사용자의 현대적 경향과 선호도를 반영하여 서비스 디자인을 맞춤화합니다. 사용자 인터페이스를 직관적이고 접근성 높게 디자인하여 사용자가 쉽게 서비스를 이용할 수 있도록 합니다. 넷째, 입양 대상 동물을 선별할 때 명확하고 일관된 결정을 내릴 수 있도록 기준을 명확히 정리하고 문서화합니다. 이는 보호소와 구조 단체의 추천을 통해 선별된 건강하고 성격이 검증된 동물들을 대상으로 합니다. 이와 같은 체계적이고 포괄적인 접근 방식을 통해 Petit은 반려동물의 안정적인 입양을 도모하며, 입양자가 반려동물을 정성껏 돌볼 수 있는 준비를 철저히 갖출 수 있도록 돕고자 합니다.""}","update_idea","2024-08-12 06:30:09","4"
"","finish","2024-08-12 06:30:15","4"
"","start","2024-08-12 06:31:38","4"
"{""user_input"": ""학생증을 사용해서 에어컨과 전등을 제어한다는 것이 구체적으로 어떻게 진행되는 것인가요?"", ""category"": [{""sentence"": ""학생증을 사용해서 에어컨과 전등을 제어한다는 것이 구체적으로 어떻게 진행되는 것인가요?"", ""categories"": ""Question"", ""type"": ""Low-Level""}], ""new_knowledge"": [""Consider the practical implementation of your design idea.""], ""new_actionPlan"": [""Evaluate the feasibility and practicality of using student ID cards to control air conditioning and lighting systems.""], ""new_thinking"": ""내 디자인 아이디어가 실제로 어떻게 구현될 수 있을지 고려해야겠어."", ""evaluation"": {""sentences"": [{""sentence"": ""학생증을 사용해서 에어컨과 전등을 제어한다는 것이 구체적으로 어떻게 진행되는 것인가요?"", ""categories"": ""Question"", ""type"": ""Low-Level"", ""knowledge"": ""Clarification on the mechanism of controlling air conditioning and lights using student ID."", ""evaluation"": {""timely"": 5, ""relevance"": 6, ""high-level"": 2, ""specificity"": 0, ""justification"": 0, ""active"": 0, ""sentiment"": 0}}]}, ""response"": {""answer"": ""학생증을 리더기에 태그하면, 방의 에어컨과 전등이 상태를 감지하여 외출 시 자동으로 꺼지도록 프로그래밍됩니다. 출입문 센서와 학생증 데이터베이스를 연동해 외출 여부를 확인합니다.""}}","user_feedaback","2024-08-12 06:32:38","4"
"{""user_input"": ""대학교 기숙사를 대상으로 한 서비스인가요?"", ""category"": [{""sentence"": ""대학교 기숙사를 대상으로 한 서비스인가요?"", ""categories"": ""Question"", ""type"": ""Low-Level""}], ""new_knowledge"": [""Consider the specific target audience for your design.""], ""new_actionPlan"": [""Identify and analyze the specific needs and behaviors of the target audience for the service.""], ""new_thinking"": ""내 디자인의 대상이 누구인지 명확히 해야겠어."", ""evaluation"": {""sentences"": [{""sentence"": ""대학교 기숙사를 대상으로 한 서비스인가요?"", ""categories"": ""Question"", ""type"": ""Low-Level"", ""knowledge"": ""The feedback asks if the service targets university dormitories."", ""evaluation"": {""timely"": 5, ""relevance"": 5, ""high-level"": 1, ""specificity"": 0, ""justification"": 0, ""active"": 0, ""sentiment"": 0}}]}, ""response"": {""answer"": ""네, 대학교 기숙사를 대상으로 한 서비스입니다.""}}","user_feedaback","2024-08-12 06:33:08","4"
"{""user_input"": ""학생증을 잘 가지고 다니지 않거나 분실한 학생들은 어떻게 해야하나요?"", ""category"": [{""sentence"": ""학생증을 잘 가지고 다니지 않거나 분실한 학생들은 어떻게 해야하나요?"", ""categories"": ""Question"", ""type"": ""Generate Design""}], ""new_knowledge"": [""Consider potential issues with user compliance and system reliability.""], ""new_actionPlan"": [""Develop a strategy to address non-compliance and system failures, such as backup mechanisms or user education programs.""], ""new_thinking"": ""사용자 준수와 시스템 신뢰성 문제를 고려해야겠어."", ""evaluation"": {""sentences"": [{""sentence"": ""학생증을 잘 가지고 다니지 않거나 분실한 학생들은 어떻게 해야하나요?"", ""categories"": ""Question"", ""type"": ""Generate Design"", ""knowledge"": ""Consideration for students who may not carry or lose their ID cards."", ""evaluation"": {""timely"": 6, ""relevance"": 7, ""high-level"": 5, ""specificity"": 0, ""justification"": 0, ""active"": 0, ""sentiment"": 0}}]}, ""response"": {""answer"": ""출입시에만 필요한 거니까 분실 시에만 문제겠네요. 분실 시 학생증 재발급을 유도하는 방안이나 임시 출입증 발급 절차도 마련해야겠어요.""}}","user_feedaback","2024-08-12 06:33:34","4"
"{""user_input"": ""저는 실제로 지금 학생증을 분실했는데 한달정도 재발급을 하지 않고있어요. 필요성을 못느끼기 때문이죠. 이 서비스는 학교에게는 큰 도움이 되겠지만 학생들에게는 동기부여하기 힘들 것 같아요. 분실한 학생이 재발급하면서까지 이 서비스를 이용해야하는 이유가 무엇이죠?"", ""category"": [{""sentence"": ""저는 실제로 지금 학생증을 분실했는데 한달정도 재발급을 하지 않고있어요."", ""categories"": ""Statement"", ""type"": ""Information""}, {""sentence"": ""필요성을 못느끼기 때문이죠."", ""categories"": ""Statement"", ""type"": ""Information""}, {""sentence"": ""이 서비스는 학교에게는 큰 도움이 되겠지만 학생들에게는 동기부여하기 힘들 것 같아요."", ""categories"": ""Statement"", ""type"": ""Evaluation""}, {""sentence"": ""분실한 학생이 재발급하면서까지 이 서비스를 이용해야하는 이유가 무엇이죠?"", ""categories"": ""Question"", ""type"": ""Deep Reasoning""}], ""new_knowledge"": [""Consider the potential delays in system reactivation due to lost or unissued access cards."", ""Ensure that the system addresses the essential needs of the users."", ""Consider the balance between user convenience and system effectiveness."", ""Consider the user experience and potential challenges in using the system.""], ""new_actionPlan"": [""Develop a contingency plan for students who lose their access cards, ensuring minimal disruption to the system's functionality."", ""Evaluate the necessity and practicality of the system to ensure it meets the essential needs of the users."", ""Evaluate how the design can be adjusted to minimize inconvenience for users while maintaining its effectiveness."", ""Develop a user-friendly process for reissuing lost or forgotten access cards to ensure continuous service usage.""], ""new_thinking"": ""학생증 분실 시 시스템 재활성화에 지연이 발생할 수 있겠구나. 시스템이 사용자들의 필수적인 요구를 충족시키는지 평가해야겠어. 사용자 편의성과 시스템 효과성의 균형을 고려해야겠어. 사용자 경험과 시스템 사용 시 발생할 수 있는 잠재적인 문제를 고려해야겠어."", ""evaluation"": {""sentences"": [{""sentence"": ""저는 실제로 지금 학생증을 분실했는데 한달정도 재발급을 하지 않고있어요."", ""categories"": ""Statement"", ""type"": ""Information"", ""knowledge"": ""The mentor has lost their student ID and has not reissued it for a month."", ""evaluation"": {""specificity"": 5, ""justification"": 4, ""active"": 3, ""sentiment"": 0}}, {""sentence"": ""필요성을 못느끼기 때문이죠."", ""categories"": ""Statement"", ""type"": ""Information"", ""knowledge"": ""The mentor does not feel the need to reissue the student ID."", ""evaluation"": {""specificity"": 4, ""justification"": 4, ""active"": 2, ""sentiment"": 0}}, {""sentence"": ""이 서비스는 학교에게는 큰 도움이 되겠지만 학생들에게는 동기부여하기 힘들 것 같아요."", ""categories"": ""Statement"", ""type"": ""Evaluation"", ""knowledge"": ""The service may benefit the school but may not motivate students."", ""evaluation"": {""specificity"": 5, ""justification"": 5, ""active"": 4, ""sentiment"": -1}}, {""sentence"": ""분실한 학생이 재발급하면서까지 이 서비스를 이용해야하는 이유가 무엇이죠?"", ""categories"": ""Question"", ""type"": ""Deep Reasoning"", ""knowledge"": ""The mentor is questioning the motivation for students to reissue their ID to use the service."", ""evaluation"": {""timely"": 5, ""relevance"": 5, ""high-level"": 5, ""sentiment"": 0}}]}, ""response"": {""answer"": ""음, 그렇다면 학생들에게도 혜택이 돌아가게 만들어야 할 것 같아요. 예를 들어, 전기 절감에 기여한 만큼 소정의 장학금을 지급하거나, 기숙사 이용료를 할인해주는 방안을 도입하면 어떨까요.""}}","user_feedaback","2024-08-12 06:34:47","4"
"{""user_input"": ""어느정도의 할인일까요? "", ""category"": [{""sentence"": ""어느정도의 할인일까요?"", ""categories"": ""Question"", ""type"": ""Low-Level""}], ""new_knowledge"": [""Consider the potential benefits or incentives for users to adopt the system.""], ""new_actionPlan"": [""Identify and implement user incentives to encourage adoption and compliance with the system.""], ""new_thinking"": ""사용자들이 시스템을 채택하도록 유도할 혜택이나 인센티브를 고려해야겠어."", ""evaluation"": {""sentences"": [{""sentence"": ""어느정도의 할인일까요?"", ""categories"": ""Question"", ""type"": ""Low-Level"", ""knowledge"": ""The mentor is asking about the specific amount of discount."", ""evaluation"": {""timely"": 5, ""relevance"": 4, ""high-level"": 1, ""specificity"": 0, ""justification"": 0, ""active"": 0, ""sentiment"": 0}}]}, ""response"": {""answer"": ""할인율은 매달 전기 절감률에 따라 차등 적용하는 게 좋을 것 같습니다. 예를 들어, 10% 이상 절감하면 5% 할인, 20% 이상 절감하면 10% 할인을 제공하는 식으로요.""}}","user_feedaback","2024-08-12 06:35:12","4"
"{""user_input"": ""전기절감률은 어떻게 측정되나요?"", ""category"": [{""sentence"": ""전기절감률은 어떻게 측정되나요?"", ""categories"": ""Question"", ""type"": ""Low-Level""}], ""new_knowledge"": [""Consider how to measure and quantify the effectiveness of your design.""], ""new_actionPlan"": [""Develop a clear metric system to measure and report the energy savings achieved by the system.""], ""new_thinking"": ""내 디자인의 효과를 어떻게 측정하고 정량화할 수 있을까?"", ""evaluation"": {""sentences"": [{""sentence"": ""전기절감률은 어떻게 측정되나요?"", ""categories"": ""Question"", ""type"": ""Low-Level"", ""knowledge"": ""The mentor is asking about the method for measuring electricity savings."", ""evaluation"": {""timely"": 5, ""relevance"": 5, ""high-level"": 1, ""specificity"": 0, ""justification"": 0, ""active"": 0, ""sentiment"": 0}}]}, ""response"": {""answer"": ""각 방마다 전력 소비를 모니터링하는 스마트 미터를 설치해 측정할 수 있어요. 이 데이터를 기반으로 전기 절감률을 계산하는 방식을 생각하고 있어요.""}}","user_feedaback","2024-08-12 06:35:42","4"
"{""user_input"": ""그렇다면 기존에 쓰던 전력량과 서비스를 시행한 후 쓰는 전력량을 비교하여 각 방별로 전기절감률을 계산하는 것인가요?"", ""category"": [{""sentence"": ""그렇다면 기존에 쓰던 전력량과 서비스를 시행한 후 쓰는 전력량을 비교하여 각 방별로 전기절감률을 계산하는 것인가요?"", ""categories"": ""Question"", ""type"": ""Low-Level""}], ""new_knowledge"": [""Consider using historical data to measure the impact of your design.""], ""new_actionPlan"": [""Collect and analyze historical energy consumption data to establish a baseline for measuring the effectiveness of the new system.""], ""new_thinking"": ""기존의 전력 사용 데이터를 활용해 새로운 시스템의 효과를 측정해야겠어."", ""evaluation"": {""sentences"": [{""sentence"": ""그렇다면 기존에 쓰던 전력량과 서비스를 시행한 후 쓰는 전력량을 비교하여 각 방별로 전기절감률을 계산하는 것인가요?"", ""categories"": ""Question"", ""type"": ""Low-Level"", ""knowledge"": ""The feedback asks if the electricity savings rate will be calculated by comparing the electricity usage before and after implementing the service."", ""evaluation"": {""timely"": 5, ""relevance"": 5, ""high-level"": 1, ""specificity"": 0, ""justification"": 0, ""active"": 0, ""sentiment"": 0}}]}, ""response"": {""answer"": ""네, 맞습니다. 기존과 서비스 시행 후의 전력량을 비교해 방별로 절감률을 계산할 생각입니다.""}}","user_feedaback","2024-08-12 06:36:30","4"
"{""user_input"": ""학생들이 오히려 돈을 더 냈으니 전기를 더 막써도 된다는 식으로 생각할 수도 있을 것 같아요. 보상심리처럼요"", ""category"": [{""sentence"": ""학생들이 오히려 돈을 더 냈으니 전기를 더 막써도 된다는 식으로 생각할 수도 있을 것 같아요."", ""categories"": ""Statement"", ""type"": ""Evaluation""}, {""sentence"": ""보상심리처럼요"", ""categories"": ""Statement"", ""type"": ""Information""}], ""new_knowledge"": [""Consider the potential for users to perceive the system as a financial burden rather than a benefit."", ""Consider the psychological factors that influence user behavior.""], ""new_actionPlan"": [""Develop a communication strategy to clearly convey the financial and environmental benefits of the system to users."", ""Investigate how psychological incentives can be integrated into the design to encourage user compliance.""], ""new_thinking"": ""사용자들이 시스템을 재정적 부담으로 느낄 수 있다는 점을 고려해야겠어. 사용자 행동에 영향을 미치는 심리적 요인을 고려해야겠어."", ""evaluation"": {""sentences"": [{""sentence"": ""학생들이 오히려 돈을 더 냈으니 전기를 더 막써도 된다는 식으로 생각할 수도 있을 것 같아요."", ""categories"": ""Statement"", ""type"": ""Evaluation"", ""knowledge"": ""Students might think they can use more electricity because they paid more."", ""evaluation"": {""specificity"": 5, ""justification"": 5, ""active"": 4, ""sentiment"": -1}}, {""sentence"": ""보상심리처럼요"", ""categories"": ""Statement"", ""type"": ""Information"", ""knowledge"": ""This is similar to the concept of reward psychology."", ""evaluation"": {""specificity"": 3, ""justification"": 3, ""active"": 2, ""sentiment"": 0}}]}, ""response"": {""answer"": ""아, 그럴 수도 있겠네요. 그러면 보상을 주는 대신, 절감한 전기만큼을 학교 발전 기금이나 복지 사업 등에 사용되도록 안내하는 건 어떨까요? 학생들이 동참하는 이유를 더 명확히 하면 좋을 것 같아요.""}}","user_feedaback","2024-08-12 06:37:20","4"
