user_id,timestamp,tag,data
10,2024-08-12 12:12:32,start,
10,2024-08-12 12:14:52,user_feedaback,"{""user_input"": ""목표 문제가 사람들이 기다리는 과정과 많은 사람들과 함께 타면서 발생하는 부정적인 경험이 핵심인 것 같은데, 아이디어는 부정적인 경험을 개선하기보다는 탄소량에 집중하는 것 같아. 그래서 나는 목표 문제와 아이디어가 그렇게 잘 정렬되지 않는다는 인상을 받았어. 아이디어를 목표 문제인 기다리는 과정에서의 귀찮음, 많은 사람들과 이용하는 데서 나오는 불쾌감과 짜증에 좀 더 초점을 맞춰주면 어떨까?"", ""category"": [{""sentence"": ""목표 문제가 사람들이 기다리는 과정과 많은 사람들과 함께 타면서 발생하는 부정적인 경험이 핵심인 것 같은데,"", ""categories"": ""Statement"", ""type"": ""Evaluation""}, {""sentence"": ""아이디어는 부정적인 경험을 개선하기보다는 탄소량에 집중하는 것 같아."", ""categories"": ""Statement"", ""type"": ""Evaluation""}, {""sentence"": ""그래서 나는 목표 문제와 아이디어가 그렇게 잘 정렬되지 않는다는 인상을 받았어."", ""categories"": ""Statement"", ""type"": ""Evaluation""}, {""sentence"": ""아이디어를 목표 문제인 기다리는 과정에서의 귀찮음, 많은 사람들과 이용하는 데서 나오는 불쾌감과 짜증에 좀 더 초점을 맞춰주면 어떨까?"", ""categories"": ""Statement"", ""type"": ""Recommendation""}], ""new_knowledge"": [""Identifying the core problem is crucial for effective design solutions."", ""Designs should focus on addressing negative user experiences as well as promoting positive aspects."", ""Design ideas should be clearly aligned with the problem they aim to solve."", ""사용자 경험의 부정적인 측면을 해결하는 것이 중요하다.""], ""new_actionPlan"": [""Focus on addressing the core issues of waiting times and discomfort in crowded public transport to enhance user experience."", ""Identify and address the negative experiences users face with low-carbon transportation to improve overall user satisfaction."", ""Ensure that the design idea directly addresses the identified problem and clearly communicates how it solves it."", ""저탄소 교통 이용 시 발생하는 불편함을 줄이기 위한 해결책을 디자인에 포함시켜야 한다.""], ""new_thinking"": ""핵심 문제를 파악하는 것이 효과적인 디자인 솔루션을 위해 중요하구나. 디자인은 부정적인 사용자 경험을 해결하는 것과 긍정적인 측면을 홍보하는 것 모두에 집중해야 해. 디자인 아이디어는 해결하려는 문제와 명확히 일치해야 해. 사용자 경험의 부정적인 측면을 해결하는 것이 중요하구나."", ""evaluation"": {""sentences"": [{""sentence"": ""목표 문제가 사람들이 기다리는 과정과 많은 사람들과 함께 타면서 발생하는 부정적인 경험이 핵심인 것 같은데,"", ""categories"": ""Statement"", ""type"": ""Evaluation"", ""knowledge"": ""The core problem is the negative experience of waiting and traveling with many people."", ""evaluation"": {""specificity"": 6, ""justification"": 5, ""active"": 4, ""sentiment"": 0}}, {""sentence"": ""아이디어는 부정적인 경험을 개선하기보다는 탄소량에 집중하는 것 같아."", ""categories"": ""Statement"", ""type"": ""Evaluation"", ""knowledge"": ""The idea focuses on carbon reduction rather than improving negative experiences."", ""evaluation"": {""specificity"": 6, ""justification"": 5, ""active"": 4, ""sentiment"": 0}}, {""sentence"": ""그래서 나는 목표 문제와 아이디어가 그렇게 잘 정렬되지 않는다는 인상을 받았어."", ""categories"": ""Statement"", ""type"": ""Evaluation"", ""knowledge"": ""The problem and the idea do not seem well-aligned."", ""evaluation"": {""specificity"": 5, ""justification"": 5, ""active"": 3, ""sentiment"": 0}}, {""sentence"": ""아이디어를 목표 문제인 기다리는 과정에서의 귀찮음, 많은 사람들과 이용하는 데서 나오는 불쾌감과 짜증에 좀 더 초점을 맞춰주면 어떨까?"", ""categories"": ""Statement"", ""type"": ""Recommendation"", ""knowledge"": ""The idea should focus more on the inconvenience and discomfort of waiting and traveling with many people."", ""evaluation"": {""specificity"": 6, ""justification"": 5, ""active"": 6, ""sentiment"": 1}}]}, ""response"": {""answer"": ""목표 문제가 기다리는 귀찮음과 많은 사람들과 함께 타면서 발생하는 불쾌감이라는 점은 이해했어요. 그러면 교통수단의 실시간 혼잡도를 함께 보여주는 기능도 추가하면 어떨까요? 사람들이 덜 붐비는 시간이나 버스를 선택할 수 있게 도와주는 거죠.""}}"
10,2024-08-12 12:14:53,student_question,"{""question"": ""제가 실시간 혼잡도 기능을 추가한다고 했을 때, 어떤 구체적인 요소들에 주목해야 할까요? 사용자 경험을 개선하려면 어떤 것들을 고려해야 할지 궁금합니다.""}"
10,2024-08-12 12:16:57,user_feedaback,"{""user_input"": ""나도 바로 떠오르는 부분이 없어서, 일단 사람들이 왜 혼잡한 저탄소 교통에서 불쾌감을 느끼는지, 그 이유를 정리하면서 같이 생각해보자."", ""category"": [{""sentence"": ""일단 사람들이 왜 혼잡한 저탄소 교통에서 불쾌감을 느끼는지, 그 이유를 정리하면서 같이 생각해보자."", ""categories"": ""Question"", ""type"": ""Deep Reasoning""}], ""new_knowledge"": [""Understanding the reasons behind negative user experiences is essential for effective design improvements.""], ""new_actionPlan"": [""Analyze why users feel discomfort in crowded low-carbon transportation and incorporate solutions to address these issues.""], ""new_thinking"": ""사용자들이 왜 혼잡한 저탄소 교통에서 불쾌감을 느끼는지 이해하는 것이 중요하구나."", ""evaluation"": {""sentences"": [{""sentence"": ""일단 사람들이 왜 혼잡한 저탄소 교통에서 불쾌감을 느끼는지, 그 이유를 정리하면서 같이 생각해보자."", ""categories"": ""Question"", ""type"": ""Deep Reasoning"", ""knowledge"": ""Understanding the reasons behind discomfort in crowded low-carbon transportation is crucial."", ""evaluation"": {""timely"": 6, ""relevance"": 7, ""high-level"": 5, ""specificity"": 0, ""justification"": 0, ""active"": 0, ""sentiment"": 0}}]}, ""response"": {""answer"": ""혼잡한 교통에서 불쾌감을 느끼는 이유를 정리해보자면, 공간 부족, 소음, 냄새, 온도 문제, 개인 공간 침해 등이 있을 것 같아요. 이를 바탕으로 실시간 혼잡도를 보여주는 기능에서 어떤 부분에 주목할 수 있을까요? 예를 들어, 특정 시간대의 혼잡도 예측, 대중교통의 현재 상태, 승객 수 등을 시각화하는 방안을 생각해볼 수 있겠죠.""}}"
10,2024-08-12 12:19:39,user_feedaback,"{""user_input"": ""고려할 점으로 좋은 요소를 많이 제시한 것 같아. 그런데 사람들이 많이 사용하는 날씨 애플리케이션 같은 경우에도 여러 요소를 고려해서 불쾌지수나 미세먼지 수준(좋음, 보통, 나쁨) 같은 식으로 사람들이 대략적인 정도를 바로 알 수 있는 간단한 종합 지표를 제시하곤 하는데, 시각화를 한다면 첫 화면에서는 종합 지표로 한눈에 볼 수 있고 어떤 요소라 이 결과에 영향을 줬는지는 더 알아보고 싶은 사람들이 열람할 수 있는 형식이면 어떨까?"", ""category"": [{""sentence"": ""고려할 점으로 좋은 요소를 많이 제시한 것 같아."", ""categories"": ""Statement"", ""type"": ""Evaluation""}, {""sentence"": ""그런데 사람들이 많이 사용하는 날씨 애플리케이션 같은 경우에도 여러 요소를 고려해서 불쾌지수나 미세먼지 수준(좋음, 보통, 나쁨) 같은 식으로 사람들이 대략적인 정도를 바로 알 수 있는 간단한 종합 지표를 제시하곤 하는데,"", ""categories"": ""Statement"", ""type"": ""Information""}, {""sentence"": ""시각화를 한다면 첫 화면에서는 종합 지표로 한눈에 볼 수 있고 어떤 요소라 이 결과에 영향을 줬는지는 더 알아보고 싶은 사람들이 열람할 수 있는 형식이면 어떨까?"", ""categories"": ""Statement"", ""type"": ""Recommendation""}], ""new_knowledge"": [""Highlighting positive aspects can enhance user engagement."", ""Providing users with simple and comprehensive indicators can help them quickly understand complex information."", ""Visualizing data effectively can enhance user engagement and understanding.""], ""new_actionPlan"": [""Emphasize the benefits of using low-carbon transportation in the design."", ""Develop a simple and comprehensive indicator system to show users the current state of public transportation, including factors like crowding and comfort levels."", ""Consider how to visually present the information about carbon savings and real-time congestion to make it easily understandable and engaging for users.""], ""new_thinking"": ""긍정적인 측면을 강조하면 사용자 참여를 높일 수 있겠구나. 사용자에게 간단하고 종합적인 지표를 제공하면 복잡한 정보를 빠르게 이해할 수 있겠구나. 데이터를 효과적으로 시각화하면 사용자 참여와 이해도를 높일 수 있겠구나!"", ""evaluation"": {""sentences"": [{""sentence"": ""고려할 점으로 좋은 요소를 많이 제시한 것 같아."", ""categories"": ""Statement"", ""type"": ""Evaluation"", ""knowledge"": ""The student has suggested many good elements to consider."", ""evaluation"": {""specificity"": 3, ""justification"": 3, ""active"": 2, ""sentiment"": 1}}, {""sentence"": ""그런데 사람들이 많이 사용하는 날씨 애플리케이션 같은 경우에도 여러 요소를 고려해서 불쾌지수나 미세먼지 수준(좋음, 보통, 나쁨) 같은 식으로 사람들이 대략적인 정도를 바로 알 수 있는 간단한 종합 지표를 제시하곤 하는데,"", ""categories"": ""Statement"", ""type"": ""Information"", ""knowledge"": ""Weather applications often provide simple composite indicators like discomfort index or air quality levels."", ""evaluation"": {""specificity"": 4, ""justification"": 4, ""active"": 2, ""sentiment"": 1}}, {""sentence"": ""시각화를 한다면 첫 화면에서는 종합 지표로 한눈에 볼 수 있고 어떤 요소라 이 결과에 영향을 줬는지는 더 알아보고 싶은 사람들이 열람할 수 있는 형식이면 어떨까?"", ""categories"": ""Statement"", ""type"": ""Recommendation"", ""knowledge"": ""A visualization could start with a composite indicator on the main screen, with detailed elements available for further exploration."", ""evaluation"": {""specificity"": 5, ""justification"": 5, ""active"": 5, ""sentiment"": 1}}]}, ""response"": {""answer"": ""불쾌지수처럼 간단한 종합 지표 형태로 정보를 제공하는 것도 좋겠네요. 첫 화면에서는 종합 지표로 혼잡도를 한눈에 볼 수 있게 하고, 세부 사항은 더 알아보고 싶은 사람들이 열람할 수 있게 하면 편리할 것 같아요.""}}"
10,2024-08-12 12:20:49,user_feedaback,"{""user_input"": ""맞아, 사용자에게 한 화면에 너무 많은 정보를 담으면 피로감이 심하니까 그런 부분에서 신경쓰면 사용자 경험에도 좋은 영향을 주는 것 같아."", ""category"": [{""sentence"": ""맞아, 사용자에게 한 화면에 너무 많은 정보를 담으면 피로감이 심하니까 그런 부분에서 신경쓰면 사용자 경험에도 좋은 영향을 주는 것 같아."", ""categories"": ""Statement"", ""type"": ""Recommendation""}], ""new_knowledge"": [""Providing too much information on a single screen can overwhelm users.""], ""new_actionPlan"": [""Ensure that the design presents information in a clear and concise manner, avoiding information overload on a single screen.""], ""new_thinking"": ""한 화면에 너무 많은 정보를 담으면 사용자에게 피로감을 줄 수 있구나."", ""evaluation"": {""sentences"": [{""sentence"": ""맞아, 사용자에게 한 화면에 너무 많은 정보를 담으면 피로감이 심하니까 그런 부분에서 신경쓰면 사용자 경험에도 좋은 영향을 주는 것 같아."", ""categories"": ""Statement"", ""type"": ""Recommendation"", ""knowledge"": ""Providing too much information on one screen can cause user fatigue, so it's important to manage this for a better user experience."", ""evaluation"": {""specificity"": 5, ""justification"": 5, ""active"": 4, ""sentiment"": 1}}]}, ""response"": {""answer"": ""사용자 경험 측면에서 좋은 방향인 것 같아요. 시각적으로도 깔끔하게 구성이 가능할 거예요. 혼잡지수를 단계별로 색상으로 표현하면 직관적으로 이해하기 쉬울 듯해요.""}}"
10,2024-08-12 12:22:44,user_feedaback,"{""user_input"": ""그리고 동건이 네가 처음 제시한 아이디어는 사람들의 불쾌감을 완화하는 것 외에도, 이 서비스를 통해 저탄소 교통을 이용함으로써 사람들이 환경에 기여하는 정도를 시각화 자료로 직접 체감할 수 있도록 해서 사람들이 더 적극적으로 저탄소 교통을 이용할 수 있도록 독려하는 것 같은데 내가 이해한 게 적절할까?"", ""category"": [{""sentence"": ""그리고 동건이 네가 처음 제시한 아이디어는 사람들의 불쾌감을 완화하는 것 외에도, 이 서비스를 통해 저탄소 교통을 이용함으로써 사람들이 환경에 기여하는 정도를 시각화 자료로 직접 체감할 수 있도록 해서 사람들이 더 적극적으로 저탄소 교통을 이용할 수 있도록 독려하는 것 같은데"", ""categories"": ""Question"", ""type"": ""Verification""}, {""sentence"": ""내가 이해한 게 적절할까?"", ""categories"": ""Question"", ""type"": ""Judgmental""}], ""new_knowledge"": [""Designs should not only address negative experiences but also emphasize the positive impact on the environment."", ""Ensuring that the design is well understood by others is crucial for effective communication.""], ""new_actionPlan"": [""Incorporate features that allow users to visualize their positive environmental impact when using low-carbon transportation."", ""Review the design idea to ensure it is clearly articulated and easily understandable by others.""], ""new_thinking"": ""부정적인 경험을 해결하는 것뿐만 아니라 환경에 긍정적인 영향을 강조하는 것도 중요하구나. 내 디자인이 다른 사람들에게 잘 이해될 수 있도록 명확하게 설명하는 것이 중요하구나."", ""evaluation"": {""sentences"": [{""sentence"": ""그리고 동건이 네가 처음 제시한 아이디어는 사람들의 불쾌감을 완화하는 것 외에도, 이 서비스를 통해 저탄소 교통을 이용함으로써 사람들이 환경에 기여하는 정도를 시각화 자료로 직접 체감할 수 있도록 해서 사람들이 더 적극적으로 저탄소 교통을 이용할 수 있도록 독려하는 것 같은데"", ""categories"": ""Question"", ""type"": ""Verification"", ""knowledge"": ""The idea aims to reduce discomfort and visualize environmental contributions to encourage low-carbon transport use."", ""evaluation"": {""timely"": 6, ""relevance"": 7, ""high-level"": 5, ""specificity"": 0, ""justification"": 0, ""active"": 0, ""sentiment"": 1}}, {""sentence"": ""내가 이해한 게 적절할까?"", ""categories"": ""Question"", ""type"": ""Judgmental"", ""knowledge"": ""The mentor seeks confirmation of their understanding of the student's idea."", ""evaluation"": {""timely"": 6, ""relevance"": 7, ""high-level"": 5, ""specificity"": 0, ""justification"": 0, ""active"": 0, ""sentiment"": 1}}]}, ""response"": {""answer"": ""네, 맞습니다. 저탄소 교통을 탐으로써 절약한 탄소량을 시각화하여 사람들이 환경에 기여하는 정도를 체감하게 만드는 것이 목표입니다.""}}"
10,2024-08-12 12:25:37,user_feedaback,"{""user_input"": ""그 부분에서 사람들이 '내가 저탄소 교통을 이용하는 게 이런 도움이 되는구나'라는 게 더 체감이 되려면, 단순 탄소량 수치보다는 1인당 발생 탄소량이 내가 저탄소 교통을 이용해서 줄인 만큼 감소했을 때 사람들의 일상에 미치는 변화로 비유하면 더 체감하기 좋을 것 같아. 연평균 기온에 기여할 수 있는 정도라던지, 여름 열대야 기간이 감소하는 정도라던지, 태풍이 줄어드는 정도, 모기 수 같은 것 말이야. 너는 어떻게 생각해?"", ""category"": [{""sentence"": ""그 부분에서 사람들이 '내가 저탄소 교통을 이용하는 게 이런 도움이 되는구나'라는 게 더 체감이 되려면, 단순 탄소량 수치보다는 1인당 발생 탄소량이 내가 저탄소 교통을 이용해서 줄인 만큼 감소했을 때 사람들의 일상에 미치는 변화로 비유하면 더 체감하기 좋을 것 같아."", ""categories"": ""Statement"", ""type"": ""Recommendation""}, {""sentence"": ""연평균 기온에 기여할 수 있는 정도라던지, 여름 열대야 기간이 감소하는 정도라던지, 태풍이 줄어드는 정도, 모기 수 같은 것 말이야."", ""categories"": ""Statement"", ""type"": ""Recommendation""}, {""sentence"": ""너는 어떻게 생각해?"", ""categories"": ""Question"", ""type"": ""Judgmental""}], ""new_knowledge"": [""Designs should emphasize the personal impact of using eco-friendly options to enhance user engagement."", ""Providing users with contextual information can enhance their decision-making process."", ""Asking questions can help clarify and refine design ideas.""], ""new_actionPlan"": [""Incorporate features that highlight the personal environmental impact of using low-carbon transportation to make the benefits more relatable to users."", ""Incorporate contextual information such as average temperature, seasonal changes, and weather conditions to help users make informed decisions."", ""Reflect on the mentor's questions to identify areas of improvement and ensure the design aligns with the core problem.""], ""new_thinking"": ""디자인은 친환경 옵션을 사용하는 개인적인 영향을 강조해야 사용자 참여를 높일 수 있다. 사용자에게 상황에 맞는 정보를 제공하면 의사결정에 도움이 될 수 있겠구나. 질문을 통해 디자인 아이디어를 명확히 하고 개선할 수 있겠어."", ""evaluation"": {""sentences"": [{""sentence"": ""그 부분에서 사람들이 '내가 저탄소 교통을 이용하는 게 이런 도움이 되는구나'라는 게 더 체감이 되려면, 단순 탄소량 수치보다는 1인당 발생 탄소량이 내가 저탄소 교통을 이용해서 줄인 만큼 감소했을 때 사람들의 일상에 미치는 변화로 비유하면 더 체감하기 좋을 것 같아."", ""categories"": ""Statement"", ""type"": ""Recommendation"", ""knowledge"": ""비유를 통해 저탄소 교통 이용의 효과를 체감하게 할 수 있다."", ""evaluation"": {""specificity"": 6, ""justification"": 6, ""active"": 5, ""sentiment"": 1}}, {""sentence"": ""연평균 기온에 기여할 수 있는 정도라던지, 여름 열대야 기간이 감소하는 정도라던지, 태풍이 줄어드는 정도, 모기 수 같은 것 말이야."", ""categories"": ""Statement"", ""type"": ""Recommendation"", ""knowledge"": ""저탄소 교통 이용의 효과를 다양한 환경적 변화로 비유할 수 있다."", ""evaluation"": {""specificity"": 6, ""justification"": 5, ""active"": 5, ""sentiment"": 1}}, {""sentence"": ""너는 어떻게 생각해?"", ""categories"": ""Question"", ""type"": ""Judgmental"", ""knowledge"": ""질문을 통해 학생의 의견을 묻고 있다."", ""evaluation"": {""timely"": 5, ""relevance"": 5, ""high-level"": 4, ""sentiment"": 0}}]}, ""response"": {""answer"": ""정말 좋은 생각이에요. '줄어든 탄소량 = 얼마나 많은 나무를 심은 것과 같은 효과' 같은 예시로 비유하면 사용자에게 더 와닿을 것 같아요. 실제 일상에서 느낄 수 있는 변화를 통해 동기부여가 더 강해질 것 같아요.""}}"
10,2024-08-12 12:26:48,user_feedaback,"{""user_input"": ""일단 내가 당장 생각한 예시는 앞에서 언급한 연평균 기온, 열대야 기간 변화, 태풍 같은 게 있는데, 동건이 너는 혹시 떠오르는 예시가 있어? 다양한 후보를 만들고 점차 좁혀나가면 더 좋은 지표를 만들 수 있을 것 같아서!"", ""category"": [{""sentence"": ""일단 내가 당장 생각한 예시는 앞에서 언급한 연평균 기온, 열대야 기간 변화, 태풍 같은 게 있는데,"", ""categories"": ""Statement"", ""type"": ""Information""}, {""sentence"": ""동건이 너는 혹시 떠오르는 예시가 있어?"", ""categories"": ""Question"", ""type"": ""Generate Design""}, {""sentence"": ""다양한 후보를 만들고 점차 좁혀나가면 더 좋은 지표를 만들 수 있을 것 같아서!"", ""categories"": ""Statement"", ""type"": ""Recommendation""}], ""new_knowledge"": [""Using relatable and tangible comparisons can make data more impactful for users."", ""Asking questions can help clarify and refine design ideas."", ""Incorporating diverse feedback can lead to better design outcomes.""], ""new_actionPlan"": [""Incorporate relatable comparisons, such as environmental impacts, to make the benefits of eco-friendly choices more tangible for users."", ""Ask specific questions to identify potential improvements and new features for the design."", ""Gather and integrate feedback from various sources to refine and improve the design.""], ""new_thinking"": ""사용자에게 와닿는 비교를 통해 데이터를 더 효과적으로 전달할 수 있구나. 질문을 통해 디자인 아이디어를 더 명확하게 하고 개선할 수 있겠어! 다양한 피드백을 반영하면 더 나은 디자인 결과를 얻을 수 있겠구나."", ""evaluation"": {""sentences"": [{""sentence"": ""일단 내가 당장 생각한 예시는 앞에서 언급한 연평균 기온, 열대야 기간 변화, 태풍 같은 게 있는데,"", ""categories"": ""Statement"", ""type"": ""Information"", ""knowledge"": ""Examples of environmental impacts include average annual temperature, tropical night period changes, and typhoons."", ""evaluation"": {""specificity"": 6, ""justification"": 5, ""active"": 4, ""sentiment"": 1}}, {""sentence"": ""동건이 너는 혹시 떠오르는 예시가 있어?"", ""categories"": ""Question"", ""type"": ""Generate Design"", ""knowledge"": ""Asking for additional examples from the student."", ""evaluation"": {""timely"": 6, ""relevance"": 6, ""high-level"": 5, ""specificity"": 0, ""justification"": 0, ""active"": 0, ""sentiment"": 1}}, {""sentence"": ""다양한 후보를 만들고 점차 좁혀나가면 더 좋은 지표를 만들 수 있을 것 같아서!"", ""categories"": ""Statement"", ""type"": ""Recommendation"", ""knowledge"": ""Creating multiple candidates and narrowing them down can lead to better indicators."", ""evaluation"": {""specificity"": 5, ""justification"": 5, ""active"": 5, ""sentiment"": 1}}]}, ""response"": {""answer"": ""네, 몇 가지 더 생각해봤어요. 예를 들어, '저탄소 교통으로 몇 주분의 전기를 절약한 효과', '자동차 배출가스로 인한 질병 발생 확률 감소', '맑은 공기 질 유지 기간 증가' 같은 건 어떨까요? 다양한 가능성을 고려해서 사용자에게 직관적으로 와닿는 지표를 만들면 좋을 것 같아요.""}}"
10,2024-08-12 12:26:50,student_question,"{""question"": ""사용자에게 탄소 절약 효과를 설명할 때, 네이밍이나 시각화에서 기억에 남을 만한 방식으로 전달하기 위해 어떤 점을 더 고려해야 할까요?""}"
10,2024-08-12 12:27:36,update_idea,"{""title"": ""저탄소 교통 이용을 장려하는 지도 서비스 2.0"", ""problem"": ""저탄소 교통 이용 시 기다림과 혼잡으로 인한 불편함과 불쾌감이 많은 사용자들이 개인 교통수단으로 전환하게 만듭니다."", ""idea"": ""이 서비스는 실시간 혼잡도와 이에 따른 불쾌지수를 포함하는 종합 지표를 제공함으로써 사용자가 덜 혼잡한 시간대나 교통수단을 선택할 수 있게 돕습니다. 사용자는 첫 화면에서 간단하게 혼잡도를 확인할 수 있으며, 원하는 경우 더 자세한 정보(예: 현재 승객 수, 대기 시간 등)를 탐색할 수 있습니다. 또한, 이 서비스는 사용자가 저탄소 교통을 이용함으로써 환경에 미치는 긍정적인 영향을 시각적으로 보여주는 기능을 포함합니다. 예를 들어, '저탄소 교통을 이용함으로써 어떤 변화가 일어나는가'에 대한 시각적 예시(예: 절약된 전기량, 맑은 날씨 유지 기간 등)를 제공하여 사용자가 그 행동의 중요성을 더 쉽게 체감할 수 있도록 합니다.""}"
