user_id,timestamp,tag,data
10,2024-08-12 12:28:32,user_feedaback,"{""user_input"": ""사용자에게 적합한 결과물을 만들기 위해서는 일단 목표 사용자층에 대해 알아보는 게 도움이 될거야. 혹시 네가 생각해둔 목표 사용자층이 있어?"", ""category"": [{""sentence"": ""사용자에게 적합한 결과물을 만들기 위해서는 일단 목표 사용자층에 대해 알아보는 게 도움이 될거야."", ""categories"": ""Statement"", ""type"": ""Recommendation""}, {""sentence"": ""혹시 네가 생각해둔 목표 사용자층이 있어?"", ""categories"": ""Question"", ""type"": ""Low-Level""}], ""new_knowledge"": [""Understanding the target user group is essential for creating effective design outcomes."", ""Identifying the target user group is essential for tailoring design solutions effectively.""], ""new_actionPlan"": [""Identify and analyze the target user group to tailor the design to their specific needs and preferences."", ""Define and analyze the target user group to ensure the design meets their specific needs and preferences.""], ""new_thinking"": ""목표 사용자층에 대해 잘 알아야 효과적인 디자인 결과물을 만들 수 있겠구나. 목표 사용자층을 명확히 정의하는 것이 중요하구나."", ""evaluation"": {""sentences"": [{""sentence"": ""사용자에게 적합한 결과물을 만들기 위해서는 일단 목표 사용자층에 대해 알아보는 게 도움이 될거야."", ""categories"": ""Statement"", ""type"": ""Recommendation"", ""knowledge"": ""Understanding the target user group is helpful for creating suitable outcomes."", ""evaluation"": {""specificity"": 5, ""justification"": 5, ""active"": 5, ""sentiment"": 1}}, {""sentence"": ""혹시 네가 생각해둔 목표 사용자층이 있어?"", ""categories"": ""Question"", ""type"": ""Low-Level"", ""knowledge"": ""Asking if the student has a target user group in mind."", ""evaluation"": {""timely"": 5, ""relevance"": 5, ""high-level"": 1, ""sentiment"": 1}}]}, ""response"": {""answer"": ""목표 사용자층은 주로 20~40대 대중교통 이용자들이에요. 이들은 환경 보호에도 관심이 많고, 일상 생활을 효율적으로 관리하려는 경향이 있죠.""}}"
10,2024-08-12 12:29:40,user_feedaback,"{""user_input"": ""목표 사용자층을 그렇게 설정한 이유가 궁금한데, 좀 더 자세히 설명해줄래?"", ""category"": [{""sentence"": ""목표 사용자층을 그렇게 설정한 이유가 궁금한데, 좀 더 자세히 설명해줄래?"", ""categories"": ""Question"", ""type"": ""Deep Reasoning""}], ""new_knowledge"": [""Understanding the target user group in detail is essential for creating effective design solutions.""], ""new_actionPlan"": [""Conduct a detailed analysis of the target user group to better tailor the design to their needs and preferences.""], ""new_thinking"": ""목표 사용자층을 더 자세히 이해하는 것이 효과적인 디자인 솔루션을 만드는 데 중요하구나."", ""evaluation"": {""sentences"": [{""sentence"": ""목표 사용자층을 그렇게 설정한 이유가 궁금한데, 좀 더 자세히 설명해줄래?"", ""categories"": ""Question"", ""type"": ""Deep Reasoning"", ""knowledge"": ""The mentor is asking for a detailed explanation of why the student chose the target user group."", ""evaluation"": {""timely"": 6, ""relevance"": 6, ""high-level"": 5, ""specificity"": 0, ""justification"": 0, ""active"": 0, ""sentiment"": 0}}]}, ""response"": {""answer"": ""20~40대는 대중교통을 자주 이용하고 환경 보호에 대한 관심이 높은 연령대예요. 이들은 대학생이나 직장인일 가능성이 크고, 스마트폰 사용에 익숙해 기능을 빠르게 이해하고 활용할 수 있어요.""}}"
10,2024-08-12 12:30:15,user_feedaback,"{""user_input"": ""그럼 환경 보호에 관심이 많고 일상 생활을 효율적으로 관리하려는 경향이 있다는 특징은 어떻게 정하게 된거야?"", ""category"": [{""sentence"": ""그럼 환경 보호에 관심이 많고 일상 생활을 효율적으로 관리하려는 경향이 있다는 특징은 어떻게 정하게 된거야?"", ""categories"": ""Question"", ""type"": ""Deep Reasoning""}], ""new_knowledge"": [""Understanding the specific characteristics and needs of the target user group is essential for effective design solutions.""], ""new_actionPlan"": [""Conduct detailed research to understand the specific characteristics and needs of the target user group to tailor the design solution effectively.""], ""new_thinking"": ""목표 사용자 그룹의 구체적인 특성과 필요를 이해하는 것이 효과적인 디자인 솔루션을 위해 필수적이구나."", ""evaluation"": {""sentences"": [{""sentence"": ""그럼 환경 보호에 관심이 많고 일상 생활을 효율적으로 관리하려는 경향이 있다는 특징은 어떻게 정하게 된거야?"", ""categories"": ""Question"", ""type"": ""Deep Reasoning"", ""knowledge"": ""The mentor is asking for the reasoning behind the characteristics of the target user group."", ""evaluation"": {""timely"": 6, ""relevance"": 7, ""high-level"": 5, ""specificity"": 0, ""justification"": 0, ""active"": 0, ""sentiment"": 0}}]}, ""response"": {""answer"": ""20~40대는 대중교통을 많이 이용하면서 동시에 환경 문제에 대한 민감도가 높은 연령대라 생각했어요. 또한, 이 나이대는 대부분 현대 사회에서 개인의 효율성을 많이 중시하는 경향이 강하다는 것을 주변에서 지켜보며 느꼈습니다.""}}"
10,2024-08-12 12:32:09,user_feedaback,"{""user_input"": ""그렇구나, 그럼 탄소 절약과 개인의 효율성이 연결되는 지표가 있는지 앞에서 이야기했던 후보 중에서 살펴보자. 나는 '저탄소 교통으로 몇 주 분의 전기를 절약한 효과'나 '자동차 배출가스로 인한 질병 발생 확률 감소'가 연결점이 있는 것 같아. 특히 이를 통해 절감한 전기 사용료라던지, 잠재적 의료비 같은 걸로 보여주면 효율성과 연결짓지 좋지 않을까?"", ""category"": [{""sentence"": ""그렇구나, 그럼 탄소 절약과 개인의 효율성이 연결되는 지표가 있는지 앞에서 이야기했던 후보 중에서 살펴보자."", ""categories"": ""Statement"", ""type"": ""Recommendation""}, {""sentence"": ""나는 '저탄소 교통으로 몇 주 분의 전기를 절약한 효과'나 '자동차 배출가스로 인한 질병 발생 확률 감소'가 연결점이 있는 것 같아."", ""categories"": ""Statement"", ""type"": ""Evaluation""}, {""sentence"": ""특히 이를 통해 절감한 전기 사용료라던지, 잠재적 의료비 같은 걸로 보여주면 효율성과 연결짓지 좋지 않을까?"", ""categories"": ""Statement"", ""type"": ""Recommendation""}], ""new_knowledge"": [""Relating environmental benefits to personal efficiency can enhance user engagement."", ""Using relatable and tangible comparisons can make data more impactful for users."", ""Using relatable comparisons can make data more impactful for users.""], ""new_actionPlan"": [""Evaluate the proposed indicators to ensure they effectively connect environmental benefits with personal efficiency."", ""Incorporate relatable and tangible comparisons to illustrate the positive impact of using eco-friendly options in the design."", ""Incorporate relatable comparisons to illustrate the positive impact of using eco-friendly options in the design.""], ""new_thinking"": ""환경적 이익과 개인의 효율성을 연결하는 지표가 사용자 참여를 높일 수 있겠구나. 사용자에게 와닿는 비유를 사용하면 데이터가 더 효과적으로 전달될 수 있겠구나. 사용자에게 와닿는 비유를 사용하면 데이터가 더 효과적으로 전달될 수 있겠구나."", ""evaluation"": {""sentences"": [{""sentence"": ""그렇구나, 그럼 탄소 절약과 개인의 효율성이 연결되는 지표가 있는지 앞에서 이야기했던 후보 중에서 살펴보자."", ""categories"": ""Statement"", ""type"": ""Recommendation"", ""knowledge"": ""탄소 절약과 개인의 효율성을 연결하는 지표를 검토하자."", ""evaluation"": {""specificity"": 5, ""justification"": 4, ""active"": 5, ""sentiment"": 1}}, {""sentence"": ""나는 '저탄소 교통으로 몇 주 분의 전기를 절약한 효과'나 '자동차 배출가스로 인한 질병 발생 확률 감소'가 연결점이 있는 것 같아."", ""categories"": ""Statement"", ""type"": ""Evaluation"", ""knowledge"": ""저탄소 교통의 효과로 전기 절약과 질병 발생 확률 감소가 있다."", ""evaluation"": {""specificity"": 5, ""justification"": 4, ""active"": 0, ""sentiment"": 1}}, {""sentence"": ""특히 이를 통해 절감한 전기 사용료라던지, 잠재적 의료비 같은 걸로 보여주면 효율성과 연결짓지 좋지 않을까?"", ""categories"": ""Statement"", ""type"": ""Recommendation"", ""knowledge"": ""절감한 전기 사용료와 잠재적 의료비를 통해 효율성을 강조하자."", ""evaluation"": {""specificity"": 5, ""justification"": 4, ""active"": 5, ""sentiment"": 1}}]}, ""response"": {""answer"": ""절감한 전기 사용료나 잠재적 의료비 같은 실질적인 지표를 통해 사용자에게 전달하면 더욱 효과적일 것 같아요. 사용자들은 직접적인 금전적 혜택을 통해 동기부여를 더 강하게 받을 수 있거든요. 좋은 방향이에요!""}}"
10,2024-08-12 12:32:39,update_idea,"{""title"": ""저탄소 교통 이용을 장려하는 지도 서비스 2.0"", ""problem"": ""많은 사람들이 저탄소 교통의 중요성을 인지하고 있으나, 대중교통 이용 시 발생하는 기다림과 혼잡으로 인한 불쾌감 및 짜증으로 인해 점차 개인 교통수단 이용률이 증가하는 문제가 있습니다."", ""idea"": ""이 서비스는 실시간 혼잡도와 승객 수, 대기 시간 등의 정보를 제공하여 사용자가 덜 붐비는 시간대나 교통수단을 선택할 수 있게 돕습니다. 첫 화면에서는 사용자가 한눈에 볼 수 있는 간단한 종합 지표(혼잡지수)를 제공하며, 구체적인 정보는 자세히 보고 싶은 사용자가 추가로 탐색할 수 있습니다. 또한, 사용자가 저탄소 교통을 이용함으로써 절약한 탄소량을 '몇 주분의 전기 절약 효과'나 '질병 발생 확률 감소', '전기 사용료 절감' 등 구체적이고 이해하기 쉬운 예시로 보여주어, 사용자가 환경 보호에 기여하고 있음을 실감할 수 있도록 합니다. 목표 사용자층은 20~40대 대중교통 이용자로, 이 연령대는 환경 보호에 관심이 많고, 효율적인 일상 생활을 원하는 경향이 있습니다. 이는 분석을 통해 사용자의 특성을 반영한 디자인을 구현하여, 실사용자의 경험을 향상시키는 것을 목표로 합니다.""}"
10,2024-08-12 12:34:06,user_feedaback,"{""user_input"": ""내 생각에는 대략적인 방향성은 정한 것 같은데, 이제 이 서비스의 실현 가능성을 높이기 위해 어떻게 지표를 모을 것인가에 대한 계획을 세우면 좋을 것 같아. 이 서비스에서 이용하는 지표인 혼잡지수나 효율성 수치를 제공하기 위해 필요한 데이터는 무엇이 있을까? 그걸 정하고 나면 그 데이터를 어떻게 가공할지 고민해보자."", ""category"": [{""sentence"": ""내 생각에는 대략적인 방향성은 정한 것 같은데,"", ""categories"": ""Statement"", ""type"": ""Evaluation""}, {""sentence"": ""이제 이 서비스의 실현 가능성을 높이기 위해 어떻게 지표를 모을 것인가에 대한 계획을 세우면 좋을 것 같아."", ""categories"": ""Statement"", ""type"": ""Recommendation""}, {""sentence"": ""이 서비스에서 이용하는 지표인 혼잡지수나 효율성 수치를 제공하기 위해 필요한 데이터는 무엇이 있을까?"", ""categories"": ""Question"", ""type"": ""Low-Level""}, {""sentence"": ""그걸 정하고 나면 그 데이터를 어떻게 가공할지 고민해보자."", ""categories"": ""Statement"", ""type"": ""Recommendation""}], ""new_knowledge"": [""Having a clear direction is crucial for effective design."", ""Planning how to visualize data can enhance the feasibility of a design."", ""Identifying the necessary data for providing key indicators is crucial for effective design."", ""Effectively communicating data is crucial for user engagement.""], ""new_actionPlan"": [""Ensure that the design idea has a well-defined and clear direction."", ""Develop a detailed plan for how to visualize the data in the service to ensure its feasibility."", ""Determine the specific data required to provide key indicators like congestion index and efficiency metrics."", ""Consider how to present the data in a way that is easily understandable and engaging for users.""], ""new_thinking"": ""명확한 방향성을 가지는 것이 효과적인 디자인에 중요하구나. 데이터를 어떻게 시각화할지 계획하는 것이 디자인의 실현 가능성을 높일 수 있겠어. 중요한 지표를 제공하기 위해 필요한 데이터를 식별하는 것이 중요하구나. 데이터를 효과적으로 전달하는 것이 사용자 참여에 중요하구나."", ""evaluation"": {""sentences"": [{""sentence"": ""내 생각에는 대략적인 방향성은 정한 것 같은데,"", ""categories"": ""Statement"", ""type"": ""Evaluation"", ""knowledge"": ""The general direction of the idea seems to be set."", ""evaluation"": {""specificity"": 3, ""justification"": 2, ""active"": 1, ""sentiment"": 0}}, {""sentence"": ""이제 이 서비스의 실현 가능성을 높이기 위해 어떻게 지표를 모을 것인가에 대한 계획을 세우면 좋을 것 같아."", ""categories"": ""Statement"", ""type"": ""Recommendation"", ""knowledge"": ""A plan for collecting metrics is needed to increase the feasibility of the service."", ""evaluation"": {""specificity"": 4, ""justification"": 3, ""active"": 5, ""sentiment"": 1}}, {""sentence"": ""이 서비스에서 이용하는 지표인 혼잡지수나 효율성 수치를 제공하기 위해 필요한 데이터는 무엇이 있을까?"", ""categories"": ""Question"", ""type"": ""Low-Level"", ""knowledge"": ""Identify the necessary data to provide metrics like congestion index and efficiency."", ""evaluation"": {""timely"": 3, ""relevance"": 4, ""high-level"": 1, ""sentiment"": 0}}, {""sentence"": ""그걸 정하고 나면 그 데이터를 어떻게 가공할지 고민해보자."", ""categories"": ""Statement"", ""type"": ""Recommendation"", ""knowledge"": ""After identifying the necessary data, consider how to process it."", ""evaluation"": {""specificity"": 3, ""justification"": 2, ""active"": 4, ""sentiment"": 1}}]}, ""response"": {""answer"": ""혼잡지수나 효율성 수치를 제공하기 위해서는 다양한 데이터가 필요해요. 예를 들어, 대중교통 이용 데이터, 승객 실시간 탑승 정보, 혼잡도 예측 알고리즘 등이 필요할 거예요. 데이터를 수집하는 방법으로는 교통카드 데이터, GPS 정보, 대중교통 기업과의 협력 등을 고려할 수 있을 것 같아요.""}}"
10,2024-08-12 12:34:07,student_question,"{""question"": ""앞으로 이 아이디어를 더 구체화할 때, 사용자 경험 측면에서 중요하게 고려해야 할 요소가 있을까요?""}"
10,2024-08-12 12:34:39,update_idea,"{""title"": ""저탄소 교통 이용을 장려하는 지도 서비스 2.0"", ""problem"": ""많은 사람들이 대중교통의 혼잡함과 대기 시간의 불편함으로 인해 개인 교통수단을 선호하게 되며, 이로 인해 저탄소 교통 이용률이 감소하고 있습니다."", ""idea"": ""이 서비스는 실시간 혼잡도와 승객 수, 대기 시간을 제공하여 사용자가 덜 붐비는 시간대나 교통수단을 선택할 수 있게 합니다. 첫 화면에서 혼잡지수 같은 간단한 종합 지표를 제공하고, 세부 정보는 추가로 탐색할 수 있습니다. 또한, 저탄소 교통을 이용함으로써 절약한 탄소량을 '몇 주분의 전기 절약 효과', '자동차 배출가스로 인한 질병 발생 확률 감소' 등 일상생활에 미치는 긍정적인 변화로 시각화하여 사용자가 환경 보호에 기여하고 있음을 느낄 수 있게 합니다. 이 서비스 구현을 위해 교통카드 데이터, GPS 정보를 활용하고, 대중교통 기업과 협력하여 실시간 데이터를 수집할 예정입니다. 사용자 경험을 중시하여, 정보의 시각화는 직관적이고 이해하기 쉽도록 구성하며, 효율성을 강조하는 목표 사용자(20~40대 대중교통 이용자)의 선호에 맞게 디자인합니다.""}"
10,2024-08-12 12:34:43,finish,