user_id,timestamp,tag,data
12,2024-08-13 12:11:57,start,
12,2024-08-13 12:13:38,user_feedaback,"{""user_input"": ""안녕 동건아, 너가 말해준 아이디어는 아동보호 서비스 기능을 제공하는 웨어러블 기기인것 같아. 혹시 이게 일반 시중에 팔리고 있는 웨어러블 기기와의 차별 점이 어떤것이라고 생각해?"", ""category"": [{""sentence"": ""안녕 동건아, 너가 말해준 아이디어는 아동보호 서비스 기능을 제공하는 웨어러블 기기인것 같아."", ""categories"": ""Statement"", ""type"": ""Evaluation""}, {""sentence"": ""혹시 이게 일반 시중에 팔리고 있는 웨어러블 기기와의 차별 점이 어떤것이라고 생각해?"", ""categories"": ""Question"", ""type"": ""Comparison""}], ""new_knowledge"": [""Design ideas should clearly communicate the core functionality and purpose of the product."", ""Designs should clearly differentiate from existing products to highlight unique value.""], ""new_actionPlan"": [""Ensure that the design idea explicitly states how the wearable device will provide child protection services."", ""Identify and emphasize the unique features of the wearable device that set it apart from regular wearables.""], ""new_thinking"": ""디자인 아이디어는 제품의 핵심 기능과 목적을 명확하게 전달해야 해. 기존 제품과의 차별점을 명확히 해야 해."", ""evaluation"": {""sentences"": [{""sentence"": ""안녕 동건아, 너가 말해준 아이디어는 아동보호 서비스 기능을 제공하는 웨어러블 기기인것 같아."", ""categories"": ""Statement"", ""type"": ""Evaluation"", ""knowledge"": ""The idea is a wearable device providing child protection services."", ""evaluation"": {""specificity"": 3, ""justification"": 2, ""active"": 2, ""sentiment"": 1}}, {""sentence"": ""혹시 이게 일반 시중에 팔리고 있는 웨어러블 기기와의 차별 점이 어떤것이라고 생각해?"", ""categories"": ""Question"", ""type"": ""Comparison"", ""knowledge"": ""The mentor is asking about the unique selling points compared to existing wearable devices."", ""evaluation"": {""timely"": 5, ""relevance"": 5, ""high-level"": 4, ""sentiment"": 0}}]}, ""response"": {""answer"": ""네, 멘토님. 일반 웨어러블 기기와의 차별 점은 GPS, 마이크, 심박수 모니터링 같은 기능을 통해 아동이 위험한 상황에 처했을 때 즉시 대응할 수 있다는 점입니다. 그리고 언제든지 응급 호출 버튼을 통해 아동이 직접 도움을 요청할 수 있다는 것입니다.""}}"
12,2024-08-13 12:16:21,user_feedaback,"{""user_input"": ""그런데 애플워치나 갤럭시 워치 같은 웨어러블 기기에는 이미 너가 말한 기능들이 존재하는걸로 알고 있어, 그렇다면 너의 아이디어는 같은 기능들을 조금더 아이들의 시각에서 흥미롭게 느껴지도록 만들면 좋을것 같다는 생각이들어. 예를 들어 아이들이 좋아할 만한 커스텀이 가능한 디자인이라던지 등의 아이디어가 더 추가되면 좋을것 같아"", ""category"": [{""sentence"": ""그런데 애플워치나 갤럭시 워치 같은 웨어러블 기기에는 이미 너가 말한 기능들이 존재하는걸로 알고 있어,"", ""categories"": ""Statement"", ""type"": ""Evaluation""}, {""sentence"": ""그렇다면 너의 아이디어는 같은 기능들을 조금더 아이들의 시각에서 흥미롭게 느껴지도록 만들면 좋을것 같다는 생각이들어."", ""categories"": ""Statement"", ""type"": ""Recommendation""}, {""sentence"": ""예를 들어 아이들이 좋아할 만한 커스텀이 가능한 디자인이라던지 등의 아이디어가 더 추가되면 좋을것 같아"", ""categories"": ""Statement"", ""type"": ""Recommendation""}], ""new_knowledge"": [""Existing products may already have similar features to your design."", ""Designs should be visually appealing and engaging to the target audience."", ""Incorporating customizable features can enhance the appeal of a design.""], ""new_actionPlan"": [""Conduct a thorough market analysis to identify existing products with similar features and find ways to further differentiate your design."", ""Enhance the visual design of the wearable device to make it more attractive and engaging for children."", ""Consider adding customizable features to the design to make it more appealing to children.""], ""new_thinking"": ""기존 제품들이 이미 비슷한 기능을 가지고 있을 수 있구나. 아이들의 시각에서 더 흥미롭게 느껴지도록 디자인을 개선해야겠어. 커스터마이징 가능한 기능을 추가하면 디자인의 매력이 높아질 수 있겠어."", ""evaluation"": {""sentences"": [{""sentence"": ""그런데 애플워치나 갤럭시 워치 같은 웨어러블 기기에는 이미 너가 말한 기능들이 존재하는걸로 알고 있어,"", ""categories"": ""Statement"", ""type"": ""Evaluation"", ""knowledge"": ""Existing wearable devices already have similar features."", ""evaluation"": {""specificity"": 6, ""justification"": 5, ""active"": 3, ""sentiment"": 0}}, {""sentence"": ""그렇다면 너의 아이디어는 같은 기능들을 조금더 아이들의 시각에서 흥미롭게 느껴지도록 만들면 좋을것 같다는 생각이들어."", ""categories"": ""Statement"", ""type"": ""Recommendation"", ""knowledge"": ""The idea should be made more appealing from a child's perspective."", ""evaluation"": {""specificity"": 5, ""justification"": 4, ""active"": 5, ""sentiment"": 1}}, {""sentence"": ""예를 들어 아이들이 좋아할 만한 커스텀이 가능한 디자인이라던지 등의 아이디어가 더 추가되면 좋을것 같아"", ""categories"": ""Statement"", ""type"": ""Recommendation"", ""knowledge"": ""Adding customizable designs that children would like could improve the idea."", ""evaluation"": {""specificity"": 6, ""justification"": 5, ""active"": 6, ""sentiment"": 1}}]}, ""response"": {""answer"": ""멘토님, 그렇다면 저의 아이디어에 아동들이 좋아할 만한 캐릭터나 색상 등을 활용한 디자인 옵션을 추가해보겠습니다. 사용자가 직접 꾸밀 수 있는 스티커나 액세서리를 제공하는 것도 고려해볼 수 있을 것 같습니다.""}}"
12,2024-08-13 12:18:14,user_feedaback,"{""user_input"": ""좋아, 다만 너가 원래 해결하고자 했던 아동의 안전 문제도 중요하게 생각해야 할거야. 너무 엔터테인먼트 적인 요소에 치중하면 본질이 흐려질 수 도 있을거라 생각해."", ""category"": [{""sentence"": ""좋아, 다만 너가 원래 해결하고자 했던 아동의 안전 문제도 중요하게 생각해야 할거야."", ""categories"": ""Statement"", ""type"": ""Evaluation""}, {""sentence"": ""너무 엔터테인먼트 적인 요소에 치중하면 본질이 흐려질 수 도 있을거라 생각해."", ""categories"": ""Statement"", ""type"": ""Recommendation""}], ""new_knowledge"": [""Designs should address the core problem they aim to solve effectively."", ""Overly focusing on entertainment aspects can detract from the core functionality of the design.""], ""new_actionPlan"": [""Ensure that the design effectively addresses the core issue of child safety and protection."", ""Ensure that the design maintains a balance between engaging features and essential functionalities.""], ""new_thinking"": ""디자인은 해결하고자 하는 핵심 문제를 효과적으로 다루어야 해. 너무 엔터테인먼트적인 요소에 치중하면 본질이 흐려질 수 있겠구나."", ""evaluation"": {""sentences"": [{""sentence"": ""좋아, 다만 너가 원래 해결하고자 했던 아동의 안전 문제도 중요하게 생각해야 할거야."", ""categories"": ""Statement"", ""type"": ""Evaluation"", ""knowledge"": ""The original goal of addressing child safety should remain a priority."", ""evaluation"": {""specificity"": 5, ""justification"": 6, ""active"": 4, ""sentiment"": 1}}, {""sentence"": ""너무 엔터테인먼트 적인 요소에 치중하면 본질이 흐려질 수 도 있을거라 생각해."", ""categories"": ""Statement"", ""type"": ""Recommendation"", ""knowledge"": ""Focusing too much on entertainment elements may dilute the core purpose."", ""evaluation"": {""specificity"": 5, ""justification"": 6, ""active"": 5, ""sentiment"": 0}}]}, ""response"": {""answer"": ""네, 알겠습니다. 아동의 안전 문제를 최우선으로 고려하면서도, 시각적 흥미를 더해 아동들이 기꺼이 착용할 수 있도록 해볼게요. 감사합니다.""}}"
12,2024-08-13 12:18:15,student_question,"{""question"": ""아동이 좋아하는 캐릭터나 디자인 요소를 추가하는 방법과 아동 보호의 본질적인 기능을 유지하는 균형을 어떻게 잡아야 할지 조언 부탁드립니다.""}"
12,2024-08-13 12:20:13,user_feedaback,"{""user_input"": ""그런 방법들에는 지금 시중에 있는 제품들 처럼 웨어러블 디바이스의 스트랩을 소재 및 디자인을 다양하게 해서 선택할 수 있게 하던가, 캐릭터를 집어넣을 수도 있을 것 같고, 다만 웨어러블 디바이스에서 성인처럼 사용하기 힘든 어린이들을 위해 더 단순하고 명료한 UI 구성 및 물리 버튼을 디자인해보는 방법들이 있을 것 같아"", ""category"": [{""sentence"": ""그런 방법들에는 지금 시중에 있는 제품들 처럼 웨어러블 디바이스의 스트랩을 소재 및 디자인을 다양하게 해서 선택할 수 있게 하던가,"", ""categories"": ""Statement"", ""type"": ""Recommendation""}, {""sentence"": ""캐릭터를 집어넣을 수도 있을 것 같고,"", ""categories"": ""Statement"", ""type"": ""Recommendation""}, {""sentence"": ""다만 웨어러블 디바이스에서 성인처럼 사용하기 힘든 어린이들을 위해 더 단순하고 명료한 UI 구성 및 물리 버튼을 디자인해보는 방법들이 있을 것 같아"", ""categories"": ""Statement"", ""type"": ""Recommendation""}], ""new_knowledge"": [""Customizable design options can make a product more appealing and user-friendly."", ""Incorporating familiar characters can make a design more appealing to the target audience."", ""Designs should have a simple and clear user interface, especially for younger users.""], ""new_actionPlan"": [""Incorporate customizable design elements that allow users to personalize the wearable device."", ""Integrate popular characters into the design to increase its attractiveness to children."", ""Simplify the user interface and design intuitive buttons for the wearable device to ensure ease of use for children.""], ""new_thinking"": ""사용자가 직접 꾸밀 수 있는 디자인 옵션이 제품을 더 매력적이고 사용자 친화적으로 만들 수 있구나. 친숙한 캐릭터를 포함하면 디자인이 더 매력적으로 보일 수 있겠구나. 어린이들을 위해서는 단순하고 명료한 UI가 필요하구나."", ""evaluation"": {""sentences"": [{""sentence"": ""그런 방법들에는 지금 시중에 있는 제품들 처럼 웨어러블 디바이스의 스트랩을 소재 및 디자인을 다양하게 해서 선택할 수 있게 하던가,"", ""categories"": ""Statement"", ""type"": ""Recommendation"", ""knowledge"": ""Consider offering various strap materials and designs for the wearable device."", ""evaluation"": {""specificity"": 6, ""justification"": 5, ""active"": 6, ""sentiment"": 1}}, {""sentence"": ""캐릭터를 집어넣을 수도 있을 것 같고,"", ""categories"": ""Statement"", ""type"": ""Recommendation"", ""knowledge"": ""Incorporate characters into the design."", ""evaluation"": {""specificity"": 4, ""justification"": 4, ""active"": 5, ""sentiment"": 1}}, {""sentence"": ""다만 웨어러블 디바이스에서 성인처럼 사용하기 힘든 어린이들을 위해 더 단순하고 명료한 UI 구성 및 물리 버튼을 디자인해보는 방법들이 있을 것 같아"", ""categories"": ""Statement"", ""type"": ""Recommendation"", ""knowledge"": ""Design a simpler and clearer UI and physical buttons for children."", ""evaluation"": {""specificity"": 6, ""justification"": 6, ""active"": 6, ""sentiment"": 1}}]}, ""response"": {""answer"": ""소재와 디자인을 다양하게 선택할 수 있는 스트랩과 캐릭터 요소를 넣는다는 건 좋은 생각이에요. 그리고 아동들을 위해 단순하고 명료한 UI 구성, 물리 버튼 디자인을 고민해볼게요. 응급 상황에서 빠르게 접근할 수 있도록 직관적인 인터페이스가 중요할 것 같아요. ""}}"
12,2024-08-13 12:20:40,update_idea,"{""title"": ""아동의 안전을 위한 맞춤형 웨어러블 기기"", ""problem"": ""아동 보호 서비스는 아동 학대 및 방치를 예방하고 아동의 안전을 지원하기 위해 필수적입니다. 그러나 대부분의 학대 및 방치는 실내에서 발생하여 외부인이 인지하기 어렵습니다. 기존의 웨어러블 기기들은 아동을 특별히 대상으로 한 기능이 부족하며, 아동에게 맞는 기능과 디자인이 필요합니다."", ""idea"": ""이 웨어러블 기기는 아동의 안전을 최우선으로 고려하여 설계되었습니다. GPS 추적 기능, 마이크, 심박수 모니터를 갖추고 아동의 상태와 위치를 실시간으로 추적하여 위험 상황 시 즉각적인 대응을 가능하게 합니다. 또한, 아동의 매력을 고려한 캐릭터와 다양한 색상의 스트랩을 제공하여 아동들이 기꺼이 착용하고 싶어하는 디자인을 제안합니다. 사용자가 직접 웨어러블 기기를 꾸밀 수 있는 스티커와 액세서리를 제공하여 아동의 흥미를 유발합니다. UI는 아동이 사용하기 쉽도록 간단하며, 크고 쉽게 누를 수 있는 물리적 응급 호출 버튼을 포함하여 아동이 스스로 신속하게 도움을 요청할 수 있습니다. 이 제품은 기존의 성인용 웨어러블과 차별화되어 아동 전용의 기능과 디자인을 강조하여 아동 보호의 본질적 문제를 해결하면서도 아동의 관심을 끌 수 있는 요소를 제공합니다.""}"
12,2024-08-13 12:25:30,user_feedaback,"{""user_input"": ""업데이트해준 아이디어 잘 봤어. 아이디어를 더 구체화하기 전에 target problem을 더 상세하게 적어보는건 어떨까? 디자인에서 의사결정 과정에서 문제정의는 중요하거든, 여러개의 아이디어들 중에서 어떤 것을 선택하고 어떤것은 선택하지 않을지 고르는데 있어서 중요해. 그래서 나는 너가 적어준 것중 \""기존의 웨어러블 기기들은 아동을 특별히 대상으로 한 기능이 부족하며\"" 라는 부분을 조금더 이유와 함께 적어보면 좋을것 같아"", ""category"": [{""sentence"": ""아이디어를 더 구체화하기 전에 target problem을 더 상세하게 적어보는건 어떨까?"", ""categories"": ""Question"", ""type"": ""Generate Design""}, {""sentence"": ""디자인에서 의사결정 과정에서 문제정의는 중요하거든, 여러개의 아이디어들 중에서 어떤 것을 선택하고 어떤것은 선택하지 않을지 고르는데 있어서 중요해."", ""categories"": ""Statement"", ""type"": ""Information""}, {""sentence"": ""그래서 나는 너가 적어준 것중 '기존의 웨어러블 기기들은 아동을 특별히 대상으로 한 기능이 부족하며' 라는 부분을 조금더 이유와 함께 적어보면 좋을것 같아"", ""categories"": ""Statement"", ""type"": ""Recommendation""}], ""new_knowledge"": [""Clearly defining the target problem can help in creating more focused and effective design solutions."", ""Design decisions should prioritize solving the core problem effectively."", ""Designs should clearly communicate the unique value they offer compared to existing products.""], ""new_actionPlan"": [""Refine the problem statement to be more detailed and specific, ensuring it accurately reflects the core issue you aim to address."", ""Ensure that the design decisions focus on addressing the core problem of child safety while incorporating additional features."", ""Emphasize the unique features and benefits of the design that specifically address the needs of the target audience.""], ""new_thinking"": ""타겟 문제를 더 구체적으로 정의하면 더 집중적이고 효과적인 디자인 솔루션을 만들 수 있겠구나. 디자인 결정에서 문제 해결이 가장 중요하구나. 기존의 웨어러블 기기들과 차별화된 가치를 명확히 전달해야겠어."", ""evaluation"": {""sentences"": [{""sentence"": ""아이디어를 더 구체화하기 전에 target problem을 더 상세하게 적어보는건 어떨까?"", ""categories"": ""Question"", ""type"": ""Generate Design"", ""knowledge"": ""Detailing the target problem is crucial before further refining the idea."", ""evaluation"": {""timely"": 6, ""relevance"": 7, ""high-level"": 5, ""specificity"": 0, ""justification"": 0, ""active"": 0, ""sentiment"": 0}}, {""sentence"": ""디자인에서 의사결정 과정에서 문제정의는 중요하거든, 여러개의 아이디어들 중에서 어떤 것을 선택하고 어떤것은 선택하지 않을지 고르는데 있어서 중요해."", ""categories"": ""Statement"", ""type"": ""Information"", ""knowledge"": ""Problem definition is crucial in the decision-making process of design."", ""evaluation"": {""timely"": 0, ""relevance"": 0, ""high-level"": 0, ""specificity"": 6, ""justification"": 7, ""active"": 5, ""sentiment"": 0}}, {""sentence"": ""그래서 나는 너가 적어준 것중 '기존의 웨어러블 기기들은 아동을 특별히 대상으로 한 기능이 부족하며' 라는 부분을 조금더 이유와 함께 적어보면 좋을것 같아"", ""categories"": ""Statement"", ""type"": ""Recommendation"", ""knowledge"": ""It would be beneficial to elaborate on why existing wearable devices lack child-specific features."", ""evaluation"": {""timely"": 0, ""relevance"": 0, ""high-level"": 0, ""specificity"": 7, ""justification"": 6, ""active"": 7, ""sentiment"": 1}}]}, ""response"": {""answer"": ""멘토님, 지적 감사합니다. 아동용 웨어러블 기기의 기존 문제는 아이들이 사용하기 어렵다는 점입니다. 성인용 UI나 기능 복잡성 때문에 아동이 낯설어 하거나, 사용법을 이해하지 못하는 경우가 많아요. 또한, 아동을 보호할 기능이 충분하지 않아서, 실내 보호의 한계가 있습니다.""}}"
12,2024-08-13 12:25:32,student_question,"{""question"": ""네 멘토님, 아동을 위한 단순하고 명료한 UI를 설계할 때, 어떤 요소들을 가장 중점적으로 고려해야 할지 조언해 주실 수 있나요?""}"
12,2024-08-13 12:29:02,user_feedaback,"{""user_input"": ""우선 생각나는건 어떤 단어와 문장을 사용하는지야. 아이들은 성인들에 비해 어휘능력이 떨어지기 때문에 모든 표현들을 단순하고 명료하게 적어야해. 두번째는 단순한 동작 방식이야, 횡 스크롤, 종 스크롤, 클릭 등 여러 액션을 사용하다 보면 아동들은 사용하는데 익숙해지기 어려워질 수도 있어. 마지막으로 생상이야, 강조하고 싶은 부분, 자주 사용하는 부분 등에 사용할 하이라이트 컬러들이 잘 구분되게 설정해야 할수도 있을것 같아"", ""category"": [{""sentence"": ""우선 생각나는건 어떤 단어와 문장을 사용하는지야."", ""categories"": ""Statement"", ""type"": ""Recommendation""}, {""sentence"": ""아이들은 성인들에 비해 어휘능력이 떨어지기 때문에 모든 표현들을 단순하고 명료하게 적어야해."", ""categories"": ""Statement"", ""type"": ""Recommendation""}, {""sentence"": ""두번째는 단순한 동작 방식이야, 횡 스크롤, 종 스크롤, 클릭 등 여러 액션을 사용하다 보면 아동들은 사용하는데 익숙해지기 어려워질 수도 있어."", ""categories"": ""Statement"", ""type"": ""Recommendation""}, {""sentence"": ""마지막으로 생상이야, 강조하고 싶은 부분, 자주 사용하는 부분 등에 사용할 하이라이트 컬러들이 잘 구분되게 설정해야 할수도 있을것 같아"", ""categories"": ""Statement"", ""type"": ""Recommendation""}], ""new_knowledge"": [""Clear and concise language is essential for effective communication in design."", ""Designs for children should prioritize simplicity and clarity in all elements."", ""Designs should avoid overly complex interactions to ensure ease of use for the target audience."", ""Designs should use clear and distinct color coding to highlight important features.""], ""new_actionPlan"": [""Ensure that the language used in the design is simple and easy to understand for the target audience."", ""Ensure that all features and interfaces of the wearable device are simple and clear to accommodate children's lower cognitive abilities."", ""Simplify the interaction methods of the wearable device to ensure that children can use it easily and intuitively."", ""Incorporate clear and distinct color coding to highlight frequently used and important features in the design.""], ""new_thinking"": ""디자인에서 명확하고 간결한 언어가 중요하구나. 아이들을 위한 디자인은 모든 요소에서 단순함과 명료함을 우선시해야 해. 디자인은 너무 복잡한 상호작용을 피해야 해, 그래야 대상 사용자가 쉽게 사용할 수 있어. 중요한 기능을 강조하기 위해 명확하고 구별되는 색상 코딩을 사용해야겠어."", ""evaluation"": {""sentences"": [{""sentence"": ""우선 생각나는건 어떤 단어와 문장을 사용하는지야."", ""categories"": ""Statement"", ""type"": ""Recommendation"", ""knowledge"": ""Use simple and clear language for children."", ""evaluation"": {""specificity"": 5, ""justification"": 4, ""active"": 5, ""sentiment"": 1}}, {""sentence"": ""아이들은 성인들에 비해 어휘능력이 떨어지기 때문에 모든 표현들을 단순하고 명료하게 적어야해."", ""categories"": ""Statement"", ""type"": ""Recommendation"", ""knowledge"": ""Children have lower vocabulary skills than adults, so expressions should be simple and clear."", ""evaluation"": {""specificity"": 6, ""justification"": 6, ""active"": 6, ""sentiment"": 1}}, {""sentence"": ""두번째는 단순한 동작 방식이야, 횡 스크롤, 종 스크롤, 클릭 등 여러 액션을 사용하다 보면 아동들은 사용하는데 익숙해지기 어려워질 수도 있어."", ""categories"": ""Statement"", ""type"": ""Recommendation"", ""knowledge"": ""Simple interaction methods are important as children may find it difficult to get used to multiple actions."", ""evaluation"": {""specificity"": 6, ""justification"": 6, ""active"": 6, ""sentiment"": 1}}, {""sentence"": ""마지막으로 생상이야, 강조하고 싶은 부분, 자주 사용하는 부분 등에 사용할 하이라이트 컬러들이 잘 구분되게 설정해야 할수도 있을것 같아"", ""categories"": ""Statement"", ""type"": ""Recommendation"", ""knowledge"": ""Use highlight colors to distinguish important and frequently used parts."", ""evaluation"": {""specificity"": 5, ""justification"": 5, ""active"": 5, ""sentiment"": 1}}]}, ""response"": {""answer"": ""감사합니다 멘토님. 간단한 표현, 단순한 동작 방식, 하이라이트 색상으로 중요 요소를 잘 표시하는 것이 중요하다는 점 새기겠습니다. 아동의 눈높이에 맞는 UI와 디자인을 중점적으로 고민해보겠습니다.""}}"
12,2024-08-13 12:29:04,student_question,"{""question"": ""아동용 웨어러블 기기의 단순하고 명료한 UI에 대해 개선할 방향성을 조언해 주실 수 있나요?""}"
