user_id,timestamp,tag,data
12,2024-08-13 12:30:12,user_feedaback,"{""user_input"": ""너가 제공하려는 기능들을 정리해서 먼저 알려줘, 그 종류와 성격, 그리고 개수에 따라 달라질 것 같아"", ""category"": [{""sentence"": ""너가 제공하려는 기능들을 정리해서 먼저 알려줘"", ""categories"": ""Question"", ""type"": ""Low-Level""}, {""sentence"": ""그 종류와 성격, 그리고 개수에 따라 달라질 것 같아"", ""categories"": ""Statement"", ""type"": ""Evaluation""}], ""new_knowledge"": [""Clearly organizing and communicating the intended features is crucial for effective design."", ""Designs should consider the diversity in user preferences and characteristics.""], ""new_actionPlan"": [""List and explain the key features of the wearable device to ensure clarity and focus in the design."", ""Ensure the design accommodates various user preferences and characteristics by offering customizable options.""], ""new_thinking"": ""제공하려는 기능들을 명확하게 정리하고 설명하는 것이 중요하구나. 사용자의 다양한 취향과 특성을 고려해야 해."", ""evaluation"": {""sentences"": [{""sentence"": ""너가 제공하려는 기능들을 정리해서 먼저 알려줘"", ""categories"": ""Question"", ""type"": ""Low-Level"", ""knowledge"": ""The mentor is asking for a list of the features the student plans to offer."", ""evaluation"": {""timely"": 5, ""relevance"": 5, ""high-level"": 1, ""specificity"": 0, ""justification"": 0, ""active"": 0, ""sentiment"": 0}}, {""sentence"": ""그 종류와 성격, 그리고 개수에 따라 달라질 것 같아"", ""categories"": ""Statement"", ""type"": ""Evaluation"", ""knowledge"": ""The mentor suggests that the types, nature, and number of features will affect the design."", ""evaluation"": {""timely"": 0, ""relevance"": 0, ""high-level"": 0, ""specificity"": 5, ""justification"": 5, ""active"": 5, ""sentiment"": 0}}]}, ""response"": {""answer"": ""알겠습니다. 제 웨어러블 기기의 주요 기능들은 다음과 같습니다: GPS 추적, 마이크, 심박수 모니터링, 응급 호출 버튼. 이 기능들이 아동의 안전을 위해 어떤 방식으로 작동해야 할지 추가적인 조언 주시면 감사하겠습니다.""}}"
12,2024-08-13 12:31:18,user_feedaback,"{""user_input"": ""GPS 추적과 마이크는 어떤 기능을 의미하는 거야? 너가 생각해본 사용 예시와 함께 이야기해주면 좋을것 같아"", ""category"": [{""sentence"": ""GPS 추적과 마이크는 어떤 기능을 의미하는 거야?"", ""categories"": ""Question"", ""type"": ""Definition""}, {""sentence"": ""너가 생각해본 사용 예시와 함께 이야기해주면 좋을것 같아"", ""categories"": ""Question"", ""type"": ""Example""}], ""new_knowledge"": [""Understanding the specific functionalities of each feature is crucial for effective design."", ""User scenarios can help in understanding and refining design requirements.""], ""new_actionPlan"": [""Clearly define and document the specific functionalities and purposes of each feature in the design."", ""Create detailed user scenarios to better understand how the design will be used in real-life situations.""], ""new_thinking"": ""각 기능의 구체적인 역할과 목적을 명확히 이해하는 것이 중요하구나. 사용 시나리오를 통해 디자인 요구사항을 더 잘 이해할 수 있겠구나."", ""evaluation"": {""sentences"": [{""sentence"": ""GPS 추적과 마이크는 어떤 기능을 의미하는 거야?"", ""categories"": ""Question"", ""type"": ""Definition"", ""knowledge"": ""Clarification of the functions of GPS tracking and microphone."", ""evaluation"": {""timely"": 5, ""relevance"": 5, ""high-level"": 3, ""specificity"": 0, ""justification"": 0, ""active"": 0, ""sentiment"": 0}}, {""sentence"": ""너가 생각해본 사용 예시와 함께 이야기해주면 좋을것 같아"", ""categories"": ""Question"", ""type"": ""Example"", ""knowledge"": ""Request for examples of use cases."", ""evaluation"": {""timely"": 5, ""relevance"": 5, ""high-level"": 3, ""specificity"": 0, ""justification"": 0, ""active"": 0, ""sentiment"": 0}}]}, ""response"": {""answer"": ""GPS 추적은 아동의 위치를 실시간으로 파악할 수 있는 기능이에요. 예를 들어, 아이가 어디서 놀고 있는지 부모님이 쉽게 확인할 수 있어요. 마이크는 아동의 주변 소리를 들을 수 있게 해서, 이상한 소음이나 위험한 상황이 발생할 때 경고를 줄 수 있어요.""}}"
12,2024-08-13 12:35:16,user_feedaback,"{""user_input"": ""설명해줘서 고마워, 그럼 너가 말해준 기능들 중에 GPS 추적과 같이 항상 켜져있어야 하는건 화면에 항상 띄워주면 좋을 것 같고, 응급 호출 버튼과 같이 모니터링 하는것이 아닌 것들은 바로 접근하지 않게 디자인 하면 좋을것 같아. 특히나 응급 호출 버튼은 잘못 눌렀을때의 경우를 배제하기 위해 항상 화면에 띄우지 않으면 좋을것 같아"", ""category"": [{""sentence"": ""그럼 너가 말해준 기능들 중에 GPS 추적과 같이 항상 켜져있어야 하는건 화면에 항상 띄워주면 좋을 것 같고,"", ""categories"": ""Statement"", ""type"": ""Recommendation""}, {""sentence"": ""응급 호출 버튼과 같이 모니터링 하는것이 아닌 것들은 바로 접근하지 않게 디자인 하면 좋을것 같아."", ""categories"": ""Statement"", ""type"": ""Recommendation""}, {""sentence"": ""특히나 응급 호출 버튼은 잘못 눌렀을때의 경우를 배제하기 위해 항상 화면에 띄우지 않으면 좋을것 같아"", ""categories"": ""Statement"", ""type"": ""Recommendation""}], ""new_knowledge"": [""Designs should ensure that critical features are always visible and easily accessible."", ""Designs should ensure that critical features are easily accessible."", ""Designs should include fail-safes to handle user errors effectively.""], ""new_actionPlan"": [""Ensure that essential features like GPS tracking are always visible and easily accessible in the user interface."", ""Ensure that the emergency call button and other essential monitoring features are designed for quick and easy access."", ""Ensure that the emergency call button has a fail-safe mechanism to prevent accidental activation.""], ""new_thinking"": ""중요한 기능은 항상 화면에 잘 보이게 배치해야 해. 중요한 기능은 쉽게 접근할 수 있도록 설계해야 해. 사용자 오류를 효과적으로 처리할 수 있는 안전장치를 디자인에 포함해야 해."", ""evaluation"": {""sentences"": [{""sentence"": ""그럼 너가 말해준 기능들 중에 GPS 추적과 같이 항상 켜져있어야 하는건 화면에 항상 띄워주면 좋을 것 같고,"", ""categories"": ""Statement"", ""type"": ""Recommendation"", ""knowledge"": ""GPS tracking should always be displayed on the screen."", ""evaluation"": {""specificity"": 6, ""justification"": 5, ""active"": 6, ""sentiment"": 1}}, {""sentence"": ""응급 호출 버튼과 같이 모니터링 하는것이 아닌 것들은 바로 접근하지 않게 디자인 하면 좋을것 같아."", ""categories"": ""Statement"", ""type"": ""Recommendation"", ""knowledge"": ""Emergency call buttons should not be immediately accessible."", ""evaluation"": {""specificity"": 6, ""justification"": 5, ""active"": 6, ""sentiment"": 1}}, {""sentence"": ""특히나 응급 호출 버튼은 잘못 눌렀을때의 경우를 배제하기 위해 항상 화면에 띄우지 않으면 좋을것 같아"", ""categories"": ""Statement"", ""type"": ""Recommendation"", ""knowledge"": ""Emergency call buttons should not always be displayed to avoid accidental presses."", ""evaluation"": {""specificity"": 6, ""justification"": 5, ""active"": 6, ""sentiment"": 1}}]}, ""response"": {""answer"": ""알겠습니다, 멘토님. GPS 추적 기능은 항상 켜져 있도록 화면에 띄우고, 응급 호출 버튼은 잘못 눌리지 않도록 숨겨진 상태에서 필요할 때만 접근할 수 있게 설계하겠습니다. 중요한 정보와 기능의 접근성을 균형 있게 조절해볼게요.""}}"
12,2024-08-13 12:37:07,update_idea,"{""title"": ""아동의 안전을 위한 맞춤형 웨어러블 기기"", ""problem"": ""현재 시중에 판매되는 웨어러블 기기들은 주로 성인 사용자를 대상으로 하며, 그로 인해 아동의 인지 및 사용 능력을 충분히 고려하지 않고 설계되어 있습니다. 이는 아동이 기기를 이용하여 실시간으로 보호받고, 위급 상황을 재빠르게 대처하는 데 제약을 초래합니다. 또한, 아동이 잠재적 위험 상황에서 빠르게 부모나 보호자에게 알릴 수 있는 방법이 제한적입니다."", ""idea"": ""이 웨어러블 기기는 아동의 인지 및 운동 능력에 맞춰 설계되어, 간단하고 명확한 사용자 인터페이스(UI)를 제공합니다. 주요 기능으로는 GPS 추적, 실시간 마이크 모니터링, 심박수 측정, 그리고 물리적 응급 호출 버튼이 포함되어 있습니다. 기기의 GPS 추적 기능은 항상 활성화되어 있으며, 화면에 쉽게 표시되어 아동의 위치를 실시간으로 확인할 수 있습니다. 응급 호출 버튼은 아동이 쉽게 접근할 수 있도록 설계되었지만, 오작동을 막기 위해 특별한 방식으로 보호됩니다. 이 기기는 아동의 특성을 고려하여, 아동이 좋아하는 캐릭터와 색상을 사용하여 디자인되었고, 사용자가 직접 액세서리를 추가하거나 꾸밀 수 있도록 하는 등 여러 가지 맞춤 설정을 제공합니다. 특히, UI는 강조하고 싶은 기능에 대해 명확한 색상 코딩을 사용하여 직관적으로 이해할 수 있도록 하였습니다. 이 웨어러블 기기는 아동이 실내외를 막론하고 안전을 유지할 수 있도록 도와주고, 위험 상황에서 신속하게 대응할 수 있도록 설계되었습니다.""}"
12,2024-08-13 12:37:52,finish,