user_id,timestamp,tag,data
14,2024-08-13 8:56:38,user_feedaback,"{""user_input"": ""게임에서는 키우던 동물이 죽거나 다쳐도 크게 다가오지 않을 수 있는데, 어떤 식으로 유저가 몰입하게 해야할까?"", ""category"": [{""sentence"": ""게임에서는 키우던 동물이 죽거나 다쳐도 크게 다가오지 않을 수 있는데,"", ""categories"": ""Statement"", ""type"": ""Evaluation""}, {""sentence"": ""어떤 식으로 유저가 몰입하게 해야할까?"", ""categories"": ""Question"", ""type"": ""Generate Design""}], ""new_knowledge"": [""Simulated experiences can help users understand and prepare for real-life responsibilities."", ""Understanding user engagement methods can enhance design effectiveness.""], ""new_actionPlan"": [""Incorporate realistic consequences in the simulation to enhance user responsibility."", ""Explore various user engagement strategies to determine the most effective approach for the design.""], ""new_thinking"": ""가상 현실 시뮬레이션에서 현실적인 결과를 반영하면 사용자 책임감을 높일 수 있겠어. 유저가 몰입하게 하는 방법을 이해하면 디자인의 효과를 높일 수 있겠어."", ""evaluation"": {""sentences"": [{""sentence"": ""게임에서는 키우던 동물이 죽거나 다쳐도 크게 다가오지 않을 수 있는데,"", ""categories"": ""Statement"", ""type"": ""Evaluation"", ""knowledge"": ""In games, the impact of a pet dying or getting hurt may not be significant."", ""evaluation"": {""specificity"": 5, ""justification"": 4, ""active"": 3, ""sentiment"": 0}}, {""sentence"": ""어떤 식으로 유저가 몰입하게 해야할까?"", ""categories"": ""Question"", ""type"": ""Generate Design"", ""knowledge"": ""How can users be made to immerse themselves?"", ""evaluation"": {""timely"": 5, ""relevance"": 5, ""high-level"": 5, ""sentiment"": 0}}]}, ""response"": {""answer"": ""멘토님, 동건입니다. 유저가 몰입하게 하기 위해서 다양한 측면에서의 감정적 요소를 고려해야 할 것 같아요. 예를 들어, 반려동물의 건강 상태가 나빠지면 유저에게 알림과 함께 시각적, 청각적 피드백을 제공하는 식으로 반영할 수 있어요. 실제 반려동물과 유사한 행동 패턴과 정서적 반응을 통해 유저가 더욱 감정 이입을 할 수 있게 하는 것도 한 방법입니다.""}}"
14,2024-08-13 8:56:39,student_question,"{""question"": ""이 시뮬레이션을 통해 유저가 진짜 반려동물을 돌보는 것처럼 몰입하게 만들기 위해 추가적으로 어떤 요소들을 고려해야 할까요?""}"
14,2024-08-13 8:58:00,user_feedaback,"{""user_input"": ""단순한 푸시 알림보다는 더 좋은 자극이 필요할 것 같아. 추가적으로 실제로 반려동물을 키우다 보면 내가 다른 걸 하고 싶은 시간에 원하는 것을 못하고 시간적, 경제적 비용을 할애해야 하는 경우가 많은데, 이런 제약은 어떻게 줘야할까?"", ""category"": [{""sentence"": ""단순한 푸시 알림보다는 더 좋은 자극이 필요할 것 같아."", ""categories"": ""Statement"", ""type"": ""Evaluation""}, {""sentence"": ""추가적으로 실제로 반려동물을 키우다 보면 내가 다른 걸 하고 싶은 시간에 원하는 것을 못하고 시간적, 경제적 비용을 할애해야 하는 경우가 많은데, 이런 제약은 어떻게 줘야할까?"", ""categories"": ""Question"", ""type"": ""Generate Design""}], ""new_knowledge"": [""Effective user engagement requires more than simple notifications."", ""Design constraints should be considered to ensure practical implementation.""], ""new_actionPlan"": [""Enhance the user engagement features by incorporating more immersive and interactive elements."", ""Identify and address potential constraints such as time and economic costs in the design.""], ""new_thinking"": ""단순한 알림보다는 더 좋은 자극이 필요할 것 같아. 디자인 제약 조건을 고려해야 실현 가능성을 높일 수 있겠구나."", ""evaluation"": {""sentences"": [{""sentence"": ""단순한 푸시 알림보다는 더 좋은 자극이 필요할 것 같아."", ""categories"": ""Statement"", ""type"": ""Evaluation"", ""knowledge"": ""Simple push notifications may not be sufficient to engage users."", ""evaluation"": {""specificity"": 5, ""justification"": 4, ""active"": 3, ""sentiment"": 0}}, {""sentence"": ""추가적으로 실제로 반려동물을 키우다 보면 내가 다른 걸 하고 싶은 시간에 원하는 것을 못하고 시간적, 경제적 비용을 할애해야 하는 경우가 많은데, 이런 제약은 어떻게 줘야할까?"", ""categories"": ""Question"", ""type"": ""Generate Design"", ""knowledge"": ""Consider how to simulate the time and economic constraints of pet ownership."", ""evaluation"": {""timely"": 6, ""relevance"": 7, ""high-level"": 5, ""sentiment"": 0}}]}, ""response"": {""answer"": ""실제 상황과 유사하게 만들어야지요. 예를 들어, 게임 내에서 반려동물이 원하는 시간에 돌봄 요구가 발생하면, 일정 시간 내에 이를 해결하지 않으면 점수나 진행도에 패널티를 주는 방법도 고려해볼 수 있어요. 또, 유저가 가상통화를 벌어 실제 돈처럼 사용할 수 있도록 하고, 이를 통해 반려동물의 건강과 행복도를 유지하는 데 경제적 비용을 체험하도록 하는 것도 좋을 것 같아요.""}}"
14,2024-08-13 8:58:42,user_feedaback,"{""user_input"": ""그렇다면 가상통화는 어떻게 벌지?"", ""category"": [{""sentence"": ""그렇다면 가상통화는 어떻게 벌지?"", ""categories"": ""Question"", ""type"": ""Generate Design""}], ""new_knowledge"": [""Simulated experiences should be designed to closely mimic real-life scenarios.""], ""new_actionPlan"": [""Design the virtual pet care simulation to include realistic scenarios and challenges that users might face in real life.""], ""new_thinking"": ""가상 경험은 실제 상황을 최대한 유사하게 만들어야 해."", ""evaluation"": {""sentences"": [{""sentence"": ""그렇다면 가상통화는 어떻게 벌지?"", ""categories"": ""Question"", ""type"": ""Generate Design"", ""knowledge"": ""The mentor is asking how users will earn virtual currency in the simulation."", ""evaluation"": {""timely"": 5, ""relevance"": 5, ""high-level"": 3, ""specificity"": 0, ""justification"": 0, ""active"": 0, ""sentiment"": 0}}]}, ""response"": {""answer"": ""가상통화는 다양한 미션이나 일일 과제를 통해 벌 수 있게 하면 어떨까요? 예를 들어, 산책, 목욕, 병원 방문 등의 돌봄 미션을 완료하면 보상이 주어지는 식으로요. 아니면 커뮤니티 활동, 다른 입양자들과의 상호작용으로도 추가적인 통화를 벌 수 있게 하는 방법도 생각해볼 수 있어요.""}}"
14,2024-08-13 8:59:36,user_feedaback,"{""user_input"": ""그런데 실제로는 동물을 키운다고 해서 돈을 받지는 않잖아. 게임 상에서 그러면 동물을 키워서 돈을 벌어서 그걸 동물한테 쓰는거야? 현실과 괴리가 있지 않을까?"", ""category"": [{""sentence"": ""그런데 실제로는 동물을 키운다고 해서 돈을 받지는 않잖아."", ""categories"": ""Statement"", ""type"": ""Evaluation""}, {""sentence"": ""게임 상에서 그러면 동물을 키워서 돈을 벌어서 그걸 동물한테 쓰는거야?"", ""categories"": ""Question"", ""type"": ""Deep Reasoning""}, {""sentence"": ""현실과 괴리가 있지 않을까?"", ""categories"": ""Question"", ""type"": ""Deep Reasoning""}], ""new_knowledge"": [""Simulated experiences should be designed to closely mimic real-life scenarios to ensure user engagement."", ""Designs should consider how users can earn and utilize in-game currency to enhance engagement."", ""Designs should consider how closely simulated experiences mimic real-life scenarios.""], ""new_actionPlan"": [""Enhance the virtual pet care simulation to include realistic financial and emotional aspects to increase user engagement."", ""Develop a system where users can earn virtual currency through completing tasks and use it for pet care activities."", ""Ensure that the simulated experiences in the design closely replicate real-life situations to enhance user engagement and responsibility.""], ""new_thinking"": ""가상 현실 시뮬레이션은 실제 상황과 유사하게 만들어야 사용자 몰입을 높일 수 있겠어. 사용자가 가상 통화를 벌고 이를 반려동물 돌봄 활동에 사용할 수 있는 시스템을 개발해야겠어. 시뮬레이션 경험이 실제 상황과 얼마나 유사한지 고려해야겠어."", ""evaluation"": {""sentences"": [{""sentence"": ""그런데 실제로는 동물을 키운다고 해서 돈을 받지는 않잖아."", ""categories"": ""Statement"", ""type"": ""Evaluation"", ""knowledge"": ""In reality, people do not get paid for raising animals."", ""evaluation"": {""specificity"": 5, ""justification"": 5, ""active"": 4, ""sentiment"": 0}}, {""sentence"": ""게임 상에서 그러면 동물을 키워서 돈을 벌어서 그걸 동물한테 쓰는거야?"", ""categories"": ""Question"", ""type"": ""Deep Reasoning"", ""knowledge"": ""In the game, users earn money by raising animals and spend it on the animals."", ""evaluation"": {""timely"": 5, ""relevance"": 5, ""high-level"": 4, ""sentiment"": 0}}, {""sentence"": ""현실과 괴리가 있지 않을까?"", ""categories"": ""Question"", ""type"": ""Deep Reasoning"", ""knowledge"": ""There might be a disconnect between the game and reality."", ""evaluation"": {""timely"": 5, ""relevance"": 5, ""high-level"": 4, ""sentiment"": 0}}]}, ""response"": {""answer"": ""반려동물을 키운다고 돈을 번다는 것은 실제 상황과 괴리가 있긴 해요. 대신 가상통화를 벌어야 하는 게 아니라, 제한된 초기 자금을 주고 그걸 어떻게 관리하는지 확인하는 방식으로 해보면 어떨까요? 이를 통해 경제적 책임감도 배울 수 있을 것 같아요.""}}"
14,2024-08-13 9:04:04,update_idea,"{""title"": ""Petit - 책임감 있는 반려동물 입양 지원 플랫폼"", ""problem"": ""반려동물 입양 후 책임감과 돌봄 능력 부족으로 유기동물이 되는 사례가 증가하고 있습니다. 복잡한 반려동물 관리 요구와 예상치 못한 비용 및 시간 소모 등이 이러한 문제의 주요 원인입니다."", ""idea"": ""Petit 플랫폼은 반려동물 입양 과정을 철저히 이해하고 준비할 수 있도록 돕습니다. 첫째, 사용자는 가상 현실 시뮬레이션을 통해 실제 반려동물 관리와 유사한 경험을 하게 됩니다. 이 시뮬레이션은 반려동물의 일상적인 돌봄 활동을 포함하여, 사용자가 실제로 반려동물을 돌보는 것처럼 경험할 수 있게 합니다. 둘째, 이 시뮬레이션에서는 반려동물의 건강이 나빠지거나 긴급한 돌봄이 필요할 때 사용자에게 적극적인 피드백을 제공하여 감정적 몰입을 강화합니다. 셋째, 시뮬레이션에서의 활동은 실시간으로 평가되며, 입양 과정 전에 반려동물 돌볼 능력을 충분히 검증받아야 합니다. 넷째, 플랫폼은 반려동물 용품 판매, 온라인 교육 프로그램 유료화, 동물 병원과의 협력을 통한 건강 관리 패키지 등 다양한 수익 모델을 통하여 지속 가능하게 운영됩니다. 이를 통해 반려동물과 입양자 모두가 만족할 수 있는 환경을 제공하며, 반려동물 복지와 책임감 있는 입양 문화를 장려하는데 기여합니다.""}"
14,2024-08-13 9:04:36,user_feedaback,"{""user_input"": ""좋은 것 같아. 그렇다면 초기 자금을 동물을 잘 키우면 잘 관리할 수 있는건가? 점점 주제에서 멀어지는것 같네. 이런것 보다는 동물을 잘 키우지 못했을때 유저의 다른 경험에 제약이 가는 식은 어때? 인스타 사용시간 조절 어플 처럼"", ""category"": [{""sentence"": ""좋은 것 같아."", ""categories"": ""Statement"", ""type"": ""Evaluation""}, {""sentence"": ""그렇다면 초기 자금을 동물을 잘 키우면 잘 관리할 수 있는건가?"", ""categories"": ""Question"", ""type"": ""Generate Design""}, {""sentence"": ""점점 주제에서 멀어지는것 같네."", ""categories"": ""Statement"", ""type"": ""Evaluation""}, {""sentence"": ""이런것 보다는 동물을 잘 키우지 못했을때 유저의 다른 경험에 제약이 가는 식은 어때?"", ""categories"": ""Question"", ""type"": ""Generate Design""}, {""sentence"": ""인스타 사용시간 조절 어플 처럼"", ""categories"": ""Statement"", ""type"": ""Information""}], ""new_knowledge"": [""Positive feedback indicates that the design idea is on the right track."", ""Designs should consider how users can manage limited resources to enhance responsibility."", ""Design ideas should maintain focus on the core problem."", ""Designs should consider how to handle user failure scenarios effectively."", ""User engagement can be enhanced by providing time-sensitive challenges.""], ""new_actionPlan"": [""Continue refining and developing the current design idea, ensuring it aligns with the positive aspects highlighted."", ""Incorporate a system where users start with limited resources and must manage them effectively to care for their virtual pets."", ""Ensure that the design idea consistently addresses the main issue without deviating."", ""Incorporate mechanisms to address and guide users through failure scenarios in the simulation."", ""Incorporate time-sensitive challenges in the simulation to increase user engagement.""], ""new_thinking"": ""긍정적인 피드백은 내가 올바른 방향으로 가고 있다는 신호야. 사용자가 제한된 자원을 관리하는 방법을 고려해야 책임감을 높일 수 있겠어. 디자인 아이디어는 핵심 문제에 집중해야 해. 사용자가 실패했을 때 어떻게 대처할지 고려해야겠어. 사용자 참여를 높이기 위해 시간에 민감한 도전을 제공해야겠어."", ""evaluation"": {""sentences"": [{""sentence"": ""좋은 것 같아."", ""categories"": ""Statement"", ""type"": ""Evaluation"", ""knowledge"": ""The mentor thinks the idea is good."", ""evaluation"": {""specificity"": 1, ""justification"": 1, ""active"": 1, ""sentiment"": 1}}, {""sentence"": ""그렇다면 초기 자금을 동물을 잘 키우면 잘 관리할 수 있는건가?"", ""categories"": ""Question"", ""type"": ""Generate Design"", ""knowledge"": ""The mentor is questioning the management of initial funds in relation to pet care."", ""evaluation"": {""timely"": 5, ""relevance"": 5, ""high-level"": 3, ""sentiment"": 0}}, {""sentence"": ""점점 주제에서 멀어지는것 같네."", ""categories"": ""Statement"", ""type"": ""Evaluation"", ""knowledge"": ""The mentor feels the discussion is straying from the main topic."", ""evaluation"": {""specificity"": 3, ""justification"": 3, ""active"": 2, ""sentiment"": -1}}, {""sentence"": ""이런것 보다는 동물을 잘 키우지 못했을때 유저의 다른 경험에 제약이 가는 식은 어때?"", ""categories"": ""Question"", ""type"": ""Generate Design"", ""knowledge"": ""The mentor suggests imposing restrictions on other user experiences if they fail to care for the pet properly."", ""evaluation"": {""timely"": 5, ""relevance"": 5, ""high-level"": 4, ""sentiment"": 0}}, {""sentence"": ""인스타 사용시간 조절 어플 처럼"", ""categories"": ""Statement"", ""type"": ""Information"", ""knowledge"": ""The mentor compares the idea to an app that controls Instagram usage time."", ""evaluation"": {""specificity"": 4, ""justification"": 3, ""active"": 2, ""sentiment"": 0}}]}, ""response"": {""answer"": ""반려동물을 잘 키우지 못했을 때 유저의 다른 경험에 제약을 가는 방식, 예를 들면 SNS 사용 시간 감소, 게임 플레이 제한 등을 적용하는 것이 흥미로울 것 같습니다. 이는 책임감 있는 돌봄을 더욱 강조할 수 있을 거예요. 어떻게 생각하세요?""}}"
14,2024-08-13 9:04:37,student_question,"{""question"": ""가상 현실 시뮬레이션에서 유저가 진짜로 책임감을 느낄 수 있도록 감정적 몰입을 강화할 방법에 대해 더 알아보고 싶은데, 멘토님의 경험이나 생각을 공유해 주실 수 있나요?""}"
14,2024-08-13 9:06:06,user_feedaback,"{""user_input"": ""다른 어플 사용에 제한을 두는 건 좋은 것 같아. 감정적 몰입 같은 경우에 나는 캐릭터가 2d 애니메이션 캐릭터에 사람들이 애정을 갖는 것처럼 실제로 몰입하게 되는 경험이 도움이 되지 않을까 생각해"", ""category"": [{""sentence"": ""다른 어플 사용에 제한을 두는 건 좋은 것 같아."", ""categories"": ""Statement"", ""type"": ""Evaluation""}, {""sentence"": ""감정적 몰입 같은 경우에 나는 캐릭터가 2d 애니메이션 캐릭터에 사람들이 애정을 갖는 것처럼 실제로 몰입하게 되는 경험이 도움이 되지 않을까 생각해"", ""categories"": ""Statement"", ""type"": ""Recommendation""}], ""new_knowledge"": [""User engagement can be enhanced by imposing restrictions on other activities."", ""Emotional engagement in design can enhance user experience.""], ""new_actionPlan"": [""Implement restrictions on other activities when users fail to care for their virtual pets to enhance responsibility."", ""Incorporate elements that evoke strong emotional responses to enhance user engagement in the simulation.""], ""new_thinking"": ""다른 활동에 제약을 두면 사용자 몰입을 높일 수 있겠어. 감정적 몰입이 사용자 경험을 향상시킬 수 있구나."", ""evaluation"": {""sentences"": [{""sentence"": ""다른 어플 사용에 제한을 두는 건 좋은 것 같아."", ""categories"": ""Statement"", ""type"": ""Evaluation"", ""knowledge"": ""Limiting the use of other apps is a good idea."", ""evaluation"": {""specificity"": 5, ""justification"": 4, ""active"": 5, ""sentiment"": 1}}, {""sentence"": ""감정적 몰입 같은 경우에 나는 캐릭터가 2d 애니메이션 캐릭터에 사람들이 애정을 갖는 것처럼 실제로 몰입하게 되는 경험이 도움이 되지 않을까 생각해"", ""categories"": ""Statement"", ""type"": ""Recommendation"", ""knowledge"": ""Emotional immersion can be enhanced by making users feel attached to characters like they do with 2D animation characters."", ""evaluation"": {""specificity"": 5, ""justification"": 4, ""active"": 5, ""sentiment"": 1}}]}, ""response"": {""answer"": ""안녕하세요, 동건입니다. 멘토님의 피드백을 듣고 감정적 몰입을 강화하기 위해 캐릭터 디자인에 더 집중해야 한다고 생각했습니다. 2D 애니메이션처럼 애정을 가질 수 있는 귀여운 디자인을 적용하고, 반려동물의 행동과 반응을 더욱 풍부하게 만드는 방향으로 개선하려고 합니다. 어떻게 생각하시나요?""}}"
14,2024-08-13 9:07:23,update_idea,"{""title"": ""Petit - 책임감 있는 반려동물 입양 지원 플랫폼"", ""problem"": ""많은 반려동물 입양자들이 반려동물을 적절히 돌보는 데 필요한 시간적, 경제적, 감정적 자원의 부족으로 인해 어려움을 겪고 있습니다. 이로 인해 돌봄 포기와 같은 문제가 발생하고 있어, 이를 해결하기 위한 효율적인 교육과 준비 과정이 필요합니다."", ""idea"": ""Petit 플랫폼은 가상 현실 시뮬레이션을 통해 실제 반려동물 돌봄 활동을 경험할 수 있는 서비스를 제공함으로써 예비 입양인들이 반려동물 돌봄에 필요한 책임감과 능력을 갖추도록 돕습니다. 이 시뮬레이션은 사용자가 초기에 제한된 자원을 효율적으로 관리하며 반려동물을 돌보아야 하는 시나리오를 포함하고 있습니다. 사용자가 시뮬레이션 내에서 반려동물 돌봄에 실패할 경우, 실제 생활에서의 다른 활동(예: SNS 사용, 게임 플레이 등)에도 제약을 받게 되어 자연스럽게 책임감을 갖게 됩니다. 또한, 시뮬레이션은 시간에 민감한 도전을 제공하여 사용자의 몰입을 높이고, 실패 시나리오를 통해 적절한 가이드와 유용한 피드백을 제공하여 사용자가 실수에서 배울 수 있도록 설계되어 있습니다. 사용자는 반려동물의 상태나 요구에 따라 감정적으로 반응하도록 설계된 캐릭터와 상호작용하면서 강한 감정적 몰입을 경험하게 되고, 이는 반려동물에 대한 애착과 책임감을 심화시키는 데 기여합니다.""}"
14,2024-08-13 9:08:04,finish,