user_id,timestamp,tag,data
14,2024-08-13 8:42:55,start,
14,2024-08-13 8:45:02,user_feedaback,"{""user_input"": ""문제 상황에 대해 구체적으로 접근해서 해결하려는 건 좋아. 그런데 이게 실제로 어떻게 구체화될지 잘 그려지지 않아. 이런 부분에서 유저 시나리오를 잘 생각해봤어?"", ""category"": [{""sentence"": ""문제 상황에 대해 구체적으로 접근해서 해결하려는 건 좋아."", ""categories"": ""Statement"", ""type"": ""Evaluation""}, {""sentence"": ""그런데 이게 실제로 어떻게 구체화될지 잘 그려지지 않아."", ""categories"": ""Statement"", ""type"": ""Evaluation""}, {""sentence"": ""이런 부분에서 유저 시나리오를 잘 생각해봤어?"", ""categories"": ""Question"", ""type"": ""Generate Design""}], ""new_knowledge"": [""Approaching problems systematically can lead to effective solutions."", ""Design ideas need to be clearly visualized to understand their feasibility."", ""Consider the user scenario to ensure the design addresses real user needs.""], ""new_actionPlan"": [""Ensure that each problem identified in the design is addressed with a structured and systematic approach."", ""Create detailed visual representations or prototypes of the design idea to better understand its feasibility."", ""Develop detailed user scenarios to validate that the design effectively addresses the needs and challenges of the target users.""], ""new_thinking"": ""문제 상황에 대해 구체적으로 접근해서 해결하려는 건 좋아. 아이디어를 명확하게 시각화해야 실현 가능성을 이해할 수 있겠어. 사용자 시나리오를 잘 생각해봐야겠어."", ""evaluation"": {""sentences"": [{""sentence"": ""문제 상황에 대해 구체적으로 접근해서 해결하려는 건 좋아."", ""categories"": ""Statement"", ""type"": ""Evaluation"", ""knowledge"": ""The approach to solving the problem is specific."", ""evaluation"": {""specificity"": 6, ""justification"": 5, ""active"": 4, ""sentiment"": 1}}, {""sentence"": ""그런데 이게 실제로 어떻게 구체화될지 잘 그려지지 않아."", ""categories"": ""Statement"", ""type"": ""Evaluation"", ""knowledge"": ""The implementation details are unclear."", ""evaluation"": {""specificity"": 4, ""justification"": 4, ""active"": 3, ""sentiment"": -1}}, {""sentence"": ""이런 부분에서 유저 시나리오를 잘 생각해봤어?"", ""categories"": ""Question"", ""type"": ""Generate Design"", ""knowledge"": ""Consideration of user scenarios is important."", ""evaluation"": {""timely"": 5, ""relevance"": 6, ""high-level"": 5, ""sentiment"": 0}}]}, ""response"": {""answer"": ""네, 멘토님 맞습니다! 아직 구체적인 유저 시나리오는 생각해보지 않았습니다. 오히려 입양 과정과 교육 부분에 집중했어요.""}}"
14,2024-08-13 8:46:25,user_feedaback,"{""user_input"": ""디자인적으로 생각해볼만한 문제이긴 한데, 너의 해결 방식은 정말 단순하게 해결에 초점을 맞춘 것 같아. 이 시스템을 개인이 도입한다는게 가능할까? 어떻게 생각해?"", ""category"": [{""sentence"": ""디자인적으로 생각해볼만한 문제이긴 한데,"", ""categories"": ""Statement"", ""type"": ""Evaluation""}, {""sentence"": ""너의 해결 방식은 정말 단순하게 해결에 초점을 맞춘 것 같아."", ""categories"": ""Statement"", ""type"": ""Evaluation""}, {""sentence"": ""이 시스템을 개인이 도입한다는게 가능할까?"", ""categories"": ""Question"", ""type"": ""Generate Design""}, {""sentence"": ""어떻게 생각해?"", ""categories"": ""Question"", ""type"": ""Judgmental""}], ""new_knowledge"": [""Design ideas should be critically evaluated to identify potential issues."", ""Simple solutions can effectively address complex problems."", ""Consider the feasibility of individual adoption processes within the system."", ""Asking questions can help clarify and refine design ideas.""], ""new_actionPlan"": [""Critically evaluate the current design idea to identify and address any potential issues."", ""Ensure that the design remains straightforward and user-friendly while addressing the core issues."", ""Evaluate if the adoption process can be personalized for each user to enhance the system's effectiveness."", ""Reflect on the current design and ask specific questions to identify areas that need further development or clarification.""], ""new_thinking"": ""디자인 아이디어는 잠재적인 문제를 식별하기 위해 비판적으로 평가해야 해. 복잡한 문제도 단순한 해결책으로 효과적으로 해결할 수 있구나. 이 시스템을 개인이 도입한다는게 가능할까? 질문을 통해 디자인 아이디어를 더 명확하게 할 수 있구나."", ""evaluation"": {""sentences"": [{""sentence"": ""디자인적으로 생각해볼만한 문제이긴 한데,"", ""categories"": ""Statement"", ""type"": ""Evaluation"", ""knowledge"": ""The problem is worth considering from a design perspective."", ""evaluation"": {""specificity"": 2, ""justification"": 2, ""active"": 1, ""sentiment"": 0}}, {""sentence"": ""너의 해결 방식은 정말 단순하게 해결에 초점을 맞춘 것 같아."", ""categories"": ""Statement"", ""type"": ""Evaluation"", ""knowledge"": ""The solution seems to focus too simply on resolution."", ""evaluation"": {""specificity"": 3, ""justification"": 3, ""active"": 2, ""sentiment"": -1}}, {""sentence"": ""이 시스템을 개인이 도입한다는게 가능할까?"", ""categories"": ""Question"", ""type"": ""Generate Design"", ""knowledge"": ""Feasibility of individual adoption of the system."", ""evaluation"": {""timely"": 4, ""relevance"": 5, ""high-level"": 4, ""sentiment"": 0}}, {""sentence"": ""어떻게 생각해?"", ""categories"": ""Question"", ""type"": ""Judgmental"", ""knowledge"": ""Request for the student's opinion."", ""evaluation"": {""timely"": 3, ""relevance"": 3, ""high-level"": 2, ""sentiment"": 0}}]}, ""response"": {""answer"": ""그 부분이 저도 고민이에요. 개인이 도입하기엔 어려울 것 같아서, 공공 기관이나 동물 보호단체와 협력해서 시스템을 구축하는 방향으로 생각해보는 게 어떨까요?""}}"
14,2024-08-13 8:46:26,student_question,"{""question"": ""현재 아이디어의 유저 시나리오를 어떻게 구체화시킬 수 있을까요?""}"
14,2024-08-13 8:48:06,user_feedaback,"{""user_input"": ""동물 보호 단체와 협력하는 건 좋아. 그런데 보통 동물 보호 단체는 경제적인 이득보다는 개인적인 비용을 들여 하는 경우가 많은데, 너의 아이디어는 수익성이 목적이 아니야?"", ""category"": [{""sentence"": ""동물 보호 단체와 협력하는 건 좋아."", ""categories"": ""Statement"", ""type"": ""Evaluation""}, {""sentence"": ""그런데 보통 동물 보호 단체는 경제적인 이득보다는 개인적인 비용을 들여 하는 경우가 많은데,"", ""categories"": ""Statement"", ""type"": ""Information""}, {""sentence"": ""너의 아이디어는 수익성이 목적이 아니야?"", ""categories"": ""Question"", ""type"": ""Low-Level""}], ""new_knowledge"": [""Collaborating with relevant organizations can enhance the feasibility of a design idea."", ""Understand the financial implications of implementing a design idea."", ""Design ideas should be evaluated for their potential profitability.""], ""new_actionPlan"": [""Identify and reach out to potential organizations for collaboration to support the implementation of the design idea."", ""Research the financial aspects and potential costs involved in collaborating with animal protection organizations."", ""Assess the potential profitability of the design idea to ensure it is viable.""], ""new_thinking"": ""관련 조직과 협력하면 디자인 아이디어의 실현 가능성을 높일 수 있겠어. 디자인 아이디어를 구현하는 데 드는 비용을 이해해야겠어. 디자인 아이디어의 수익성을 평가해야 해."", ""evaluation"": {""sentences"": [{""sentence"": ""동물 보호 단체와 협력하는 건 좋아."", ""categories"": ""Statement"", ""type"": ""Evaluation"", ""knowledge"": ""협력은 긍정적이다."", ""evaluation"": {""specificity"": 2, ""justification"": 1, ""active"": 1, ""sentiment"": 1}}, {""sentence"": ""그런데 보통 동물 보호 단체는 경제적인 이득보다는 개인적인 비용을 들여 하는 경우가 많은데,"", ""categories"": ""Statement"", ""type"": ""Information"", ""knowledge"": ""동물 보호 단체는 주로 개인적인 비용으로 운영된다."", ""evaluation"": {""specificity"": 3, ""justification"": 3, ""active"": 1, ""sentiment"": 0}}, {""sentence"": ""너의 아이디어는 수익성이 목적이 아니야?"", ""categories"": ""Question"", ""type"": ""Low-Level"", ""knowledge"": ""아이디어의 수익성 여부를 묻는다."", ""evaluation"": {""timely"": 3, ""relevance"": 3, ""high-level"": 1, ""sentiment"": 0}}]}, ""response"": {""answer"": ""죄송합니다, 저는 수익성에 대해서 아직 구체적으로 생각해보지 못했습니다. 수익성보다는 반려동물의 복지와 입양자의 책임감을 높이는 것이 주요 목적입니다.""}}"
14,2024-08-13 8:48:43,user_feedaback,"{""user_input"": ""너의 생각에는 수익성이 없는 디자인이 실현이 가능하다고 생각해?"", ""category"": [{""sentence"": ""너의 생각에는 수익성이 없는 디자인이 실현이 가능하다고 생각해?"", ""categories"": ""Question"", ""type"": ""Deep Reasoning""}], ""new_knowledge"": [""Consider the financial sustainability of a design idea to ensure its feasibility.""], ""new_actionPlan"": [""Evaluate the financial model of the current design idea to ensure it can be sustainably implemented.""], ""new_thinking"": ""디자인 아이디어의 재정적 지속 가능성을 고려해야 해."", ""evaluation"": {""sentences"": [{""sentence"": ""너의 생각에는 수익성이 없는 디자인이 실현이 가능하다고 생각해?"", ""categories"": ""Question"", ""type"": ""Deep Reasoning"", ""knowledge"": ""Feasibility of a non-profit design"", ""evaluation"": {""timely"": 5, ""relevance"": 5, ""high-level"": 5, ""specificity"": 0, ""justification"": 0, ""active"": 0, ""sentiment"": 0}}]}, ""response"": {""answer"": ""수익성이 없으면 지속 가능성이 떨어질 수 있어요. 공공기관이나 단체와 협력해서 초기 자금을 얻는 것도 방법이지만, 장기적으로 자금을 지속적으로 확보할 수 있는 모델을 생각해보는 게 좋을 것 같아요. 예를 들어, 반려동물 관련 제품 판매나 서비스 연계로 수익을 창출하는 방법도 고려해봐요.""}}"
14,2024-08-13 8:50:23,user_feedaback,"{""user_input"": ""좋은 접근이야. 어떻게 수익성과 연계할지 생각해볼까? 결국 우리의 문제를 명확히 정의해볼까? 결국 문제는 반려동물 입양한 사람들이 책임감과 능력 부족이 있다는 것 아닐까?"", ""category"": [{""sentence"": ""좋은 접근이야."", ""categories"": ""Statement"", ""type"": ""Evaluation""}, {""sentence"": ""어떻게 수익성과 연계할지 생각해볼까?"", ""categories"": ""Question"", ""type"": ""Generate Design""}, {""sentence"": ""결국 우리의 문제를 명확히 정의해볼까?"", ""categories"": ""Question"", ""type"": ""Generate Design""}, {""sentence"": ""결국 문제는 반려동물 입양한 사람들이 책임감과 능력 부족이 있다는 것 아닐까?"", ""categories"": ""Question"", ""type"": ""Generate Design""}], ""new_knowledge"": [""Positive feedback indicates that the design idea is on the right track."", ""Consider how to integrate profitability with the design idea."", ""Clearly defining the problem is crucial for developing effective design solutions."", ""Identify the root causes of the problem to design effective solutions.""], ""new_actionPlan"": [""Continue refining and developing the design idea based on the positive aspects highlighted."", ""Explore potential revenue streams that align with the design's goals."", ""Revisit and refine the problem statement to ensure it is specific and addresses the core issues."", ""Analyze the reasons behind the lack of responsibility and capability in pet adopters to create targeted interventions.""], ""new_thinking"": ""긍정적인 피드백은 내가 올바른 방향으로 가고 있다는 신호야. 수익성을 디자인 아이디어와 어떻게 통합할 수 있을까? 결국 우리의 문제를 명확히 정의해볼까? 문제의 근본 원인을 파악해야 효과적인 해결책을 설계할 수 있겠어."", ""evaluation"": {""sentences"": [{""sentence"": ""좋은 접근이야."", ""categories"": ""Statement"", ""type"": ""Evaluation"", ""knowledge"": ""The approach is good."", ""evaluation"": {""specificity"": 2, ""justification"": 1, ""active"": 1, ""sentiment"": 1}}, {""sentence"": ""어떻게 수익성과 연계할지 생각해볼까?"", ""categories"": ""Question"", ""type"": ""Generate Design"", ""knowledge"": ""Consider how to link the idea with profitability."", ""evaluation"": {""timely"": 5, ""relevance"": 5, ""high-level"": 5, ""sentiment"": 0}}, {""sentence"": ""결국 우리의 문제를 명확히 정의해볼까?"", ""categories"": ""Question"", ""type"": ""Generate Design"", ""knowledge"": ""Define the problem clearly."", ""evaluation"": {""timely"": 5, ""relevance"": 5, ""high-level"": 5, ""sentiment"": 0}}, {""sentence"": ""결국 문제는 반려동물 입양한 사람들이 책임감과 능력 부족이 있다는 것 아닐까?"", ""categories"": ""Question"", ""type"": ""Generate Design"", ""knowledge"": ""The problem is that people who adopt pets lack responsibility and ability."", ""evaluation"": {""timely"": 5, ""relevance"": 5, ""high-level"": 5, ""sentiment"": 0}}]}, ""response"": {""answer"": ""맞아요. 반려동물 입양자들의 책임감과 돌봄 능력 부족이 핵심 문제예요. 이를 해결하기 위해 다양한 수익 모델을 도입해볼게요. 반려동물 용품 판매, 온라인 교육 프로그램 유료화, 그리고 동물 병원과 연계한 건강 관리 서비스도 생각해봤어요.""}}"
14,2024-08-13 8:52:17,update_idea,"{""title"": ""Petit - 책임감 있는 반려동물 입양 지원 플랫폼"", ""problem"": ""반려동물을 책임감 있게 돌보지 못하고 유기하는 사례가 지속적으로 증가하고 있습니다. 이는 입양자들의 책임감 부족과 돌봄 능력의 결여에서 기인합니다. 입양 과정에서 체계적인 교육과 평가가 부족하며, 입양 후에도 지속적인 지원과 관리가 제대로 이루어지지 않는 현실입니다."", ""idea"": ""Petit 플랫폼은 반려동물 입양을 희망하는 사람들에게 체계적인 교육과 입양 후 지원을 제공하여 책임감 있는 입양 문화를 조성합니다. 사용자 시나리오를 통해 입양 과정을 한 눈에 이해할 수 있도록 하며, 교육 과정은 반려동물 돌봄의 기본 지식부터 심화 학습까지 포함합니다. 온라인 교육을 이수한 후 사용자는 평가를 통과해야만 입양을 진행할 수 있으며, 입양 후에는 정기적인 체크인과 피드백을 통해 반려동물의 건강과 복지 상태를 유지하도록 지원합니다. 추가로, 가상 현실을 통한 반려동물 돌봄 시뮬레이션과 실시간 상담 서비스를 제공함으로써 실제 상황에 대비할 수 있도록 합니다. 또한, 지속 가능한 재정 모델을 개발하기 위해 반려동물 관련 제품 판매 및 교육 프로그램의 유료화, 동물 병원과의 제휴를 통한 건강 관리 패키지 서비스를 도입합니다. 이러한 수익 모델은 플랫폼의 지속 가능한 운영을 보장하고, 더 많은 반려동물이 책임감 있는 환경에서 돌봄을 받을 수 있도록 합니다.""}"
14,2024-08-13 8:53:52,user_feedaback,"{""user_input"": ""이런 시스템도 좋지만, 내 생각에는 사용자들이 실제로 반려동물을 키우는 것과 유사한 상황을 경험해보게 하는 접근은 어때? 결국에 책임감 있는지 스스로 돌아보고 입양을 하게 된다면 문제해결이 되는 것 아닐까? 어떻게 생각해?"", ""category"": [{""sentence"": ""이런 시스템도 좋지만, 내 생각에는 사용자들이 실제로 반려동물을 키우는 것과 유사한 상황을 경험해보게 하는 접근은 어때?"", ""categories"": ""Question"", ""type"": ""Generate Design""}, {""sentence"": ""결국에 책임감 있는지 스스로 돌아보고 입양을 하게 된다면 문제해결이 되는 것 아닐까?"", ""categories"": ""Question"", ""type"": ""Generate Design""}, {""sentence"": ""어떻게 생각해?"", ""categories"": ""Question"", ""type"": ""Judgmental""}], ""new_knowledge"": [""Designs should consider how users will realistically interact with the system."", ""Ensuring responsibility in users can lead to effective problem-solving."", ""Asking questions can help clarify and refine design ideas.""], ""new_actionPlan"": [""Incorporate features that allow users to experience realistic scenarios of pet care and adoption."", ""Incorporate mechanisms to assess and ensure the responsibility of users before allowing them to proceed with the adoption process."", ""Continuously ask questions to identify potential issues and refine the design idea.""], ""new_thinking"": ""사용자들이 시스템과 실제로 어떻게 상호작용할지 고려해야 해. 사용자의 책임감을 보장하는 것이 문제 해결에 효과적일 수 있겠어. 질문을 통해 디자인 아이디어를 더 명확하게 하고 개선할 수 있겠어."", ""evaluation"": {""sentences"": [{""sentence"": ""이런 시스템도 좋지만, 내 생각에는 사용자들이 실제로 반려동물을 키우는 것과 유사한 상황을 경험해보게 하는 접근은 어때?"", ""categories"": ""Question"", ""type"": ""Generate Design"", ""knowledge"": ""Consider simulating real pet ownership experiences for users."", ""evaluation"": {""timely"": 6, ""relevance"": 7, ""high-level"": 5, ""specificity"": 0, ""justification"": 0, ""active"": 0, ""sentiment"": 1}}, {""sentence"": ""결국에 책임감 있는지 스스로 돌아보고 입양을 하게 된다면 문제해결이 되는 것 아닐까?"", ""categories"": ""Question"", ""type"": ""Generate Design"", ""knowledge"": ""Self-reflection on responsibility can solve the problem."", ""evaluation"": {""timely"": 6, ""relevance"": 7, ""high-level"": 5, ""specificity"": 0, ""justification"": 0, ""active"": 0, ""sentiment"": 1}}, {""sentence"": ""어떻게 생각해?"", ""categories"": ""Question"", ""type"": ""Judgmental"", ""knowledge"": ""Asking for the student's opinion."", ""evaluation"": {""timely"": 6, ""relevance"": 5, ""high-level"": 3, ""specificity"": 0, ""justification"": 0, ""active"": 0, ""sentiment"": 0}}]}, ""response"": {""answer"": ""가상 현실로 반려동물 돌봄 시뮬레이션을 추가하는 방향도 좋은 접근인 것 같아요. 사용자가 실제 상황과 비슷한 경험을 통해 책임감을 느낄 수 있도록 해주는 것이 중요하죠. 이를 통해 입양 전 충분히 준비된 상태가 될 수 있어요.""}}"
14,2024-08-13 8:53:54,student_question,"{""question"": ""입양 전 가상 현실 시뮬레이션이 실제로 사용자에게 얼마나 책임감을 느낄 수 있게 할까요? 멘토님의 경험이나 생각을 듣고 싶어요.""}"
14,2024-08-13 8:55:08,user_feedaback,"{""user_input"": ""좋은 질문이야. 나는 반려동물은 아니지만 작은 게임기에서 계속해서 내 캐릭터를 키우고 유지하기 위해 시간과 노력을 들이는 경험에서 행복도 얻고, 이게 실제 생물이라고 생각하면서 더 책임감을 느낀 적이 있어"", ""category"": [{""sentence"": ""좋은 질문이야."", ""categories"": ""Statement"", ""type"": ""Evaluation""}, {""sentence"": ""나는 반려동물은 아니지만 작은 게임기에서 계속해서 내 캐릭터를 키우고 유지하기 위해 시간과 노력을 들이는 경험에서 행복도 얻고, 이게 실제 생물이라고 생각하면서 더 책임감을 느낀 적이 있어"", ""categories"": ""Statement"", ""type"": ""Information""}], ""new_knowledge"": [""Asking good questions can help clarify and refine design ideas."", ""Experiencing responsibility in a simulated environment can enhance real-life accountability.""], ""new_actionPlan"": [""Formulate specific questions to identify potential issues and areas for improvement in the design idea."", ""Incorporate interactive and immersive simulations to help users experience and understand the responsibilities involved.""], ""new_thinking"": ""좋은 질문을 통해 디자인 아이디어를 명확히 하고 개선할 수 있겠어. 가상 환경에서 책임감을 경험하는 것이 실제 책임감을 높일 수 있구나."", ""evaluation"": {""sentences"": [{""sentence"": ""좋은 질문이야."", ""categories"": ""Statement"", ""type"": ""Evaluation"", ""knowledge"": ""The mentor acknowledges the student's question as good."", ""evaluation"": {""specificity"": 1, ""justification"": 1, ""active"": 1, ""sentiment"": 1}}, {""sentence"": ""나는 반려동물은 아니지만 작은 게임기에서 계속해서 내 캐릭터를 키우고 유지하기 위해 시간과 노력을 들이는 경험에서 행복도 얻고, 이게 실제 생물이라고 생각하면서 더 책임감을 느낀 적이 있어"", ""categories"": ""Statement"", ""type"": ""Information"", ""knowledge"": ""The mentor shares a personal experience of feeling responsible for a virtual character."", ""evaluation"": {""specificity"": 7, ""justification"": 7, ""active"": 1, ""sentiment"": 1}}]}, ""response"": {""answer"": ""멘토님, 동건입니다. 가상 현실 시뮬레이션을 통해 반려동물과 유사한 경험을 제공하는 방향으로 플랫폼을 고민하고 있습니다. 이를 통해 입양자의 책임감을 높일 수 있겠죠?""}}"
14,2024-08-13 8:55:51,user_feedaback,"{""user_input"": ""좋은 접근이야. 어떤 식의 경험이 좋을까? 아이디어를 내봐"", ""category"": [{""sentence"": ""좋은 접근이야."", ""categories"": ""Statement"", ""type"": ""Evaluation""}, {""sentence"": ""어떤 식의 경험이 좋을까?"", ""categories"": ""Question"", ""type"": ""Generate Design""}, {""sentence"": ""아이디어를 내봐"", ""categories"": ""Question"", ""type"": ""Generate Design""}], ""new_knowledge"": [""Positive feedback indicates that the design idea is on the right track."", ""Simulated experiences can help users understand and prepare for real-life responsibilities."", ""Generating new design ideas can lead to innovative solutions.""], ""new_actionPlan"": [""Continue refining and developing the current design idea, ensuring it aligns with the positive aspects highlighted."", ""Incorporate simulated experiences into the design to help users better understand and prepare for real-life responsibilities."", ""Brainstorm additional features or services that could enhance the platform's effectiveness and user experience.""], ""new_thinking"": ""긍정적인 피드백은 내가 올바른 방향으로 가고 있다는 신호야. 가상 경험이 실제 책임감을 이해하고 준비하는 데 도움이 될 수 있겠구나. 새로운 디자인 아이디어를 생성하면 혁신적인 해결책을 찾을 수 있어!"", ""evaluation"": {""sentences"": [{""sentence"": ""좋은 접근이야."", ""categories"": ""Statement"", ""type"": ""Evaluation"", ""knowledge"": ""The approach is good."", ""evaluation"": {""specificity"": 2, ""justification"": 1, ""active"": 1, ""sentiment"": 1}}, {""sentence"": ""어떤 식의 경험이 좋을까?"", ""categories"": ""Question"", ""type"": ""Generate Design"", ""knowledge"": ""What kind of experience would be good?"", ""evaluation"": {""timely"": 5, ""relevance"": 5, ""high-level"": 5, ""sentiment"": 1}}, {""sentence"": ""아이디어를 내봐"", ""categories"": ""Question"", ""type"": ""Generate Design"", ""knowledge"": ""Come up with an idea."", ""evaluation"": {""timely"": 4, ""relevance"": 4, ""high-level"": 3, ""sentiment"": 1}}]}, ""response"": {""answer"": ""멘토님, 동건입니다. 가상 현실을 활용한 시뮬레이션을 통해 일상 생활에서의 반려동물 돌봄을 체험할 수 있도록 할 생각입니다. 예를 들어, 밥 주기, 산책 시키기, 목욕, 병원 방문 등 일상적인 돌봄 활동을 가상 현실에서 구현해보면 어떨까요?""}}"
