user_id,timestamp,tag,data
16,2024-08-15 5:45:23,start,
16,2024-08-15 5:47:22,user_feedaback,"{""user_input"": ""각 연령별로 어떤 부적합한 컨텐츠가 걸러지는지 궁금해"", ""category"": [{""sentence"": ""각 연령별로 어떤 부적합한 컨텐츠가 걸러지는지 궁금해"", ""categories"": ""Question"", ""type"": ""Low-Level""}], ""new_knowledge"": [""Understanding the specific content that is inappropriate for each age group is crucial.""], ""new_actionPlan"": [""Research and define the types of content that are considered inappropriate for different age groups.""], ""new_thinking"": ""각 연령별로 어떤 콘텐츠가 부적합한지 명확히 이해하는 것이 중요하구나."", ""evaluation"": {""sentences"": [{""sentence"": ""각 연령별로 어떤 부적합한 컨텐츠가 걸러지는지 궁금해"", ""categories"": ""Question"", ""type"": ""Low-Level"", ""knowledge"": ""The mentor is curious about the specific types of inappropriate content filtered for each age group."", ""evaluation"": {""timely"": 5, ""relevance"": 5, ""high-level"": 1, ""specificity"": 0, ""justification"": 0, ""active"": 0, ""sentiment"": 0}}]}, ""response"": {""answer"": ""Safeview는 AI를 통해 연령별로 각기 다른 콘텐츠 필터링을 적용합니다. 예를 들어, 7세 이하의 아이들에게는 폭력적이거나 성인용 콘텐츠를 걸러내고, 12세 이하의 경우 도박이나 부적절한 언어를 포함한 콘텐츠를 차단해요.""}}"
16,2024-08-15 5:48:38,user_feedaback,"{""user_input"": ""음 나는 이 아이디어를 보니까 영화관에서 관람연령을 제한하는 것과 비슷하다고 생각이 드는데 이런 제도의 단점들로부터 예상되는 문제들을 상상해볼 수 있을 것 같아. 만약 이 아이디어를 실현했을 때 어떤 문제들이 생길 수 있을까?"", ""category"": [{""sentence"": ""음 나는 이 아이디어를 보니까 영화관에서 관람연령을 제한하는 것과 비슷하다고 생각이 드는데"", ""categories"": ""Statement"", ""type"": ""Evaluation""}, {""sentence"": ""이런 제도의 단점들로부터 예상되는 문제들을 상상해볼 수 있을 것 같아."", ""categories"": ""Statement"", ""type"": ""Evaluation""}, {""sentence"": ""만약 이 아이디어를 실현했을 때 어떤 문제들이 생길 수 있을까?"", ""categories"": ""Question"", ""type"": ""Scenario Creation""}], ""new_knowledge"": [""Comparing your design idea to existing solutions can help identify unique value propositions."", ""Anticipating potential issues with the design can help in creating a more robust solution."", ""Anticipating potential issues that may arise during implementation is crucial for a successful design.""], ""new_actionPlan"": [""Analyze existing content filtering solutions to highlight what makes your design unique and valuable."", ""Identify and list potential weaknesses or challenges in the current design to address them proactively."", ""Identify and analyze potential challenges that could occur during the implementation of the design idea.""], ""new_thinking"": ""기존 솔루션과 비교해보면 내 아이디어의 독창적인 가치를 더 잘 파악할 수 있겠어. 디자인의 잠재적인 문제를 예상하는 것이 더 견고한 솔루션을 만드는 데 도움이 될 수 있겠어. 실행 중 발생할 수 있는 문제들을 미리 예상하는 것이 중요하구나."", ""evaluation"": {""sentences"": [{""sentence"": ""음 나는 이 아이디어를 보니까 영화관에서 관람연령을 제한하는 것과 비슷하다고 생각이 드는데"", ""categories"": ""Statement"", ""type"": ""Evaluation"", ""knowledge"": ""The idea is similar to age restrictions in cinemas."", ""evaluation"": {""specificity"": 4, ""justification"": 3, ""active"": 2, ""sentiment"": 0}}, {""sentence"": ""이런 제도의 단점들로부터 예상되는 문제들을 상상해볼 수 있을 것 같아."", ""categories"": ""Statement"", ""type"": ""Evaluation"", ""knowledge"": ""Potential issues from similar systems can be anticipated."", ""evaluation"": {""specificity"": 3, ""justification"": 4, ""active"": 3, ""sentiment"": 0}}, {""sentence"": ""만약 이 아이디어를 실현했을 때 어떤 문제들이 생길 수 있을까?"", ""categories"": ""Question"", ""type"": ""Scenario Creation"", ""knowledge"": ""Consider potential problems if the idea is implemented."", ""evaluation"": {""timely"": 5, ""relevance"": 5, ""high-level"": 5, ""sentiment"": 0}}]}, ""response"": {""answer"": ""맞아요! 비슷한 방식이에요. 예상되는 문제로는 AI가 정확하게 필터링하지 못해 부적절한 콘텐츠가 노출될 수 있다는 점, 그리고 콘텐츠를 걸러내는 기준이 문화나 개인별로 차이가 있을 수 있다는 점이 있어요.""}}"
16,2024-08-15 5:50:04,user_feedaback,"{""user_input"": ""그치, 맞아. 나는 이것을 보고 부모가 아이에게 적합한 컨텐츠 유형을 선정하는 것이 약간 문제가 될 수 도 있을 거 같아. 예를 들면 부모가 아이에게 바라는 특정한 직업군(의사)이 되도록 부추기는 컨텐츠로 시청을 제한하면 아동이 스트레스를 받을 거 같아"", ""category"": [{""sentence"": ""나는 이것을 보고 부모가 아이에게 적합한 컨텐츠 유형을 선정하는 것이 약간 문제가 될 수 도 있을 거 같아."", ""categories"": ""Statement"", ""type"": ""Evaluation""}, {""sentence"": ""예를 들면 부모가 아이에게 바라는 특정한 직업군(의사)이 되도록 부추기는 컨텐츠로 시청을 제한하면 아동이 스트레스를 받을 거 같아"", ""categories"": ""Statement"", ""type"": ""Evaluation""}], ""new_knowledge"": [""User-defined settings may not always be effective."", ""Considering the emotional impact on children when restricting content is important.""], ""new_actionPlan"": [""Consider implementing additional layers of content filtering to support user-defined settings."", ""Evaluate the potential emotional and psychological effects on children when implementing content restrictions.""], ""new_thinking"": ""사용자 정의 설정이 항상 효과적이지 않을 수 있구나. 콘텐츠 제한이 아이들에게 미치는 정서적 영향을 고려해야겠어."", ""evaluation"": {""sentences"": [{""sentence"": ""나는 이것을 보고 부모가 아이에게 적합한 컨텐츠 유형을 선정하는 것이 약간 문제가 될 수 도 있을 거 같아."", ""categories"": ""Statement"", ""type"": ""Evaluation"", ""knowledge"": ""Parents selecting content types for children might be problematic."", ""evaluation"": {""specificity"": 4, ""justification"": 3, ""active"": 2, ""sentiment"": 0}}, {""sentence"": ""예를 들면 부모가 아이에게 바라는 특정한 직업군(의사)이 되도록 부추기는 컨텐츠로 시청을 제한하면 아동이 스트레스를 받을 거 같아"", ""categories"": ""Statement"", ""type"": ""Evaluation"", ""knowledge"": ""Restricting content to encourage specific careers might stress children."", ""evaluation"": {""specificity"": 5, ""justification"": 4, ""active"": 3, ""sentiment"": -1}}]}, ""response"": {""answer"": ""아, 그렇구나. 각 가정마다 선호하는 직업군을 강요하게 된다면 아이에게 스트레스가 될 수 있죠. 그런 걸 방지하려면 다양한 콘텐츠를 추천하되 부모가 정한 기준에 맞춰서 해당하는 범위 내에서의 선택의 자유를 주는 것도 방법일 것 같아요.""}}"
16,2024-08-15 5:51:12,user_feedaback,"{""user_input"": ""응 맞아 근데 아동이 흥미가 있는 컨텐츠를 노출해주는 것도 부모가 컨텐츠를 제한하는 것 만큼 중요할 거 같은데 이 두가지를 모두 충족시키기 위해 어떤 시스템적인 시도를 해볼 수 있을까?"", ""category"": [{""sentence"": ""응 맞아 근데 아동이 흥미가 있는 컨텐츠를 노출해주는 것도 부모가 컨텐츠를 제한하는 것 만큼 중요할 거 같은데"", ""categories"": ""Statement"", ""type"": ""Evaluation""}, {""sentence"": ""이 두가지를 모두 충족시키기 위해 어떤 시스템적인 시도를 해볼 수 있을까?"", ""categories"": ""Question"", ""type"": ""Generate Design""}], ""new_knowledge"": [""Balancing content restriction with providing engaging content is crucial."", ""Exploring systematic approaches can help address multiple design goals simultaneously.""], ""new_actionPlan"": [""Ensure the design includes a mechanism to recommend engaging content within the set restrictions."", ""Investigate systematic methods to balance content filtering accuracy and user-defined settings in the design.""], ""new_thinking"": ""아이들이 흥미를 느낄 수 있는 콘텐츠를 제공하는 것도 부모가 콘텐츠를 제한하는 것만큼 중요하구나. 여러 디자인 목표를 동시에 충족시키기 위해 체계적인 접근 방식을 탐구해야겠어."", ""evaluation"": {""sentences"": [{""sentence"": ""응 맞아 근데 아동이 흥미가 있는 컨텐츠를 노출해주는 것도 부모가 컨텐츠를 제한하는 것 만큼 중요할 거 같은데"", ""categories"": ""Statement"", ""type"": ""Evaluation"", ""knowledge"": ""Balancing content restriction with showing content that interests children is important."", ""evaluation"": {""specificity"": 5, ""justification"": 5, ""active"": 4, ""sentiment"": 1}}, {""sentence"": ""이 두가지를 모두 충족시키기 위해 어떤 시스템적인 시도를 해볼 수 있을까?"", ""categories"": ""Question"", ""type"": ""Generate Design"", ""knowledge"": ""Exploring system-level solutions to balance content restriction and interest."", ""evaluation"": {""timely"": 5, ""relevance"": 5, ""high-level"": 5, ""sentiment"": 1}}]}, ""response"": {""answer"": ""아동이 흥미 있는 콘텐츠를 분석해 추천하는 AI 알고리즘을 개발할 수 있어요. 예를 들어, 아이가 좋아하는 주제나 장르를 학습하고, 부모가 설정한 적절한 기준 내에서 그와 관련된 콘텐츠를 추천하는 시스템을 만들면 재미와 안전 두 마리 토끼를 모두 잡을 수 있을 거예요.""}}"
16,2024-08-15 5:52:19,user_feedaback,"{""user_input"": ""오 좋은 생각이다. 근데 AI가 부모가 설정한 필터링 기준을 잘 따른다는 것을 어떻게 확인할 수 있지?"", ""category"": [{""sentence"": ""오 좋은 생각이다."", ""categories"": ""Statement"", ""type"": ""Evaluation""}, {""sentence"": ""근데 AI가 부모가 설정한 필터링 기준을 잘 따른다는 것을 어떻게 확인할 수 있지?"", ""categories"": ""Question"", ""type"": ""Deep Reasoning""}], ""new_knowledge"": [""Positive feedback can indicate that the current design direction is on the right track."", ""Ensuring the accuracy of AI in following user-defined settings is essential.""], ""new_actionPlan"": [""Continue refining the design while considering any additional feedback to further improve the solution."", ""Develop a mechanism to verify and validate the AI's adherence to user-defined filtering criteria.""], ""new_thinking"": ""긍정적인 피드백은 현재 디자인 방향이 올바르다는 신호일 수 있어. AI가 부모가 설정한 필터링 기준을 정확히 따르는지 확인하는 것이 중요하구나."", ""evaluation"": {""sentences"": [{""sentence"": ""오 좋은 생각이다."", ""categories"": ""Statement"", ""type"": ""Evaluation"", ""knowledge"": ""The idea is considered good."", ""evaluation"": {""specificity"": 1, ""justification"": 1, ""active"": 1, ""sentiment"": 1}}, {""sentence"": ""근데 AI가 부모가 설정한 필터링 기준을 잘 따른다는 것을 어떻게 확인할 수 있지?"", ""categories"": ""Question"", ""type"": ""Deep Reasoning"", ""knowledge"": ""It is important to verify that AI follows the filtering criteria set by parents."", ""evaluation"": {""timely"": 5, ""relevance"": 5, ""high-level"": 5, ""sentiment"": 0}}]}, ""response"": {""answer"": ""AI가 부모의 필터링 기준을 잘 따르는지 확인하려면, 필터링 로그를 부모에게 제공할 수 있어야 해요. 예를 들어, 차단된 콘텐츠 목록과 이유, 그리고 추천된 콘텐츠 목록을 주기적으로 보고하여 부모가 검토할 수 있게 하면 신뢰성을 높일 수 있을 거예요.""}}"
16,2024-08-15 5:53:45,user_feedaback,"{""user_input"": ""좋다좋다 그런데 필터링 로그를 부모가 확인하게 된다면 아동 입장에서 시청하고자 했던 검색어나 컨텐츠의 종류가 부모에게 검사받는 느낌이 들 수도 있을 거 같아"", ""category"": [{""sentence"": ""그런데 필터링 로그를 부모가 확인하게 된다면 아동 입장에서 시청하고자 했던 검색어나 컨텐츠의 종류가 부모에게 검사받는 느낌이 들 수도 있을 거 같아"", ""categories"": ""Statement"", ""type"": ""Evaluation""}], ""new_knowledge"": [""Ensuring transparency in filtering processes can help build trust with users.""], ""new_actionPlan"": [""Implement a system that allows parents to review the filtering logs and understand the reasons behind content restrictions.""], ""new_thinking"": ""필터링 과정의 투명성을 보장하면 사용자와의 신뢰를 쌓을 수 있겠구나."", ""evaluation"": {""sentences"": [{""sentence"": ""그런데 필터링 로그를 부모가 확인하게 된다면 아동 입장에서 시청하고자 했던 검색어나 컨텐츠의 종류가 부모에게 검사받는 느낌이 들 수도 있을 거 같아"", ""categories"": ""Statement"", ""type"": ""Evaluation"", ""knowledge"": ""Children might feel monitored if parents review filtering logs."", ""evaluation"": {""specificity"": 6, ""justification"": 5, ""active"": 4, ""sentiment"": -1}}]}, ""response"": {""answer"": ""아, 맞아요. 아이가 선택한 콘텐츠가 부모에게 너무 많이 노출되면 자유로운 탐색이 어렵게 느껴질 수 있겠어요. 부모에게 전체 목록이 아닌, 꼭 필요한 경우에만 주요 필터링 결과를 간단히 알려주는 방식으로 개선할 수 있을 것 같아요.""}}"
16,2024-08-15 5:54:20,user_feedaback,"{""user_input"": ""꼭 필요한 경우라는 것은 어떤 식으로 설정할 수 있을까?"", ""category"": [{""sentence"": ""꼭 필요한 경우라는 것은 어떤 식으로 설정할 수 있을까?"", ""categories"": ""Question"", ""type"": ""Generate Design""}], ""new_knowledge"": [""Identifying critical scenarios for content filtering can enhance user experience.""], ""new_actionPlan"": [""Define specific scenarios where content filtering is essential and implement settings to address these cases.""], ""new_thinking"": ""어떤 상황에서 필터링이 꼭 필요한지 명확히 정의하는 것이 중요하구나."", ""evaluation"": {""sentences"": [{""sentence"": ""꼭 필요한 경우라는 것은 어떤 식으로 설정할 수 있을까?"", ""categories"": ""Question"", ""type"": ""Generate Design"", ""knowledge"": ""The mentor is asking how to define 'necessary cases' for notifying parents about filtered content."", ""evaluation"": {""timely"": 6, ""relevance"": 6, ""high-level"": 5, ""specificity"": 0, ""justification"": 0, ""active"": 0, ""sentiment"": 0}}]}, ""response"": {""answer"": ""필요한 경우는 예를 들어, 특정 기준 이상의 부적절한 콘텐츠가 일정 횟수 이상 시도될 때 알림을 주는 방식일 수 있어요. 이렇게 하면 아이가 나쁜 걸 자주 보려는지 부모에게 알려줄 수 있어요.""}}"
16,2024-08-15 5:55:17,user_feedaback,"{""user_input"": ""나는 근데 이 부적절한 컨텐츠라는 기준이 되게 모호한 거 같아 이 기준을 구체적으로 세우는 방법은?"", ""category"": [{""sentence"": ""나는 근데 이 부적절한 컨텐츠라는 기준이 되게 모호한 거 같아"", ""categories"": ""Statement"", ""type"": ""Evaluation""}, {""sentence"": ""이 기준을 구체적으로 세우는 방법은?"", ""categories"": ""Question"", ""type"": ""Generate Design""}], ""new_knowledge"": [""Defining clear and specific criteria for inappropriate content is essential."", ""Defining clear and objective criteria for content filtering is essential.""], ""new_actionPlan"": [""Refine the criteria for what constitutes inappropriate content to ensure clarity and effectiveness."", ""Develop a set of clear, objective criteria for content filtering that can be systematically applied.""], ""new_thinking"": ""부적절한 콘텐츠의 기준을 명확하게 정의하는 것이 중요하구나. 콘텐츠 필터링을 위한 명확하고 객관적인 기준을 정의하는 것이 중요하구나."", ""evaluation"": {""sentences"": [{""sentence"": ""나는 근데 이 부적절한 컨텐츠라는 기준이 되게 모호한 거 같아"", ""categories"": ""Statement"", ""type"": ""Evaluation"", ""knowledge"": ""The criteria for inappropriate content are vague."", ""evaluation"": {""specificity"": 4, ""justification"": 3, ""active"": 2, ""sentiment"": -1}}, {""sentence"": ""이 기준을 구체적으로 세우는 방법은?"", ""categories"": ""Question"", ""type"": ""Generate Design"", ""knowledge"": ""How to specifically set the criteria for inappropriate content."", ""evaluation"": {""timely"": 5, ""relevance"": 5, ""high-level"": 4, ""sentiment"": 0}}]}, ""response"": {""answer"": ""네, 부적절한 콘텐츠 기준을 구체화하는 게 중요하죠. 부적절한 콘텐츠를 연령별로 구체적인 카테고리로 나누고, 예를 들어, 폭력, 성인, 도박, 부적절한 언어 등 세부 항목으로 설정할 수 있을 것 같아요. 학계나 관련 기관의 기준을 참고해 AI 알고리즘에 반영하면 더 정확하게 필터링할 수 있겠죠.""}}"
16,2024-08-15 5:56:19,update_idea,"{""title"": ""Safeview - 아동 안전 콘텐츠 필터링 익스텐션"", ""problem"": ""현대 가정에서 유튜브, 넷플릭스와 같은 스트리밍 서비스를 통해 다양한 콘텐츠를 시청하는 것은 일상적이지만, 이러한 플랫폼에서 성인용 콘텐츠는 물론 아동에게 부적합할 수 있는 다양한 유해 콘텐츠에 아이들이 쉽게 노출될 수 있는 위험이 있습니다. 부모들이 콘텐츠를 완벽하게 관리하는 것이 어려우며, 아이들이 부적절한 콘텐츠에 노출될 경우 심리적, 정서적 문제를 유발할 수 있습니다."", ""idea"": ""Safeview는 부모가 설정한 기준에 따라 아동에게 적합한 콘텐츠만을 필터링하는 브라우저 익스텐션입니다. 이 익스텐션은 유튜브, 넷플릭스 등의 스트리밍 플랫폼에서 작동하며, AI 기술을 사용하여 실시간으로 콘텐츠를 분석합니다. AI는 연령별로 세분화된 부적절한 콘텐츠 기준(예를 들어 폭력, 성인 콘텐츠, 도박, 부적절한 언어 등)에 따라 콘텐츠를 필터링하고, 필터링된 콘텐츠의 로그를 부모에게 제공하여 신뢰성을 보장합니다. 또한, Safeview는 아동의 흥미와 부모의 설정을 모두 고려하여 안전하면서도 흥미로운 콘텐츠를 추천합니다. 이러한 기능은 아동의 자유로운 컨텐츠 탐색을 장려하며, 부모가 설정한 필터링 기준에 따라 부적절한 콘텐츠에 대한 접근을 효과적으로 제한합니다.""}"
16,2024-08-15 6:00:41,user_feedaback,"{""user_input"": ""갑자기 생각난 예시가 있는데 유튜브에서 성교육과 관련한 컨텐츠를 봤었는데 이게 유튜브 정책상 연령 제한이 걸려서 성인 인증을 하라고 한 경우가 생각났어. 근데 내가 보기에는 그 영상의 내용은 성인이나 어린이나 꼭 알아야할 내용이었고 전혀 유해한 컨텐츠가 아니었는데 컨텐츠를 검열하는 과정에서 오히려 아동에게 유익한 컨텐츠가 걸러질수도 있지 않을까? 그리고 영상뿐만 아니라 영상에 달린 댓글이 영상의 내용을 왜곡하고 부적절한 생각을 부추기고 인터넷상의 댓글 싸움을 부추기는는 경우도 있는데 아동이 이런 댓글을 보고 잘못 이해하는 경우도 생길 거 같아"", ""category"": [{""sentence"": ""갑자기 생각난 예시가 있는데 유튜브에서 성교육과 관련한 컨텐츠를 봤었는데 이게 유튜브 정책상 연령 제한이 걸려서 성인 인증을 하라고 한 경우가 생각났어."", ""categories"": ""Statement"", ""type"": ""Information""}, {""sentence"": ""근데 내가 보기에는 그 영상의 내용은 성인이나 어린이나 꼭 알아야할 내용이었고 전혀 유해한 컨텐츠가 아니었는데 컨텐츠를 검열하는 과정에서 오히려 아동에게 유익한 컨텐츠가 걸러질수도 있지 않을까?"", ""categories"": ""Question"", ""type"": ""Generate Design""}, {""sentence"": ""그리고 영상뿐만 아니라 영상에 달린 댓글이 영상의 내용을 왜곡하고 부적절한 생각을 부추기고 인터넷상의 댓글 싸움을 부추기는는 경우도 있는데 아동이 이런 댓글을 보고 잘못 이해하는 경우도 생길 거 같아"", ""categories"": ""Statement"", ""type"": ""Evaluation""}], ""new_knowledge"": [""Understanding existing policies and regulations can help in designing effective solutions."", ""Considering the potential for beneficial content to be filtered out is important."", ""Considering user-generated content and comments is important for comprehensive content filtering.""], ""new_actionPlan"": [""Research existing content policies and regulations on platforms like YouTube to ensure your design aligns with them."", ""Ensure the filtering system can distinguish between harmful and beneficial content accurately."", ""Incorporate a mechanism to filter user-generated comments and interactions to ensure a safer environment for children.""], ""new_thinking"": ""기존 정책과 규정을 이해하는 것이 효과적인 솔루션을 설계하는 데 도움이 될 수 있겠구나. 유익한 콘텐츠가 필터링될 가능성도 고려해야겠어. 사용자가 생성한 콘텐츠와 댓글도 필터링에 포함해야겠어."", ""evaluation"": {""sentences"": [{""sentence"": ""갑자기 생각난 예시가 있는데 유튜브에서 성교육과 관련한 컨텐츠를 봤었는데 이게 유튜브 정책상 연령 제한이 걸려서 성인 인증을 하라고 한 경우가 생각났어."", ""categories"": ""Statement"", ""type"": ""Information"", ""knowledge"": ""유튜브 정책상 연령 제한이 걸린 성교육 관련 콘텐츠가 있다."", ""evaluation"": {""specificity"": 5, ""justification"": 4, ""active"": 3, ""sentiment"": 0}}, {""sentence"": ""근데 내가 보기에는 그 영상의 내용은 성인이나 어린이나 꼭 알아야할 내용이었고 전혀 유해한 컨텐츠가 아니었는데 컨텐츠를 검열하는 과정에서 오히려 아동에게 유익한 컨텐츠가 걸러질수도 있지 않을까?"", ""categories"": ""Question"", ""type"": ""Generate Design"", ""knowledge"": ""유익한 콘텐츠가 검열 과정에서 걸러질 수 있다."", ""evaluation"": {""timely"": 5, ""relevance"": 5, ""high-level"": 4, ""sentiment"": 0}}, {""sentence"": ""그리고 영상뿐만 아니라 영상에 달린 댓글이 영상의 내용을 왜곡하고 부적절한 생각을 부추기고 인터넷상의 댓글 싸움을 부추기는는 경우도 있는데 아동이 이런 댓글을 보고 잘못 이해하는 경우도 생길 거 같아"", ""categories"": ""Statement"", ""type"": ""Evaluation"", ""knowledge"": ""영상에 달린 댓글이 부적절한 생각을 부추길 수 있다."", ""evaluation"": {""specificity"": 5, ""justification"": 5, ""active"": 4, ""sentiment"": -1}}]}, ""response"": {""answer"": ""아, 유튜브에서 그런 경우가 발생할 수 있겠네요. 유익한 성교육 콘텐츠도 필터링될 수 있으니, Safeview의 AI 알고리즘을 더 정교하게 만들어야 할 것 같아요. 댓글 필터링도 추가해서 부적절한 댓글을 차단하는 기능을 넣으면 더 좋을 것 같아요.""}}"
