user_id,timestamp,tag,data
16,2024-08-15 6:01:19,user_feedaback,"{""user_input"": ""응 좋다 근데 지금의 유튜브나 영상 플랫폼에서 제공하고 있는 서비스와 어떤 차별점을 둘 수 있어?"", ""category"": [{""sentence"": ""근데 지금의 유튜브나 영상 플랫폼에서 제공하고 있는 서비스와 어떤 차별점을 둘 수 있어?"", ""categories"": ""Question"", ""type"": ""Generate Design""}], ""new_knowledge"": [""Understanding the differences between existing services and your design can help identify unique features.""], ""new_actionPlan"": [""Compare the current design idea with existing platforms to identify and highlight unique features and improvements.""], ""new_thinking"": ""현재 유튜브나 넷플릭스와 같은 플랫폼과 내 디자인의 차별점을 이해하는 것이 중요하겠어."", ""evaluation"": {""sentences"": [{""sentence"": ""근데 지금의 유튜브나 영상 플랫폼에서 제공하고 있는 서비스와 어떤 차별점을 둘 수 있어?"", ""categories"": ""Question"", ""type"": ""Generate Design"", ""knowledge"": ""The feedback asks about the unique differentiators of the proposed service compared to existing services on platforms like YouTube."", ""evaluation"": {""timely"": 6, ""relevance"": 7, ""high-level"": 5, ""specificity"": 0, ""justification"": 0, ""active"": 0, ""sentiment"": 0}}]}, ""response"": {""answer"": ""현재 유튜브나 영상 플랫폼에서 제공하는 기존 부모 통제 기능은 주로 기본적인 연령 필터링과 특정 콘텐츠 차단 정도에 그쳐요. Safeview는 AI 기술을 사용해 실시간으로 콘텐츠와 댓글까지 분석하고, 부모가 설정한 세부 기준을 기반으로 필터링하며, 필요 시 알림 기능도 제공하는 면에서 차별화돼요.""}}"
16,2024-08-15 6:02:33,user_feedaback,"{""user_input"": ""그런데 이 서비스는 결국 아동이 건강한 컨텐츠 소비를 하는 것을 목적으로 하는데 아동의 사용자 경험에 대한 고려가 부족한 것 같아. 어떤 방식으로 이것을  개선할 수 있을까?"", ""category"": [{""sentence"": ""그런데 이 서비스는 결국 아동이 건강한 컨텐츠 소비를 하는 것을 목적으로 하는데 아동의 사용자 경험에 대한 고려가 부족한 것 같아."", ""categories"": ""Statement"", ""type"": ""Evaluation""}, {""sentence"": ""어떤 방식으로 이것을 개선할 수 있을까?"", ""categories"": ""Question"", ""type"": ""Generate Design""}], ""new_knowledge"": [""Considering user experience is crucial when designing a service aimed at children."", ""Exploring alternative methods can lead to design improvements.""], ""new_actionPlan"": [""Evaluate and enhance the user experience for children to ensure the service is engaging and beneficial."", ""Investigate different approaches to enhance the current design.""], ""new_thinking"": ""아동의 사용자 경험을 충분히 고려하는 것이 중요하구나. 다른 방법을 탐구하면 디자인을 개선할 수 있겠어."", ""evaluation"": {""sentences"": [{""sentence"": ""그런데 이 서비스는 결국 아동이 건강한 컨텐츠 소비를 하는 것을 목적으로 하는데 아동의 사용자 경험에 대한 고려가 부족한 것 같아."", ""categories"": ""Statement"", ""type"": ""Evaluation"", ""knowledge"": ""The service aims for healthy content consumption by children but lacks consideration for the user experience of children."", ""evaluation"": {""specificity"": 5, ""justification"": 4, ""active"": 3, ""sentiment"": -1}}, {""sentence"": ""어떤 방식으로 이것을 개선할 수 있을까?"", ""categories"": ""Question"", ""type"": ""Generate Design"", ""knowledge"": ""The mentor is asking for ways to improve the consideration of children's user experience in the service."", ""evaluation"": {""timely"": 5, ""relevance"": 5, ""high-level"": 5, ""specificity"": 0, ""justification"": 0, ""active"": 0, ""sentiment"": 0}}]}, ""response"": {""answer"": ""아동의 사용자 경험을 개선하기 위해, 인터페이스를 친근하고 직관적으로 설계해야 해요. 재미있는 애니메이션 요소나 캐릭터를 활용하고, 콘텐츠 선택 시 간단한 튜토리얼을 제공하면 좋아요. 또한 아동에게 적합한 UI/UX 디자인 가이드라인을 따르는 것도 중요해요.""}}"
16,2024-08-15 6:03:49,user_feedaback,"{""user_input"": ""아동이 컨텐츠를 보고 심리적, 정서적으로 긍정/부정적인 경험을 했다는 것을 어떤 방식으로 확인할 수 있을까?"", ""category"": [{""sentence"": ""아동이 컨텐츠를 보고 심리적, 정서적으로 긍정/부정적인 경험을 했다는 것을 어떤 방식으로 확인할 수 있을까?"", ""categories"": ""Question"", ""type"": ""Generate Design""}], ""new_knowledge"": [""Understanding the emotional and psychological impact of content on users is crucial for effective design.""], ""new_actionPlan"": [""Develop a system to monitor and evaluate the emotional and psychological impact of content on children.""], ""new_thinking"": ""콘텐츠가 아이들에게 미치는 심리적, 정서적 영향을 어떻게 확인할 수 있을까?"", ""evaluation"": {""sentences"": [{""sentence"": ""아동이 컨텐츠를 보고 심리적, 정서적으로 긍정/부정적인 경험을 했다는 것을 어떤 방식으로 확인할 수 있을까?"", ""categories"": ""Question"", ""type"": ""Generate Design"", ""knowledge"": ""The mentor is asking how to verify the psychological and emotional impact of content on children."", ""evaluation"": {""timely"": 5, ""relevance"": 5, ""high-level"": 5, ""specificity"": 0, ""justification"": 0, ""active"": 0, ""sentiment"": 0}}]}, ""response"": {""answer"": ""아동의 심리적, 정서적 경험을 확인하기 위해 간단한 설문조사나 피드백 시스템을 도입할 수 있어요. 예를 들어, 콘텐츠를 시청한 후 간단한 이모티콘으로 만족도나 기분을 표현하게 하면 도움이 될 거예요.""}}"
16,2024-08-15 6:04:34,user_feedaback,"{""user_input"": ""오~ 이모티콘으로 사용자 피드백을 받는 것은 되게 좋은 생각이다."", ""category"": [{""sentence"": ""오~ 이모티콘으로 사용자 피드백을 받는 것은 되게 좋은 생각이다."", ""categories"": ""Statement"", ""type"": ""Evaluation""}], ""new_knowledge"": [""User feedback mechanisms can enhance user engagement and satisfaction.""], ""new_actionPlan"": [""Implement a simple feedback system using emoticons to gauge user satisfaction after content consumption.""], ""new_thinking"": ""사용자 피드백 메커니즘이 사용자 참여와 만족도를 높일 수 있구나."", ""evaluation"": {""sentences"": [{""sentence"": ""오~ 이모티콘으로 사용자 피드백을 받는 것은 되게 좋은 생각이다."", ""categories"": ""Statement"", ""type"": ""Evaluation"", ""knowledge"": ""Using emoticons for user feedback is a good idea."", ""evaluation"": {""specificity"": 5, ""justification"": 3, ""active"": 4, ""sentiment"": 1}}]}, ""response"": {""answer"": ""이모티콘 피드백 시스템이 아이들에게 직관적이고 재미있을 것 같아요! 사용자 경험을 더욱 향상시켜줄 거예요. 다른 부분이나 추가적인 아이디어도 궁금해요!""}}"
16,2024-08-15 6:05:37,update_idea,"{""title"": ""Safeview - 아동 안전 콘텐츠 필터링 익스텐션"", ""problem"": ""유튜브, 넷플릭스 등의 스트리밍 서비스는 다양한 콘텐츠를 제공하지만, 아동에게 부적절한 콘텐츠 노출의 위험이 존재합니다. 현재의 필터링 시스템들은 종종 너무 제한적이거나, 아동의 심리적, 정서적 발달에 적합하지 않은 콘텐츠를 필터링하는데 실패합니다. 또한, 부모와 아동 모두에게 만족스러운 사용자 경험을 제공하지 못하는 경우가 많습니다."", ""idea"": ""Safeview는 고도로 발전된 AI 기반의 브라우저 익스텐션으로, 부모와 전문가의 견해를 반영한 상세한 필터링 기준을 설정하여 아동에게 적합한 콘텐츠만을 제공합니다. 유튜브와 넷플릭스 등의 플랫폼에 적용되어, 내용과 댓글을 실시간으로 분석하고, 아동의 나이와 발달 단계에 맞는 콘텐츠를 선택적으로 필터링합니다. 이는 정서적 및 심리적으로 유익하고 안전한 콘텐츠 경험을 지원합니다. 또한, 간단한 이모티콘을 사용한 피드백 시스템을 통해 아동의 만족도와 반응을 측정할 수 있으며, 이를 통해 서비스를 지속적으로 개선합니다. 아동의 콘텐츠 소비 경험뿐만 아니라 선택과 인터랙션 과정에서의 마음의 건강도 평가할 수 있는 메커니즘이 포함되어, 보다 풍부하고 안전한 디지털 환경을 조성합니다.""}"
16,2024-08-15 6:06:36,user_feedaback,"{""user_input"": ""오 그리고 아동이 친구들에게 추천하고 싶은 영상을 채팅으로 공유하고 그 이유에 대해 설명하는 것처럼 피드백을 받는 방식도 좋을 거 같아"", ""category"": [{""sentence"": ""오 그리고 아동이 친구들에게 추천하고 싶은 영상을 채팅으로 공유하고 그 이유에 대해 설명하는 것처럼 피드백을 받는 방식도 좋을 거 같아"", ""categories"": ""Statement"", ""type"": ""Recommendation""}], ""new_knowledge"": [""Incorporating social sharing and feedback mechanisms can enhance user engagement.""], ""new_actionPlan"": [""Implement a feature that allows children to share recommended content with friends and provide explanations for their choices.""], ""new_thinking"": ""친구들과 콘텐츠를 공유하고 그 이유를 설명하는 기능을 추가하면 사용자 참여도가 높아질 수 있겠어."", ""evaluation"": {""sentences"": [{""sentence"": ""오 그리고 아동이 친구들에게 추천하고 싶은 영상을 채팅으로 공유하고 그 이유에 대해 설명하는 것처럼 피드백을 받는 방식도 좋을 거 같아"", ""categories"": ""Statement"", ""type"": ""Recommendation"", ""knowledge"": ""Children can share videos with friends and explain why they recommend them as a feedback method."", ""evaluation"": {""specificity"": 6, ""justification"": 5, ""active"": 6, ""sentiment"": 1}}]}, ""response"": {""answer"": ""아, 그거 좋네요! 외에도 친구들에게 공유하고 싶은 영상과 이유를 설명하는 기능 덕분에 아이들이 콘텐츠를 추천하고 커뮤니케이션하도록 도와줄 수 있을 것 같아요. 이걸 통해 사회적 상호작용에도 긍정적인 영향을 줄 수 있어요.""}}"
16,2024-08-15 6:07:02,update_idea,"{""title"": ""Safeview - 아동 안전 콘텐츠 필터링 익스텐션"", ""problem"": ""유튜브, 넷플릭스 등 스트리밍 플랫폼에서 아동이 부적절한 콘텐츠에 무방비로 노출될 위험이 있습니다. 부모가 완벽하게 콘텐츠를 관리하기 어려워 정서적, 심리적 문제를 일으킬 수 있습니다. 아동이 안전하게 콘텐츠를 소비할 수 있는 효과적인 필터링 도구가 필요합니다."", ""idea"": ""Safeview는 AI 기술을 활용하여 아동에게 적합한 콘텐츠만을 실시간 분석하여 제공하는 브라우저 익스텐션입니다. 이 서비스는 아동의 나이와 발달 단계에 맞춰 콘텐츠를 선택적으로 필터링하며, 부모는 자녀에게 적합한 콘텐츠만 수신되도록 세부 필터링 기준을 설정할 수 있습니다. 또한, 아동이 콘텐츠를 시청한 후 간단한 이모티콘을 사용하여 만족도와 반응을 표현하게 하는 피드백 시스템을 통해 아동의 심리적, 정서적 경험을 평가할 수 있습니다. 최근 개선된 기능으로, 아동이 친구들에게 추천하고 싶은 콘텐츠를 공유하고 그 이유를 설명할 수 있는 소셜 공유 기능을 추가하였습니다. 이 기능은 아동 간의 건강한 커뮤니케이션을 장려하고, 부모가 아동의 사회적 상호작용을 이해하는데 도움을 줍니다.""}"
16,2024-08-15 6:07:13,finish,