user_id,timestamp,tag,data
2,2024-08-12 4:16:22,start,
2,2024-08-12 4:20:10,user_feedaback,"{""user_input"": ""학생증을 활용해서 전기를 절약하는 좋은 아이디어인 것 같아! 다만 며칠 전 뉴스를 봤는데, 에어컨을 활용할 때 에어컨을 반복적으로 껐다 키는 것보다 에어컨을 일정 온도에 맞춰두고 계속 켜 두는 게 전기 절약 측면에서 더 효과적이라고 들었어. 에어컨을 외출할때마다 껐다 키는것과 계속 켜두는 것 중에서 어떤 것이 전기 절약에 더 효율적인지를 고민해봤으면 좋겠어"", ""category"": [{""sentence"": ""학생증을 활용해서 전기를 절약하는 좋은 아이디어인 것 같아!"", ""categories"": ""Statement"", ""type"": ""Evaluation""}, {""sentence"": ""다만 며칠 전 뉴스를 봤는데, 에어컨을 활용할 때 에어컨을 반복적으로 껐다 키는 것보다 에어컨을 일정 온도에 맞춰두고 계속 켜 두는 게 전기 절약 측면에서 더 효과적이라고 들었어."", ""categories"": ""Statement"", ""type"": ""Information""}, {""sentence"": ""에어컨을 외출할때마다 껐다 키는것과 계속 켜두는 것 중에서 어떤 것이 전기 절약에 더 효율적인지를 고민해봤으면 좋겠어"", ""categories"": ""Statement"", ""type"": ""Recommendation""}], ""new_knowledge"": [""Leveraging existing systems can enhance the efficiency of new solutions."", ""Maintaining a consistent temperature with the air conditioner can be more energy-efficient than frequently turning it on and off."", ""Consider the efficiency of different methods for reducing energy consumption.""], ""new_actionPlan"": [""Investigate how existing systems can be integrated to improve the efficiency of the proposed solution."", ""Consider implementing a system that maintains a consistent temperature rather than turning the air conditioner on and off frequently."", ""Evaluate the effectiveness of turning off the air conditioner when leaving versus keeping it on continuously at a higher temperature.""], ""new_thinking"": ""기존 시스템을 활용하면 새로운 솔루션의 효율성을 높일 수 있구나. 에어컨을 자주 껐다 켜는 것보다 일정 온도를 유지하는 것이 더 효율적일 수 있구나. 에어컨을 외출할 때마다 끄는 것과 계속 켜두는 것 중 어떤 것이 더 효율적일까?"", ""evaluation"": {""sentences"": [{""sentence"": ""학생증을 활용해서 전기를 절약하는 좋은 아이디어인 것 같아!"", ""categories"": ""Statement"", ""type"": ""Evaluation"", ""knowledge"": ""Using student ID to save electricity is a good idea."", ""evaluation"": {""specificity"": 3, ""justification"": 2, ""active"": 2, ""sentiment"": 1}}, {""sentence"": ""다만 며칠 전 뉴스를 봤는데, 에어컨을 활용할 때 에어컨을 반복적으로 껐다 키는 것보다 에어컨을 일정 온도에 맞춰두고 계속 켜 두는 게 전기 절약 측면에서 더 효과적이라고 들었어."", ""categories"": ""Statement"", ""type"": ""Information"", ""knowledge"": ""Keeping the air conditioner at a constant temperature is more effective for saving electricity than turning it on and off repeatedly."", ""evaluation"": {""specificity"": 5, ""justification"": 5, ""active"": 3, ""sentiment"": 0}}, {""sentence"": ""에어컨을 외출할때마다 껐다 키는것과 계속 켜두는 것 중에서 어떤 것이 전기 절약에 더 효율적인지를 고민해봤으면 좋겠어"", ""categories"": ""Statement"", ""type"": ""Recommendation"", ""knowledge"": ""Consider which is more efficient for saving electricity: turning off the air conditioner when leaving or keeping it on."", ""evaluation"": {""specificity"": 4, ""justification"": 4, ""active"": 5, ""sentiment"": 0}}]}, ""response"": {""answer"": ""아, 고마워요! 저도 그점을 생각해 봤어요. 그래서 에어컨을 일정 온도로 자동 조절하는 기능을 추가해서, 외출 시에는 온도를 높이고 돌아오면 다시 설정 온도로 맞추는 거 어때요?""}}"
2,2024-08-12 4:21:50,user_feedaback,"{""user_input"": ""좋은 아이디어인 것 같아! 그렇게 된다면 학교 측에서 정해진 시간에 하루 3번씩 에어컨을 자동으로 제어할 필요 없이, 기숙사 방 내의 학생의 유무에 따라 더욱 효과적으로 에너지를 절약할 수 있을 것 같넹"", ""category"": [{""sentence"": ""좋은 아이디어인 것 같아!"", ""categories"": ""Statement"", ""type"": ""Evaluation""}, {""sentence"": ""그렇게 된다면 학교 측에서 정해진 시간에 하루 3번씩 에어컨을 자동으로 제어할 필요 없이,"", ""categories"": ""Statement"", ""type"": ""Information""}, {""sentence"": ""기숙사 방 내의 학생의 유무에 따라 더욱 효과적으로 에너지를 절약할 수 있을 것 같넹"", ""categories"": ""Statement"", ""type"": ""Evaluation""}], ""new_knowledge"": [""Positive feedback can validate the potential of an idea."", ""Automating systems can reduce the need for manual interventions."", ""Understanding user behavior can lead to more effective energy-saving solutions.""], ""new_actionPlan"": [""Continue refining and developing the idea with confidence, knowing it has potential."", ""Consider how automation can further optimize energy-saving measures in the design."", ""Analyze the behavior patterns of dormitory residents to design a more efficient energy-saving system.""], ""new_thinking"": ""긍정적인 피드백은 아이디어의 잠재력을 확인시켜주는구나. 자동화 시스템이 수동 개입의 필요성을 줄일 수 있구나. 사용자의 행동 패턴을 이해하면 더 효과적인 에너지 절약 솔루션을 만들 수 있겠어."", ""evaluation"": {""sentences"": [{""sentence"": ""좋은 아이디어인 것 같아!"", ""categories"": ""Statement"", ""type"": ""Evaluation"", ""knowledge"": ""The idea is perceived as good."", ""evaluation"": {""specificity"": 1, ""justification"": 1, ""active"": 1, ""sentiment"": 1}}, {""sentence"": ""그렇게 된다면 학교 측에서 정해진 시간에 하루 3번씩 에어컨을 자동으로 제어할 필요 없이,"", ""categories"": ""Statement"", ""type"": ""Information"", ""knowledge"": ""The proposed system could eliminate the need for scheduled air conditioning control."", ""evaluation"": {""specificity"": 5, ""justification"": 5, ""active"": 3, ""sentiment"": 1}}, {""sentence"": ""기숙사 방 내의 학생의 유무에 따라 더욱 효과적으로 에너지를 절약할 수 있을 것 같넹"", ""categories"": ""Statement"", ""type"": ""Evaluation"", ""knowledge"": ""Energy savings could be more effective based on student presence."", ""evaluation"": {""specificity"": 4, ""justification"": 4, ""active"": 4, ""sentiment"": 1}}]}, ""response"": {""answer"": ""감사합니다! 학생의 유무에 따라 에어컨과 불을 자동으로 제어하면 에너지 절약에 큰 도움이 되겠네요. 다른 의견이나 개선할 점이 있다면 알려주세요.""}}"
2,2024-08-12 4:21:51,student_question,"{""question"": ""기숙사 학생들이 에어컨 사용 습관이 얼마나 다양합니까? 이를 더 깊이 이해하려면 어떤 방법을 사용할 수 있을까요?""}"
2,2024-08-12 4:24:35,user_feedaback,"{""user_input"": ""기숙사 에어컨의 최저 온도가 설정되어있어서 26도 이하로는 에어컨 온도를 설정하지 못하는 것으로 알고 있어. 그래서 에어컨 조절 버튼에 막대기를 끼우거나 하는 부적절한 방식으로 에어컨 온도를 계속 낮추려고 하는 친구들이 많은 것 같아. 이는 에어컨 기기의 고장을 유발할 수 있으니 에어컨의 적정 온도를 학생들의 요구를 반영하면 좋지 않을까?"", ""category"": [{""sentence"": ""기숙사 에어컨의 최저 온도가 설정되어있어서 26도 이하로는 에어컨 온도를 설정하지 못하는 것으로 알고 있어."", ""categories"": ""Statement"", ""type"": ""Information""}, {""sentence"": ""그래서 에어컨 조절 버튼에 막대기를 끼우거나 하는 부적절한 방식으로 에어컨 온도를 계속 낮추려고 하는 친구들이 많은 것 같아."", ""categories"": ""Statement"", ""type"": ""Information""}, {""sentence"": ""이는 에어컨 기기의 고장을 유발할 수 있으니 에어컨의 적정 온도를 학생들의 요구를 반영하면 좋지 않을까?"", ""categories"": ""Statement"", ""type"": ""Recommendation""}], ""new_knowledge"": [""Understand the limitations and constraints of existing systems when designing new solutions."", ""User behavior and preferences can significantly impact the effectiveness of energy-saving solutions."", ""Considering user preferences can prevent potential issues with the system.""], ""new_actionPlan"": [""Investigate the current temperature settings and constraints of the air conditioning systems in the dormitory to ensure compatibility with the proposed solution."", ""Conduct surveys or interviews to understand the diverse air conditioner usage habits of dormitory students."", ""Survey students to understand their preferred air conditioner settings and incorporate these preferences into the automated system.""], ""new_thinking"": ""기존 시스템의 한계와 제약을 이해하는 것이 중요하구나. 사용자 행동과 선호도가 에너지 절약 솔루션의 효과에 큰 영향을 미칠 수 있구나. 학생들의 요구를 반영하면 시스템의 문제를 예방할 수 있겠구나."", ""evaluation"": {""sentences"": [{""sentence"": ""기숙사 에어컨의 최저 온도가 설정되어있어서 26도 이하로는 에어컨 온도를 설정하지 못하는 것으로 알고 있어."", ""categories"": ""Statement"", ""type"": ""Information"", ""knowledge"": ""Dormitory air conditioners have a minimum temperature setting of 26 degrees Celsius."", ""evaluation"": {""specificity"": 6, ""justification"": 5, ""active"": 3, ""sentiment"": 0}}, {""sentence"": ""그래서 에어컨 조절 버튼에 막대기를 끼우거나 하는 부적절한 방식으로 에어컨 온도를 계속 낮추려고 하는 친구들이 많은 것 같아."", ""categories"": ""Statement"", ""type"": ""Information"", ""knowledge"": ""Students often use inappropriate methods to lower the air conditioner temperature."", ""evaluation"": {""specificity"": 6, ""justification"": 5, ""active"": 3, ""sentiment"": -1}}, {""sentence"": ""이는 에어컨 기기의 고장을 유발할 수 있으니 에어컨의 적정 온도를 학생들의 요구를 반영하면 좋지 않을까?"", ""categories"": ""Statement"", ""type"": ""Recommendation"", ""knowledge"": ""Reflecting students' temperature preferences could prevent air conditioner malfunctions."", ""evaluation"": {""specificity"": 5, ""justification"": 6, ""active"": 6, ""sentiment"": 1}}]}, ""response"": {""answer"": ""그렇군요, 그럼 학생들이 원하는 온도를 조사해서 최적의 에어컨 온도를 설정하는 것도 좋겠어요. 그럼 기기 고장도 줄이고 에너지 절약도 할 수 있겠네요.""}}"
2,2024-08-12 4:26:43,user_feedaback,"{""user_input"": ""그리고 탄소 배출 절감 및 불필요한 전기 사용을 방지하기 위해서, 에어컨 및 전등 뿐만 아니라, 전기 콘센트도 함께 제어할 수 있도록 하는 것은 어때? "", ""category"": [{""sentence"": ""그리고 탄소 배출 절감 및 불필요한 전기 사용을 방지하기 위해서, 에어컨 및 전등 뿐만 아니라, 전기 콘센트도 함께 제어할 수 있도록 하는 것은 어때?"", ""categories"": ""Question"", ""type"": ""Generate Design""}], ""new_knowledge"": [""Consider integrating multiple electrical devices into the energy-saving system for comprehensive efficiency.""], ""new_actionPlan"": [""Explore the possibility of including other electrical devices, such as power outlets and lights, in the automated control system to enhance overall energy savings.""], ""new_thinking"": ""에어컨뿐만 아니라 다른 전기 기기도 함께 제어하면 더 큰 에너지 절약 효과를 볼 수 있겠어!"", ""evaluation"": {""sentences"": [{""sentence"": ""그리고 탄소 배출 절감 및 불필요한 전기 사용을 방지하기 위해서, 에어컨 및 전등 뿐만 아니라, 전기 콘센트도 함께 제어할 수 있도록 하는 것은 어때?"", ""categories"": ""Question"", ""type"": ""Generate Design"", ""knowledge"": ""Consider controlling electrical outlets in addition to air conditioners and lights to reduce carbon emissions and unnecessary electricity use."", ""evaluation"": {""timely"": 6, ""relevance"": 7, ""high-level"": 5, ""specificity"": 0, ""justification"": 0, ""active"": 0, ""sentiment"": 1}}]}, ""response"": {""answer"": ""아, 전기 콘센트 제어도 좋은 생각이네요! 외출 시 모든 전자기기의 전원을 자동으로 차단하면 더 많은 에너지를 절약할 수 있겠어요. 에어컨, 불, 전기 콘센트 모두 연동해서 제어하면 더 효과적일 것 같아요.""}}"
2,2024-08-12 4:28:58,user_feedaback,"{""user_input"": ""냉장고와 같이 상시적으로 켜두어야하는 전자제품이 연결되어 있는 콘센트는 안되겠지만, 책상 위에 마련된 전기 콘센트들의 경우, 귀찮다거나 자주 까먹는다는 이유로 학생들이 고데기나 충전기 등을 꽂아둔 채로 외출하는 경우가 많아. 이러한 전기들은 충분히 학생증을 활용한 제어 시스템으로 절약할 수 있을 것 같다 "", ""category"": [{""sentence"": ""냉장고와 같이 상시적으로 켜두어야하는 전자제품이 연결되어 있는 콘센트는 안되겠지만,"", ""categories"": ""Statement"", ""type"": ""Information""}, {""sentence"": ""책상 위에 마련된 전기 콘센트들의 경우, 귀찮다거나 자주 까먹는다는 이유로 학생들이 고데기나 충전기 등을 꽂아둔 채로 외출하는 경우가 많아."", ""categories"": ""Statement"", ""type"": ""Information""}, {""sentence"": ""이러한 전기들은 충분히 학생증을 활용한 제어 시스템으로 절약할 수 있을 것 같다"", ""categories"": ""Statement"", ""type"": ""Recommendation""}], ""new_knowledge"": [""Consider the compatibility of different devices when integrating them into a system."", ""User convenience and habits can lead to inefficient energy use."", ""Leveraging existing systems can enhance the efficiency of new solutions.""], ""new_actionPlan"": [""Ensure that all devices to be integrated into the energy-saving system are compatible and can be controlled together."", ""Investigate user habits and design solutions that address convenience without compromising energy efficiency."", ""Integrate the student ID system with the energy-saving system to automate control of electrical devices.""], ""new_thinking"": ""다양한 기기를 시스템에 통합할 때 호환성을 고려해야겠어. 사용자의 편의와 습관이 에너지 비효율을 초래할 수 있구나. 기존 시스템을 활용하면 새로운 솔루션의 효율성을 높일 수 있겠어."", ""evaluation"": {""sentences"": [{""sentence"": ""냉장고와 같이 상시적으로 켜두어야하는 전자제품이 연결되어 있는 콘센트는 안되겠지만,"", ""categories"": ""Statement"", ""type"": ""Information"", ""knowledge"": ""Certain appliances like refrigerators need to stay on continuously."", ""evaluation"": {""specificity"": 6, ""justification"": 5, ""active"": 0, ""sentiment"": 0}}, {""sentence"": ""책상 위에 마련된 전기 콘센트들의 경우, 귀찮다거나 자주 까먹는다는 이유로 학생들이 고데기나 충전기 등을 꽂아둔 채로 외출하는 경우가 많아."", ""categories"": ""Statement"", ""type"": ""Information"", ""knowledge"": ""Students often leave devices like hair straighteners or chargers plugged in when they leave."", ""evaluation"": {""specificity"": 6, ""justification"": 5, ""active"": 0, ""sentiment"": 0}}, {""sentence"": ""이러한 전기들은 충분히 학생증을 활용한 제어 시스템으로 절약할 수 있을 것 같다"", ""categories"": ""Statement"", ""type"": ""Recommendation"", ""knowledge"": ""A student ID-based control system can help save electricity."", ""evaluation"": {""specificity"": 5, ""justification"": 5, ""active"": 6, ""sentiment"": 1}}]}, ""response"": {""answer"": ""맞아요, 책상 위에 마련된 전기 콘센트들을 학생증으로 제어하면 에너지를 많이 절약할 수 있겠네요. 상시적으로 켜둬야 하는 제품들은 제외하고 설정하면 더 효율적일 것 같아요.""}}"
2,2024-08-12 4:28:59,student_question,"{""question"": ""에어컨과 전등 외에 통합 제어 시스템을 적용할 수 있는 다른 기기나 방법이 있을까요?""}"
2,2024-08-12 4:29:27,update_idea,"{""title"": ""기숙사 탄소 배출 감소를 위한 통합 에너지 관리 시스템"", ""problem"": ""기숙사에서 일부 학생들은 외출 시 에어컨을 켜 놓고 가거나 에어컨의 온도를 최저로 설정하여 운영함으로써, 대량의 전력 낭비가 발생합니다. 이는 전체 기숙사의 에너지 소비를 높이고, 결과적으로 탄소 배출량을 증가시킵니다."", ""idea"": ""기존 학생증 출입 시스템을 활용하여, 각 객실의 에어컨, 조명, 그리고 특정 전기 콘센트들을 자동으로 제어하는 통합 에너지 관리 시스템을 개발합니다. 이 시스템은 학생이 객실을 나설 때 자동으로 필요하지 않는 기기들을 꺼서 에너지를 절약합니다. 또한, 에어컨은 외출 시 자동으로 설정 온도를 올리고, 복귀 예정 시간 전에 원래 설정 온도로 조절하여 연속적으로 가동하는 것 보다 효율적으로 에너지를 사용합니다. 학생들의 에어컨 사용 습관과 선호하는 온도를 조사하여 이 데이터를 기반으로 최적의 자동 온도 설정범위를 결정합니다. 따라서 과도한 낭비를 줄이고, 사용자가 비효율적으로 전원을 켜둘 가능성을 최소화합니다. 추가적으로, 비필수 제품(충전기나 고데기 등)이 꽂혀 있는 콘센트의 전력 공급도 외출 시 차단되며, 필수적인 기기(예: 냉장고)가 연결된 콘센트는 자동으로 제외됩니다. 이 시스템을 통해 학생들은 더 효율적으로 에너지를 사용하면서 생활의 편리함을 유지할 수 있으며, 기숙사 전체의 탄소 발자국을 줄일 수 있습니다.""}"
2,2024-08-12 4:31:30,user_feedaback,"{""user_input"": ""통합 제어 시스템이라고 하니 생각 났는데, 기숙사에 있는 공용공간에도 이를 적용할 수 있을 것 같아. 보통 휴게실이나 스터디룸 같은 경우, 사람들이 사용하고 나가면서 전등이나 에어컨을 끄지 않고 그냥 나가는 경우가 많거든. 이러한 경우에도 제어 시스템을 적용할 수 있을 것 같아"", ""category"": [{""sentence"": ""통합 제어 시스템이라고 하니 생각 났는데, 기숙사에 있는 공용공간에도 이를 적용할 수 있을 것 같아."", ""categories"": ""Statement"", ""type"": ""Recommendation""}, {""sentence"": ""보통 휴게실이나 스터디룸 같은 경우, 사람들이 사용하고 나가면서 전등이나 에어컨을 끄지 않고 그냥 나가는 경우가 많거든."", ""categories"": ""Statement"", ""type"": ""Information""}, {""sentence"": ""이러한 경우에도 제어 시스템을 적용할 수 있을 것 같아"", ""categories"": ""Statement"", ""type"": ""Recommendation""}], ""new_knowledge"": [""Consider expanding the application of your system to other common areas."", ""People often forget to turn off electrical devices when leaving a room."", ""Consider the potential for applying control systems in various scenarios.""], ""new_actionPlan"": [""Explore the feasibility of implementing the energy management system in common areas of the dormitory."", ""Implement a system that automatically turns off electrical devices when users leave the room."", ""Explore additional scenarios where the control system can be effectively applied to enhance energy efficiency.""], ""new_thinking"": ""통합 제어 시스템을 기숙사 공용공간에도 적용할 수 있을까? 사람들은 방을 나갈 때 전기 기기를 끄는 것을 자주 잊는구나. 다양한 상황에서도 제어 시스템을 적용할 수 있는 가능성을 고려해야겠어."", ""evaluation"": {""sentences"": [{""sentence"": ""통합 제어 시스템이라고 하니 생각 났는데, 기숙사에 있는 공용공간에도 이를 적용할 수 있을 것 같아."", ""categories"": ""Statement"", ""type"": ""Recommendation"", ""knowledge"": ""The integrated control system can be applied to common areas in dormitories."", ""evaluation"": {""specificity"": 5, ""justification"": 4, ""active"": 5, ""sentiment"": 1}}, {""sentence"": ""보통 휴게실이나 스터디룸 같은 경우, 사람들이 사용하고 나가면서 전등이나 에어컨을 끄지 않고 그냥 나가는 경우가 많거든."", ""categories"": ""Statement"", ""type"": ""Information"", ""knowledge"": ""People often leave lights or air conditioners on in common areas like lounges or study rooms."", ""evaluation"": {""specificity"": 5, ""justification"": 4, ""active"": 0, ""sentiment"": 0}}, {""sentence"": ""이러한 경우에도 제어 시스템을 적용할 수 있을 것 같아"", ""categories"": ""Statement"", ""type"": ""Recommendation"", ""knowledge"": ""The control system can be applied to situations where people leave lights or air conditioners on in common areas."", ""evaluation"": {""specificity"": 4, ""justification"": 4, ""active"": 5, ""sentiment"": 1}}]}, ""response"": {""answer"": ""아, 공용공간에도 제어 시스템을 적용하는 건 좋은 생각이에요! 휴게실이나 스터디룸같이 자주 사용되지만 관리가 부족한 공간에서도 에너지 절약이 가능할 것 같아요! 학생증을 활용해 특정 시간에만 작동하도록 설정하면 효율적일 것 같네요.""}}"
