user_id,timestamp,tag,data
2,2024-08-12 4:33:33,user_feedaback,"{""user_input"": ""하지만 휴게실의 경우, 동시간대에 여러 사람이 한 공간을 사용할 수도 있잖아? 근데 학생증으로 제어를 한다면 학생증 분실우려도 있고, 학생증을 꽂아둔 사람이 먼저 나가게되면 휴게실에 남아있는 사람이 자신의 학생증을 다시 꽂아야하는 불편함이 있어.. 이정도는 감수를 해야할까? 조금 더 나은 해결방안이 있을 것 같은데..."", ""category"": [{""sentence"": ""하지만 휴게실의 경우, 동시간대에 여러 사람이 한 공간을 사용할 수도 있잖아?"", ""categories"": ""Question"", ""type"": ""Low-Level""}, {""sentence"": ""근데 학생증으로 제어를 한다면 학생증 분실우려도 있고, 학생증을 꽂아둔 사람이 먼저 나가게되면 휴게실에 남아있는 사람이 자신의 학생증을 다시 꽂아야하는 불편함이 있어.."", ""categories"": ""Statement"", ""type"": ""Evaluation""}, {""sentence"": ""이정도는 감수를 해야할까?"", ""categories"": ""Question"", ""type"": ""Judgmental""}, {""sentence"": ""조금 더 나은 해결방안이 있을 것 같은데..."", ""categories"": ""Question"", ""type"": ""Proposal/Negotiation""}], ""new_knowledge"": [""Consider the varying usage patterns of shared spaces when designing control systems."", ""Consider the potential inconvenience for users when implementing control systems."", ""Evaluating the degree of control needed can optimize system efficiency."", ""Exploring alternative solutions can lead to better outcomes.""], ""new_actionPlan"": [""Investigate the usage patterns of shared spaces to optimize the control system for different times of the day."", ""Evaluate the user experience and potential inconveniences of the control system to ensure it is user-friendly."", ""Assess the necessary level of control for each device to ensure optimal energy savings without compromising user comfort."", ""Investigate other potential solutions that might be more effective for energy management.""], ""new_thinking"": ""공용 공간의 사용 패턴이 다를 수 있다는 점을 고려해야겠어. 사용자에게 불편함을 줄 수 있는 요소를 고려해야겠어. 어느 정도의 제어가 필요한지 평가하는 것이 시스템 효율성을 최적화할 수 있겠어. 다른 해결방안을 탐구하면 더 나은 결과를 얻을 수 있겠어."", ""evaluation"": {""sentences"": [{""sentence"": ""하지만 휴게실의 경우, 동시간대에 여러 사람이 한 공간을 사용할 수도 있잖아?"", ""categories"": ""Question"", ""type"": ""Low-Level"", ""knowledge"": ""Multiple people may use the common room simultaneously."", ""evaluation"": {""timely"": 5, ""relevance"": 5, ""high-level"": 1, ""specificity"": 0, ""justification"": 0, ""active"": 0, ""sentiment"": 0}}, {""sentence"": ""근데 학생증으로 제어를 한다면 학생증 분실우려도 있고, 학생증을 꽂아둔 사람이 먼저 나가게되면 휴게실에 남아있는 사람이 자신의 학생증을 다시 꽂아야하는 불편함이 있어.."", ""categories"": ""Statement"", ""type"": ""Evaluation"", ""knowledge"": ""Using student ID cards for control may lead to issues like card loss and inconvenience if the cardholder leaves first."", ""evaluation"": {""timely"": 0, ""relevance"": 0, ""high-level"": 0, ""specificity"": 6, ""justification"": 6, ""active"": 5, ""sentiment"": -1}}, {""sentence"": ""이정도는 감수를 해야할까?"", ""categories"": ""Question"", ""type"": ""Judgmental"", ""knowledge"": ""Consideration of whether the inconvenience is acceptable."", ""evaluation"": {""timely"": 5, ""relevance"": 5, ""high-level"": 3, ""specificity"": 0, ""justification"": 0, ""active"": 0, ""sentiment"": 0}}, {""sentence"": ""조금 더 나은 해결방안이 있을 것 같은데..."", ""categories"": ""Question"", ""type"": ""Proposal/Negotiation"", ""knowledge"": ""There might be a better solution."", ""evaluation"": {""timely"": 5, ""relevance"": 5, ""high-level"": 4, ""specificity"": 0, ""justification"": 0, ""active"": 0, ""sentiment"": 0}}]}, ""response"": {""answer"": ""음, 휴게실 같은 다중 이용공간에서는 제어 방식이 조금 불편할 수도 있겠네요. 휴게실에는 동작 감지 센서를 설치해서, 일정 시간 동안 움직임이 없을 때 자동으로 전등과 에어컨을 끄는 방식은 어떨까요? 그러면 더 편리하게 에너지를 절약할 수 있을 것 같아요.""}}"
2,2024-08-12 4:35:23,user_feedaback,"{""user_input"": ""에어컨을 동작 감지 센서만으로 전원을 끄고 키는 방식은 아까 말했듯이 오히려 비효율적일 수도 있을 것 같아. 동작 감지 센서 이외에 공간 내 사람의 유무를 판단할 수 있는 다른 센서를 함께 사용하는 것은 어떨까?"", ""category"": [{""sentence"": ""에어컨을 동작 감지 센서만으로 전원을 끄고 키는 방식은 아까 말했듯이 오히려 비효율적일 수도 있을 것 같아."", ""categories"": ""Statement"", ""type"": ""Evaluation""}, {""sentence"": ""동작 감지 센서 이외에 공간 내 사람의 유무를 판단할 수 있는 다른 센서를 함께 사용하는 것은 어떨까?"", ""categories"": ""Question"", ""type"": ""Generate Design""}], ""new_knowledge"": [""Evaluating the efficiency of different control methods is crucial for optimizing system performance."", ""Exploring alternative sensors can enhance the accuracy of user presence detection.""], ""new_actionPlan"": [""Investigate the efficiency of using motion sensors versus other control methods for managing energy consumption in shared spaces."", ""Investigate and integrate additional sensors to improve the accuracy of detecting user presence in shared spaces.""], ""new_thinking"": ""다양한 제어 방법의 효율성을 평가하는 것이 시스템 성능 최적화에 중요하구나. 다른 센서를 활용하면 사용자 존재 감지의 정확성을 높일 수 있겠어!"", ""evaluation"": {""sentences"": [{""sentence"": ""에어컨을 동작 감지 센서만으로 전원을 끄고 키는 방식은 아까 말했듯이 오히려 비효율적일 수도 있을 것 같아."", ""categories"": ""Statement"", ""type"": ""Evaluation"", ""knowledge"": ""Using only motion sensors to control the air conditioner might be inefficient."", ""evaluation"": {""specificity"": 5, ""justification"": 4, ""active"": 3, ""sentiment"": -1}}, {""sentence"": ""동작 감지 센서 이외에 공간 내 사람의 유무를 판단할 수 있는 다른 센서를 함께 사용하는 것은 어떨까?"", ""categories"": ""Question"", ""type"": ""Generate Design"", ""knowledge"": ""Consider using additional sensors to detect the presence of people in the space."", ""evaluation"": {""timely"": 6, ""relevance"": 6, ""high-level"": 5, ""specificity"": 0, ""justification"": 0, ""active"": 0, ""sentiment"": 1}}]}, ""response"": {""answer"": ""아, 맞아요. 동작 감지 센서 외에 CO2 센서나 온도 센서 같이 공간 내 사람의 존재 여부를 더 정확하게 판단할 수 있는 다른 센서를 활용하면 더 효과적일 것 같아요. 다양한 센서를 조합하여 시스템의 정확도를 높여 에너지를 더 효율적으로 절약할 수 있을 거예요!""}}"
2,2024-08-12 4:35:24,student_question,"{""question"": ""동작 감지 센서 외에 사용자의 유무를 판단할 수 있는 다른 센서들로는 어떤 것들이 있을까요? 이 센서들을 사용하면 어떤 장점이 있을까요?""}"
2,2024-08-12 4:36:02,update_idea,"{""title"": ""기숙사 탄소 배출 감소를 위한 통합 에너지 관리 시스템"", ""problem"": ""기숙사 등 학교 시설에서 과도하게 에너지를 소비하는 문제를 해결해야 합니다. 특히, 학생들이 개인적인 전기비 부담이 없기 때문에 에어컨과 전기기기 사용에 있어서 낭비가 심각합니다. 또한, 기존의 자동 제어 시스템은 학생들의 생활 패턴을 반영하지 못하고, 공용공간에서의 에너지 관리도 비효율적입니다."", ""idea"": ""학생증을 이용한 에너지 관리 시스템을 도입하여 각 객실뿐만 아니라 공용 공간에서도 에너지 소비를 최적화할 수 있습니다. 각 방에서는 학생이 방을 나설 때 필요하지 않은 전등, 에어컨, 일반 콘센트에 연결된 전자기기의 전원을 자동으로 차단합니다. 이 시스템은 학생의 생활 패턴과 선호 온도를 분석하여 에너지 소비를 최적화하고, 공용 공간에는 인원 감지 센서와 CO2 센서를 설치하여 실제 사용자의 유무에 따라 에너지를 관리합니다. 또한, 고데기나 충전기 등 비필수 전자기기의 전원 공급을 필요할 때만 활성화하여 전력 낭비를 줄이고, 필수적인 기기에 연결된 콘센트는 자동으로 제외되는 시스템을 구축합니다. 이와 함께 공용공간에서도 동일한 시스템을 적용하여, 사람이 없을 때 자동으로 전등과 에어컨이 꺼지도록 합니다. 이렇게 통합적으로 에너지 관리를 실시함으로써 기숙사 전체의 탄소 배출 감소를 도모할 수 있습니다.""}"
2,2024-08-12 4:37:24,user_feedaback,"{""user_input"": ""센서에 대해서는 잘 모르겠네... 아니면 해당 공간들에서는 사람들이 보통 의자에 앉아서 시간을 보내니 의자에 압력 센서를 설치하거나 할수도 있지 않을까? 하지만 효율적일지는 모르겠어"", ""category"": [{""sentence"": ""아니면 해당 공간들에서는 사람들이 보통 의자에 앉아서 시간을 보내니 의자에 압력 센서를 설치하거나 할수도 있지 않을까?"", ""categories"": ""Question"", ""type"": ""Generate Design""}, {""sentence"": ""하지만 효율적일지는 모르겠어"", ""categories"": ""Statement"", ""type"": ""Evaluation""}], ""new_knowledge"": [""Consider the specific activities and behaviors in different spaces when designing control systems."", ""Evaluating the efficiency of different control methods is crucial for optimizing system performance.""], ""new_actionPlan"": [""Analyze the typical activities and behaviors in various spaces to determine the most suitable control mechanisms for each area."", ""Assess the efficiency of various control methods to determine the most effective approach for your system.""], ""new_thinking"": ""다양한 공간에서의 활동과 행동을 고려해야 해! 다양한 제어 방법의 효율성을 평가하는 것이 시스템 성능을 최적화하는 데 중요하구나."", ""evaluation"": {""sentences"": [{""sentence"": ""아니면 해당 공간들에서는 사람들이 보통 의자에 앉아서 시간을 보내니 의자에 압력 센서를 설치하거나 할수도 있지 않을까?"", ""categories"": ""Question"", ""type"": ""Generate Design"", ""knowledge"": ""Pressure sensors on chairs can detect occupancy."", ""evaluation"": {""timely"": 6, ""relevance"": 7, ""high-level"": 5, ""specificity"": 0, ""justification"": 0, ""active"": 0, ""sentiment"": 1}}, {""sentence"": ""하지만 효율적일지는 모르겠어"", ""categories"": ""Statement"", ""type"": ""Evaluation"", ""knowledge"": ""The efficiency of the proposed solution is uncertain."", ""evaluation"": {""timely"": 0, ""relevance"": 0, ""high-level"": 0, ""specificity"": 5, ""justification"": 4, ""active"": 3, ""sentiment"": 0}}]}, ""response"": {""answer"": ""의자에 압력 센서를 설치하는 것도 괜찮네요! 공간 내 움직임이 적더라도 사람의 존재를 감지할 수 있으니까요. 하지만 설치와 유지보수 비용이 걱정되긴 해요.""}}"
2,2024-08-12 4:38:19,user_feedaback,"{""user_input"": ""나도 그 점이 부족하다고 생각해. 더 효과적이고 유지보수가 쉬운 다른 센서를 생각해보는 게 좋을 것 같아"", ""category"": [{""sentence"": ""나도 그 점이 부족하다고 생각해."", ""categories"": ""Statement"", ""type"": ""Evaluation""}, {""sentence"": ""더 효과적이고 유지보수가 쉬운 다른 센서를 생각해보는 게 좋을 것 같아"", ""categories"": ""Statement"", ""type"": ""Recommendation""}], ""new_knowledge"": [""Identifying and addressing potential shortcomings in a design is crucial for improvement."", ""Exploring alternative sensors can lead to more efficient and maintainable systems.""], ""new_actionPlan"": [""Review the current design to identify any potential shortcomings and address them to enhance the system's effectiveness."", ""Research and evaluate different types of sensors that can be used to detect user presence more accurately and with less maintenance.""], ""new_thinking"": ""디자인의 잠재적인 단점을 식별하고 해결하는 것이 중요하구나. 다른 센서를 탐색하면 더 효율적이고 유지보수가 쉬운 시스템을 만들 수 있겠어."", ""evaluation"": {""sentences"": [{""sentence"": ""나도 그 점이 부족하다고 생각해."", ""categories"": ""Statement"", ""type"": ""Evaluation"", ""knowledge"": ""The mentor agrees that the current approach has a shortcoming."", ""evaluation"": {""specificity"": 3, ""justification"": 2, ""active"": 1, ""sentiment"": 0}}, {""sentence"": ""더 효과적이고 유지보수가 쉬운 다른 센서를 생각해보는 게 좋을 것 같아"", ""categories"": ""Statement"", ""type"": ""Recommendation"", ""knowledge"": ""The mentor suggests considering more effective and easier-to-maintain sensors."", ""evaluation"": {""specificity"": 4, ""justification"": 3, ""active"": 5, ""sentiment"": 1}}]}, ""response"": {""answer"": ""다른 센서 중에서 온도 변화 감지 센서나 소리 감지 센서를 활용하는 것도 방법이에요. 이 센서들은 유지보수가 비교적 쉽고, 사람의 움직임뿐만 아니라 다른 활동을 통해서도 유무를 감지할 수 있어요.""}}"
2,2024-08-12 4:38:50,update_idea,"{""title"": ""기숙사 탄소 배출 감소를 위한 통합 에너지 관리 시스템"", ""problem"": ""기숙사에서 학생들이 전기세 부담이 없기 때문에 에너지를 과도하게 사용하며, 이는 공간별로 다양한 활동과 행동 패턴에 따라 효율적인 에너지 관리가 이루어지지 않아 발생합니다. 이로 인해 불필요한 에너지 사용이 많아지고, 탄소 배출량이 증가합니다."", ""idea"": ""학생증과 다양한 센서를 활용하여 유지보수가 쉽고 사용자의 유무를 정확하게 감지할 수 있는 통합 에너지 관리 시스템을 도입합니다. 사용자의 생활 패턴과 선호도를 분석하여 각 공간별 최적의 에너지 소비를 실현합니다. 예를 들어, 개별 방에서는 학생이 외출할 때 자동으로 비필수 전자기기의 전원을 차단하고, 에어컨은 사용자가 설정한 온도 범위 내에서 효율적으로 조절됩니다. 공용 공간에서는 사람의 유무를 감지하는 최신 센서를 설치하여, 사람이 없을 경우 자동으로 에너지 사용을 중지합니다. 이로 인해 전체적인 탄소 배출 감소를 도모하며, 기숙사 내에서 지속 가능한 에너지 사용 환경을 조성합니다. 또한, 공용 공간에서는 온도 센서와 소리 감지 센서를 통합하여, 다양한 상황에서도 정확하게 사용자의 유무를 판단할 수 있는 체계를 구축합니다. 이러한 다양한 접근과 첨단 기술의 결합은 기숙사의 에너지 관리 효율성을 크게 향상시킬 것입니다.""}"
2,2024-08-12 4:38:57,finish,