user_id,timestamp,sentence,categories,type,evaluation.timely,evaluation.relevance,evaluation.high-level,evaluation.specificity,evaluation.justification,evaluation.active,evaluation.sentiment
6.0,2024-08-14 6:31:43,"동건님이 잘 말씀해주신 것처럼 학교나 복지 기관 관련자가 도움을 줄 수도 있고, 주변에 있는 동네 이웃이나 친구, 같이 살지 않는 친척 등이 도움이 될 수 있겠죠.",Statement,Information,,,,5.0,5.0,0.0,1
,,이런 다양한 이해관계자를 고려하는 것이 중요해요.,Statement,Recommendation,,,,4.0,4.0,4.0,1
,,너무 좋아요!,Statement,Evaluation,,,,1.0,1.0,1.0,1
,,아주 구체적이면서 다양한 방향으로 아이디어를 내봤네요?,Statement,Evaluation,,,,3.0,2.0,1.0,1
,,훌륭한 학생입니다...,Statement,Evaluation,,,,1.0,1.0,1.0,1
,,"말씀해준 통합적인 접근 방식으로 3가지를 모두 실현하면 정말 좋겠지만, 동건님의 프로젝트 듀가 이번 학기 말이기 때문에 셋 중에 한 가지 방향으로 구체화하는 걸 목표로 잡는 게 더 좋겠어요.",Statement,Recommendation,,,,5.0,5.0,5.0,1
,,"첫 번째로 말한 스마트홈 기술을 활용하여 가정 환경을 감시하는 것, 또는 두 번째로 말한 학교와 복지 기관에서 사용할 수 있는 아동 학대 예방 교육 프로그램과 앱을 개발하는 것 중 한 가지로 좁혀봅시다.",Statement,Recommendation,,,,5.0,5.0,5.0,1
,,개인적으로는 두 번째 방향성이 실제로 더 효과가 있을 것 같아서 두 번째 방향성을 추천합니다.,Statement,Recommendation,,,,5.0,5.0,5.0,1
,,"현재 학교 등 기관에서 아동 학대 예방 교육 프로그램을 만들어 사용하고 있는데,",Statement,Information,,,,5.0,4.0,3.0,0
,,기존에 있는 프로그램을 어떻게 활용할 수 있을지를 먼저 살펴봅시다.,Statement,Recommendation,,,,5.0,5.0,6.0,1
7.0,2024-08-12 2:21:21,아이디어 자체는 정말 필요하고 좋은 아이디어 같아요!,Statement,Evaluation,,,,2.0,1.0,1.0,1
7.0,2024-08-12 2:22:30,요즘 이런 문제들이 자주 일어나고 있으니 이에 공감하는 사람이 많을 것이라 생각해요!,Statement,Evaluation,,,,3.0,4.0,2.0,1
7.0,2024-08-12 2:23:29,하지만 우려되는 사항들이 조금 있어요,Statement,Evaluation,,,,2.0,3.0,2.0,-1
7.0,2024-08-12 2:24:46,"일단 이러한 플랫폼을 통해 반려동물을 입양하는 것이 법적으로 강제되는 것이 아니기 때문에 사람들의 입장에서는 다양한 플랫폼 중에 원하는 플랫폼을 선택하여 입양하게 될텐데,",Statement,Evaluation,,,,5.0,5.0,3.0,0
7.0,2024-08-12 2:24:47,그렇게 되면 입양 전 절차가 까다로운 해당 플랫폼은 유저들에게 상당히 불편하지 않을까요?,Question,Deep Reasoning,5.0,5.0,5.0,,,,0
7.0,2024-08-12 2:26:04,좀 더 신중한 입양을 위한 절차니 해당 부분이 사라지면 이 플랫폼의 가치도 사라지는 것 같기는 합니다.,Statement,Evaluation,,,,5.0,6.0,3.0,0
7.0,2024-08-12 2:27:50,따라서 이러한 불편함을 상쇄할 수 있는 이득을 사람들에게 어떻게 줄 수 있을지 생각해보는 것이 좋을 것 같아요!,Statement,Recommendation,,,,4.0,5.0,6.0,1
7.0,2024-08-12 2:27:51,나쁘지는 않은 것 같아요!,Statement,Evaluation,,,,2.0,1.0,1.0,1
7.0,2024-08-12 2:29:11,다만 사람들이 해당 플랫폼을 사용하게 만들기 위해서는 좀 더 충분한 검증이 필요해보이네요!,Statement,Recommendation,,,,4.0,3.0,4.0,0
7.0,2024-08-12 2:31:14,그래도 평소 이러한 문제에 관심을 가지던 사람들에게는 매력적인 재품이 될 것 같아요.,Statement,Evaluation,,,,3.0,2.0,2.0,1
7.0,2024-08-12 2:32:30,그러한 테스트들을 통해서 사람들이 어떻게 하면 앞서 언급한 불편함에도 불구하고 플랫폼을 사용할지 알아내면 좋을 것 같아요!,Statement,Recommendation,,,,5.0,4.0,5.0,1
7.0,2024-08-12 2:33:11,네 그런식으로 반려동물에 관한 다방면의 문제들을 신경쓴다면 브랜드의 이미지적으로도 좋을 것 같네요.,Statement,Evaluation,,,,5.0,4.0,3.0,1
7.0,2024-08-12 2:34:25,"또한 입양 전 평가를 마치 MBTI를 검사하듯이 자신은 어떤 유형의 주인인지, 어떤 종과 잘 어올리는지 등을 알 수 있는 테스트 형식으로 만든다면 사람들이 덜 귀찮아하며 재미있게 검사할 수 있지 않을까요?",Statement,Recommendation,,,,6.0,5.0,6.0,1
7.0,2024-08-12 2:36:11,해당 플랫폼을 운영하기 위해서는 많은 전문가 및 기업의 인력이 필요해보이는데 실현 가능성에 대해서는 얼마나 생각해보았나요?,Question,Deep Reasoning,6.0,7.0,5.0,0.0,0.0,0.0,0
7.0,2024-08-12 2:36:57,또한 매출은 어떻게 만드는 플랫폼인가요?,Question,Low-Level,5.0,6.0,2.0,0.0,0.0,0.0,0
7.0,2024-08-12 2:37:46,프리미엄 서비스는 어떻게 차별화 되나요?,Question,Generate Design,5.0,5.0,4.0,0.0,0.0,0.0,0
7.0,2024-08-12 2:37:47,그렇다면 해당 프리미엄 서비스는 일반적으로 저 모든 서비스를 누리는데 지불해야하는 비용과 비교해보았을때 가격이 훨씬 저렴한 편인가요?,Question,Comparison,5.0,5.0,4.0,0.0,0.0,0.0,0
7.0,2024-08-12 2:40:41,그렇게 저렴하게 제공할 수 있는 이유는 무엇인가요?,Question,Deep Reasoning,5.0,5.0,5.0,0.0,0.0,0.0,0
7.0,2024-08-12 2:40:42,비용 대비 가치를 높일 수 있다는 부분에 대해서도 더 설명해주세요,Question,Deep Reasoning,5.0,5.0,5.0,0.0,0.0,0.0,0
7.0,2024-08-12 2:42:28,그럼 성장 초기에는 유저들이 많이 없을텐데 이러한 시기는 어떻게 넘어가실 예정인가요?,Question,Deep Reasoning,6.0,7.0,5.0,0.0,0.0,0.0,0
7.0,2024-08-12 2:44:17,"저는 마케팅 자체보다는 제품이 우선 완성되어있는지, 리텐션이 잘 나오는지 등을 먼저 체크할 것 같습니다.",Statement,Recommendation,,,,6.0,5.0,5.0,0
7.0,2024-08-12 2:44:19,마케팅은 유저들이 유입되는 속도를 높여주는데 기여하기는 하지만 제품이 충분히 매력적이지 않으면 사람들이 금방 빠져나가거든요.,Statement,Information,,,,5.0,6.0,4.0,0
7.0,2024-08-12 2:44:46,따라서 어느정도 초기에는 마케팅 비용을 최대한 절약하여 지표들을 확인하고 마케팅은 나중에 진행해도 괜찮다고 생각합니다.,Statement,Recommendation,,,,5.0,5.0,5.0,0
7.0,2024-08-12 2:45:01,마케팅 방법은 아까 언급했던 MBTI형식의 테스트를 진행하고 인스타그램 스토리에 게시하는 등의 방법을 활용하면 좋을 것 같아요.,Statement,Recommendation,,,,6.0,5.0,5.0,1
,,이런 유형의 테스트에서는 사람들이 자신이 어떤 유형의 사람인지 확인받고 이를 남에게 보여주고 싶어한다고 생각해요.,Statement,Information,,,,5.0,4.0,3.0,1
,,"보통 반려동물을 키우는 사람, 키우고 싶어하는 사람이라면 자신이 어떤 종의 동물들과 잘 맞는지, 자신의 성격은 어떠한지 등을 어필할 수 있는 내용 + 캐릭터가 있다면 인스타에 더 공유하고 싶게 만들 수 있을 것 같아요.",Statement,Recommendation,,,,5.0,4.0,5.0,1
,,네 맞습니다 그런 부분이 상당히 중요할 것 같아요!,Statement,Evaluation,,,,2.0,2.0,1.0,1
,,또한 테스트 이후에 플랫폼으로 연결되도록 만들면 자연스럽게 사람들이 플랫폼에 관심을 가질 것 같아요.,Statement,Recommendation,,,,5.0,5.0,5.0,1
,,또한 얼마나 좋은 주인인지를 테스트를 통해 점수를 확인할 수 있게 하고 랭킹 제도를 도입하는 것도 괜찮을 것 같아요.,Statement,Recommendation,,,,5.0,5.0,5.0,1
8.0,2024-08-13 4:24:47,"일단 내가 너의 아이디어를 보고 처음 느낀 거는, 강아지가 인간이랑 똑같이 음성으로써만 소통 한다고 생각을 하는 거 같애.",Statement,Evaluation,,,,5.0,4.0,3.0,0
8.0,2024-08-13 4:28:57,"물론 우리도 음성이 아닌 다른 몸짓 같은 거를 혹은 표정으로써도 소통 하지만, 개의 경우는 그 정도가 훨씬 크거든.",Statement,Information,,,,5.0,5.0,0.0,0
8.0,2024-08-13 4:28:59,알다시피 꼬리를 흔들 기도하고 입을 벌리고 헥헥거리기도 하고 혹은 강아지가에서 열을 거리는 그런 행동들도 보인단 말이야.,Statement,Information,,,,5.0,5.0,0.0,0
8.0,2024-08-13 4:30:09,그걸 똑같이 인간에게도 할 거고.,Statement,Information,,,,4.0,4.0,0.0,0
8.0,2024-08-13 4:31:19,그래서 울음 소리 만으로 부족해.,Statement,Evaluation,,,,4.0,4.0,3.0,0
8.0,2024-08-13 4:34:03,"다만 네 아이디어는 확실히 좋아, 그런 행동기제나 소통하는 데 있어 의미를 모르는 사람들이 많을 테니까.",Statement,Evaluation,,,,4.0,4.0,3.0,1
8.0,2024-08-13 4:35:45,"그래서 목줄에다가 음성 센서만 다는 것보다는, 전체적으로 몸짓을 인식을 해서 니가 말한 그런 아이디어를 구현 하는 게 더 좋을 거 같고.",Statement,Recommendation,,,,5.0,5.0,5.0,1
8.0,2024-08-13 4:35:46,"스피커나 앱을 통해 나오는 아이디어는 정말 나쁘지 않아, 필요한 앱일 것 같아.",Statement,Evaluation,,,,4.0,4.0,3.0,1
8.0,2024-08-13 4:37:17,목줄의 카메라를 적용 하면 강아지의 행동이 어디까지 볼 수 있는 거야?,Question,Low-Level,5.0,5.0,1.0,0.0,0.0,0.0,0
8.0,2024-08-13 4:37:39,꼬리도 볼 수 있어?,Question,Low-Level,5.0,5.0,1.0,0.0,0.0,0.0,0
8.0,2024-08-13 4:40:30,꼬리가 비언어적인 것 중에선 제일 큰 걸 차지하는지라.,Statement,Information,0.0,0.0,0.0,5.0,5.0,5.0,0
8.0,2024-08-13 4:40:31,이제 문제가 되는 거는 강아지마다 신체사이즈나 그런 게 다 다를 것 같단 말이야?,Question,Low-Level,5.0,5.0,1.0,0.0,0.0,0.0,0
8.0,2024-08-13 4:43:26,"그리고 질문 하고 싶은게 있는데, 이 앱 혹은 시스템이 24 시간 동안 계속 구동 되게 할 거야.",Question,Low-Level,5.0,5.0,1.0,0.0,0.0,0.0,0
8.0,2024-08-13 4:43:27,아니면 사용자가 근처에 같이 있는 동안 구현되게 할 거야?,Question,Low-Level,5.0,5.0,1.0,0.0,0.0,0.0,0
8.0,2024-08-13 4:45:30,만약 전자라면 그 센서의 배터리 같은 것도 고려를 해야 할 것 같아서.,Statement,Recommendation,0.0,0.0,0.0,6.0,6.0,6.0,0
8.0,2024-08-13 4:45:50,카메라 센서 같은 게 전력을 많이 잡아 먹을 거 아녀.,Statement,Information,0.0,0.0,0.0,5.0,5.0,5.0,0
8.0,2024-08-13 4:45:57,나도 사실 그게 걱정이라서.,Statement,Evaluation,,,,1.0,1.0,1.0,-1
,,일단은 이게 아이디어 초기니까 시제품 상에서는 그렇게 실시간 데이터 수지 24 시간 동안 못 하면 어떻게 할 거다 그런 거는 고민하지 말고 일단 만들어 보는 게 좋을 거 같애.,Statement,Recommendation,,,,5.0,5.0,5.0,1
,,아이디어 자체가 나쁘지는 않다고 보여가지고.,Statement,Evaluation,,,,1.0,1.0,1.0,1
,,"아직 검토를 해 보면서 생각한 게 있는데, 앱에 어떻게 번역된 메시지가 띄울지를 네가 아까 말을 했었잖아?",Statement,Evaluation,,,,4.0,3.0,2.0,0
,,그거도 잠깐 구체적으로 UI UX를 어떻게 디자인 할지를 생각을 해 볼 필요는 있을 것 같아.,Statement,Recommendation,,,,5.0,4.0,5.0,1
,,그게 딱 사람의 말로 다 표현 하기 보다는 중간 중간에 뭐 강아지가 이러이러한 상태입니다 라는 메시지를 경고창처럼 띄워 주거나 하는 것도 좋을 거 같고.,Statement,Recommendation,,,,5.0,4.0,5.0,1
,,그러니까 다 번역된 구어체로 표현은 못 할 거야 아마.,Statement,Evaluation,,,,4.0,3.0,2.0,0
,,그 점을 고려해가지고 앱 인터페이스 자체도 네가 아이디어에 포함을 해놓으면 좋을듯.,Statement,Recommendation,,,,5.0,4.0,5.0,1
,,최대한 심플하게.,Statement,Recommendation,,,,2.0,2.0,3.0,1
,,보통은 앱들이 막 디자인들이 지저분하고 그런 경우가 많거든?,Statement,Information,,,,3.0,3.0,0.0,0
,,"맨 밑에 유저 빨 다섯개 달려있고 아이콘 겁나 혼잡 하고, 메세지는 막 쌓여 있고 막 그런 게 많단 말이야.",Statement,Information,,,,4.0,4.0,0.0,0
,,"그래서 과감하게 뺄 내용은 빼거나, 알림창으로 다 몰아 넣거나 그런 설계가 필요할 거는 같아.",Statement,Recommendation,,,,4.0,4.0,4.0,1
,,일단 앱의 첫 화면에 그 개가 말하고픈 바가 한가운데 떠 있거나 하면 좋을 거 같거든?,Statement,Recommendation,,,,4.0,3.0,4.0,1
,,그런 거 고려해서 너가 아이디어에 포함해봐봐.,Statement,Recommendation,,,,3.0,2.0,3.0,1
,,그 화면에 있는 섹션마다 메세지 하나씩 들어가는 게 중요해.,Statement,Recommendation,,,,6.0,5.0,6.0,1
,,만약 어떤 섹션이 너무 많은 문장이나 아예 다른 범위의 메시지를 포함 한다면 그거는 사용자의 머릿속에 하나도 안 들어올 거야.,Statement,Evaluation,,,,6.0,6.0,5.0,0
,,그리고 만약 어떤 섹션에 들어가는 정보가 글이면 그게 세 행은 넘지 않게 해야지.,Statement,Recommendation,,,,6.0,5.0,6.0,1
9.0,2024-08-13 0:11:38,"현재는 나갈때 학생증을 찍지 않는데,",Statement,Information,,,,5.0,4.0,3.0,0
9.0,2024-08-13 0:13:40,나가면서 학생증을 찍으면서 생기는 학생들의 불편함은 생각해봤어?,Question,Deep Reasoning,5.0,5.0,5.0,,,,0
9.0,2024-08-13 0:14:38,"하루에 세번 꺼지는 지금 시스템을 유지하고,",Statement,Recommendation,,,,5.0,4.0,3.0,0
9.0,2024-08-13 0:16:14,추가로 이 시스템을 넣는건야?,Question,Generate Design,5.0,5.0,4.0,,,,0
9.0,2024-08-13 0:17:19,그럼 혹시 현재 학생들의 출입방법에 대해 찾아본건 있어?,Question,Low-Level,5.0,5.0,1.0,0.0,0.0,0.0,0
9.0,2024-08-13 0:17:47,학생들이 출입방법이 각자 다를거야.,Statement,Information,0.0,0.0,0.0,5.0,5.0,5.0,0
9.0,2024-08-13 0:19:05,"그리고 혹시 2인실인 경우에 모든 사람이 나갔을 경우에 에어컨이 꺼져야 하는데,",Statement,Information,,,,6.0,5.0,4.0,0
9.0,2024-08-13 0:19:06,이걸 역이용해서 한사람의 학생증으로만 출입을 하는 상황은 생각해봤어?,Question,Generate Design,5.0,6.0,5.0,,,,0
9.0,2024-08-13 0:20:11,이처럼 여러 상황을 생각해보면 좋을 것 같은데,Statement,Recommendation,,,,3.0,4.0,5.0,1
9.0,2024-08-13 0:21:08,"센서를 사용하는게 얼마나 효율적인지,",Question,Quantification,5.0,5.0,3.0,0.0,0.0,0.0,0
9.0,2024-08-13 0:21:09,어느정도의 탄소배출을 줄일 수 있는지 설명해줄 수 있어?,Question,Quantification,5.0,5.0,3.0,0.0,0.0,0.0,0
9.0,2024-08-13 0:22:20,그건 너가 찾아봐야지.,Statement,Evaluation,,,,1.0,1.0,1.0,0
9.0,2024-08-13 0:22:59,힌트를 주면 현재 자동문이나 화장실 센서에는 어떤게 사용되는지를 생각해봐,Statement,Recommendation,,,,5.0,5.0,5.0,1
9.0,2024-08-13 0:23:49,"다른 센서들도 많으니까 찾아보면 좋고,",Statement,Recommendation,,,,4.0,3.0,5.0,0
9.0,2024-08-13 0:25:07,관련 센서를 이용한 연구나 실제 사례를 조사하면서 센서를 결정해봐,Statement,Recommendation,,,,5.0,4.0,6.0,0
9.0,2024-08-13 0:25:09,"아까 설명한 것처럼 한명만 나가는 경우와, 한 명의 학생증으로 같이 출입을 하는 방법으로 에어컨을 계속 켜두는 문제가 발생할 수 있어.",Statement,Evaluation,,,,6.0,5.0,4.0,0
9.0,2024-08-13 0:26:09,다른 건 좀 찾아봐야할 것 같아,Statement,Recommendation,,,,2.0,2.0,3.0,0
9.0,2024-08-13 0:26:39,이 프로젝트 진행기간이랑 계획은 세워봤어?,Question,Low-Level,5.0,4.0,1.0,0.0,0.0,0.0,0
9.0,2024-08-13 0:28:36,일단 프로젝트 계획부터 세우자.,Statement,Recommendation,,,,3.0,2.0,4.0,0
9.0,2024-08-13 0:28:40,"계획을 세워야 진행상황을 확인하기 쉽고, 해야할 일을 까먹지 않고 할 수 있어",Statement,Recommendation,,,,4.0,4.0,4.0,1
9.0,2024-08-13 0:29:18,"관련 연구를 찾아보고, 기존 연구들을 바탕으로 시스템을 디자인하면 될 것 같아.",Statement,Recommendation,,,,4.0,3.0,5.0,1
9.0,2024-08-13 0:29:33,이전 논문이나 연구를 찾아보면 답을 찾을 수 있으니까 잘 찾아봐,Statement,Recommendation,,,,3.0,3.0,5.0,1
9.0,2024-08-13 0:29:59,생각해보니 화장실 자동 불꺼짐 센서 등 관련된 내용을 이미 실생활에 많이 사용하고 있는데 이게 과연 혁신적이라고 할 수 있을까?,Question,Generate Design,5.0,6.0,4.0,0.0,0.0,0.0,0
9.0,2024-08-13 0:30:30,이 프로젝트의 혁신성에 대해서 설명해봐,Question,Generate Design,5.0,6.0,4.0,0.0,0.0,0.0,0
9.0,2024-08-13 0:30:31,그건 너가 찾아봐야지,Statement,Recommendation,,,,1.0,1.0,1.0,0
9.0,2024-08-13 0:31:45,좋은 방법이야,Statement,Evaluation,,,,1.0,1.0,1.0,1
9.0,2024-08-13 0:33:22,근데 그거는 마지막에 하면 좋을 것 같아,Statement,Recommendation,,,,3.0,2.0,3.0,0
9.0,2024-08-13 0:33:33,출입 데이터를 관리하는 것과 관련해서 공부해본 경험은 있어?,Question,Low-Level,5.0,5.0,1.0,0.0,0.0,0.0,0
,,데이터 다루는게 쉽지 않을텐데,Statement,Evaluation,0.0,0.0,0.0,5.0,4.0,3.0,0
,,관련해서는 논문이나 연구를 찾아보면 좋을 것 같아.,Statement,Recommendation,,,,3.0,4.0,3.0,1
,,가장쉬운 방법은 사람들의 테이터를 이진수로 정리하는 방법이 있을 것 같네,Statement,Recommendation,,,,4.0,3.0,4.0,1
10.0,2024-08-12 12:12:32,"목표 문제가 사람들이 기다리는 과정과 많은 사람들과 함께 타면서 발생하는 부정적인 경험이 핵심인 것 같은데,",Statement,Evaluation,,,,6.0,5.0,4.0,0
10.0,2024-08-12 12:14:52,아이디어는 부정적인 경험을 개선하기보다는 탄소량에 집중하는 것 같아.,Statement,Evaluation,,,,6.0,5.0,4.0,0
10.0,2024-08-12 12:14:53,그래서 나는 목표 문제와 아이디어가 그렇게 잘 정렬되지 않는다는 인상을 받았어.,Statement,Evaluation,,,,5.0,5.0,3.0,0
10.0,2024-08-12 12:16:57,"아이디어를 목표 문제인 기다리는 과정에서의 귀찮음, 많은 사람들과 이용하는 데서 나오는 불쾌감과 짜증에 좀 더 초점을 맞춰주면 어떨까?",Statement,Recommendation,,,,6.0,5.0,6.0,1
10.0,2024-08-12 12:19:39,"일단 사람들이 왜 혼잡한 저탄소 교통에서 불쾌감을 느끼는지, 그 이유를 정리하면서 같이 생각해보자.",Question,Deep Reasoning,6.0,7.0,5.0,0.0,0.0,0.0,0
10.0,2024-08-12 12:20:49,고려할 점으로 좋은 요소를 많이 제시한 것 같아.,Statement,Evaluation,,,,3.0,3.0,2.0,1
10.0,2024-08-12 12:22:44,"그런데 사람들이 많이 사용하는 날씨 애플리케이션 같은 경우에도 여러 요소를 고려해서 불쾌지수나 미세먼지 수준(좋음, 보통, 나쁨) 같은 식으로 사람들이 대략적인 정도를 바로 알 수 있는 간단한 종합 지표를 제시하곤 하는데,",Statement,Information,,,,4.0,4.0,2.0,1
10.0,2024-08-12 12:25:37,시각화를 한다면 첫 화면에서는 종합 지표로 한눈에 볼 수 있고 어떤 요소라 이 결과에 영향을 줬는지는 더 알아보고 싶은 사람들이 열람할 수 있는 형식이면 어떨까?,Statement,Recommendation,,,,5.0,5.0,5.0,1
10.0,2024-08-12 12:26:48,"맞아, 사용자에게 한 화면에 너무 많은 정보를 담으면 피로감이 심하니까 그런 부분에서 신경쓰면 사용자 경험에도 좋은 영향을 주는 것 같아.",Statement,Recommendation,,,,5.0,5.0,4.0,1
10.0,2024-08-12 12:26:50,"그리고 동건이 네가 처음 제시한 아이디어는 사람들의 불쾌감을 완화하는 것 외에도, 이 서비스를 통해 저탄소 교통을 이용함으로써 사람들이 환경에 기여하는 정도를 시각화 자료로 직접 체감할 수 있도록 해서 사람들이 더 적극적으로 저탄소 교통을 이용할 수 있도록 독려하는 것 같은데",Question,Verification,6.0,7.0,5.0,0.0,0.0,0.0,1
10.0,2024-08-12 12:27:36,내가 이해한 게 적절할까?,Question,Judgmental,6.0,7.0,5.0,0.0,0.0,0.0,1
10.0,2024-08-12 12:28:32,"그 부분에서 사람들이 '내가 저탄소 교통을 이용하는 게 이런 도움이 되는구나'라는 게 더 체감이 되려면, 단순 탄소량 수치보다는 1인당 발생 탄소량이 내가 저탄소 교통을 이용해서 줄인 만큼 감소했을 때 사람들의 일상에 미치는 변화로 비유하면 더 체감하기 좋을 것 같아.",Statement,Recommendation,,,,6.0,6.0,5.0,1
10.0,2024-08-12 12:29:40,"연평균 기온에 기여할 수 있는 정도라던지, 여름 열대야 기간이 감소하는 정도라던지, 태풍이 줄어드는 정도, 모기 수 같은 것 말이야.",Statement,Recommendation,,,,6.0,5.0,5.0,1
10.0,2024-08-12 12:30:15,너는 어떻게 생각해?,Question,Judgmental,5.0,5.0,4.0,,,,0
10.0,2024-08-12 12:32:09,"일단 내가 당장 생각한 예시는 앞에서 언급한 연평균 기온, 열대야 기간 변화, 태풍 같은 게 있는데,",Statement,Information,,,,6.0,5.0,4.0,1
10.0,2024-08-12 12:32:39,동건이 너는 혹시 떠오르는 예시가 있어?,Question,Generate Design,6.0,6.0,5.0,0.0,0.0,0.0,1
10.0,2024-08-12 12:34:06,다양한 후보를 만들고 점차 좁혀나가면 더 좋은 지표를 만들 수 있을 것 같아서!,Statement,Recommendation,,,,5.0,5.0,5.0,1
10.0,2024-08-12 12:34:07,사용자에게 적합한 결과물을 만들기 위해서는 일단 목표 사용자층에 대해 알아보는 게 도움이 될거야.,Statement,Recommendation,,,,5.0,5.0,5.0,1
10.0,2024-08-12 12:34:39,혹시 네가 생각해둔 목표 사용자층이 있어?,Question,Low-Level,5.0,5.0,1.0,,,,1
10.0,2024-08-12 12:34:43,"목표 사용자층을 그렇게 설정한 이유가 궁금한데, 좀 더 자세히 설명해줄래?",Question,Deep Reasoning,6.0,6.0,5.0,0.0,0.0,0.0,0
,,그럼 환경 보호에 관심이 많고 일상 생활을 효율적으로 관리하려는 경향이 있다는 특징은 어떻게 정하게 된거야?,Question,Deep Reasoning,6.0,7.0,5.0,0.0,0.0,0.0,0
,,"그렇구나, 그럼 탄소 절약과 개인의 효율성이 연결되는 지표가 있는지 앞에서 이야기했던 후보 중에서 살펴보자.",Statement,Recommendation,,,,5.0,4.0,5.0,1
,,나는 '저탄소 교통으로 몇 주 분의 전기를 절약한 효과'나 '자동차 배출가스로 인한 질병 발생 확률 감소'가 연결점이 있는 것 같아.,Statement,Evaluation,,,,5.0,4.0,0.0,1
,,"특히 이를 통해 절감한 전기 사용료라던지, 잠재적 의료비 같은 걸로 보여주면 효율성과 연결짓지 좋지 않을까?",Statement,Recommendation,,,,5.0,4.0,5.0,1
,,"내 생각에는 대략적인 방향성은 정한 것 같은데,",Statement,Evaluation,,,,3.0,2.0,1.0,0
,,이제 이 서비스의 실현 가능성을 높이기 위해 어떻게 지표를 모을 것인가에 대한 계획을 세우면 좋을 것 같아.,Statement,Recommendation,,,,4.0,3.0,5.0,1
,,이 서비스에서 이용하는 지표인 혼잡지수나 효율성 수치를 제공하기 위해 필요한 데이터는 무엇이 있을까?,Question,Low-Level,3.0,4.0,1.0,,,,0
,,그걸 정하고 나면 그 데이터를 어떻게 가공할지 고민해보자.,Statement,Recommendation,,,,3.0,2.0,4.0,1
11.0,2024-08-12 8:19:09,자식에게 유익하고 건강한 컨텐츠만을 제공해주고 싶은 부모님들의 수요를 잘 파악하신 것 같습니다.,Statement,Evaluation,,,,5.0,5.0,4.0,1
11.0,2024-08-12 8:21:29,필터링 익스텐션이 수요가 있다는게 충분한 설득력을 갖고 있군요,Statement,Evaluation,,,,4.0,5.0,4.0,1
11.0,2024-08-12 8:23:06,"다만 타겟으로 잡고 있는 스트리밍 서비스들 중 가장 큰 유튜브와 넷플릭스 등에는 이미 키즈모드라는, 동건 학생이 말한 기능들을 수행해주고 있는 서비스들이 제공되고 있습니다.",Statement,Information,,,,6.0,6.0,3.0,0
11.0,2024-08-12 8:23:57,동건 학생이 제안하는 서비스가 갖는 차별점은 뭐라고 생각하시나요?,Question,Comparison,6.0,7.0,5.0,,,,0
11.0,2024-08-12 8:25:18,그 추가설정을 좀 더 자세히 말씀해주실 수 있으실까요?,Question,Low-Level,5.0,5.0,1.0,0.0,0.0,0.0,0
11.0,2024-08-12 8:25:19,개인화 알고리즘을 곁들여 컨텐츠를 선택하는 방법을 좀 더 개인화할 수 있다는 점이 핵심이겠네요.,Statement,Evaluation,,,,5.0,4.0,3.0,1
11.0,2024-08-12 8:28:13,아이들이 본격적으로 폭력적이거나 선정적인 컨텐츠들에 노출되는 시기를 찾고 거기서 일어나는 변화들을 분석하는게 어떨까 싶습니다.,Statement,Recommendation,,,,5.0,4.0,5.0,0
11.0,2024-08-12 8:33:50,"강력하고 일관된 방침으로 컨텐츠들을 거르는 키즈모드와 같은 필터에서 벗어난 아이들의 연령대와 그 아이들이 어떤 컨텐츠를 소비하는지, 연령대 전반적인 컨텐츠 트렌드를 연구하는 것도 하나의 방법같아 보이네요.",Statement,Recommendation,,,,5.0,4.0,5.0,0
11.0,2024-08-12 8:33:51,"제 개인적인 의견을 하나 말씀드리자면, 컨텐츠를 주체적으로 소비하기 시작하는 아이들의 연령대가 점차 앞당겨지고 있는 추세라는걸 알고 계실겁니다.",Statement,Information,,,,5.0,4.0,3.0,0
11.0,2024-08-12 8:35:05,"그에 따라 부모의 알고리즘 통제가 함께 바뀌어야 하는데, 부모의 입장에서도 유연한 통제는 쉽지 않을 것이고, 또래와의 소통이 늘어나면서 부모의 통제에 대한 반발심도 중요한 요소라고 생각합니다.",Statement,Evaluation,,,,5.0,5.0,4.0,0
11.0,2024-08-12 8:36:05,이를 함께 신경써주시면 좋을 거 같습니다,Statement,Recommendation,,,,4.0,4.0,5.0,1
