user_id,timestamp,sentence,categories,type,evaluation.timely,evaluation.relevance,evaluation.high-level,evaluation.specificity,evaluation.justification,evaluation.active,evaluation.sentiment
11.0,2024-08-12 8:37:37,"부모는 다른 부모들에게서 의견을 묻고, 아이들은 또래들과 자신이 소비하는 컨텐츠를 공유합니다.",Statement,Information,,,,4.0,3.0,2.0,0
11.0,2024-08-12 8:38:13,소셜라이징 차원에서 할 수 있는 것들이 많아보이는데 어떻게 생각하세요?,Question,Generate Design,5.0,5.0,4.0,,,,0
11.0,2024-08-12 8:38:14,다른 부분에서 궁금하신 점 있으신가요,Question,Low-Level,3.0,2.0,1.0,0.0,0.0,0.0,0
11.0,2024-08-12 8:41:31,아쉽게도 선생님이 AI에 대해서 깊게 얘기해줄 수 있는건 동건 학생보다도 적을 수 있어요.,Statement,Information,,,,5.0,5.0,1.0,0
11.0,2024-08-12 8:41:35,관련 분야에 대한 질문이 있으시다면 이걸 잘 알고 있는 다른 선생님께 부탁드려볼게요.,Statement,Recommendation,,,,5.0,5.0,5.0,1
11.0,2024-08-12 8:41:59,괜찮을까요?,Question,Verification,5.0,5.0,3.0,,,,0
11.0,2024-08-12 8:43:23,마지막으로 하고싶으신 말씀 있나요?,Question,Low-Level,3.0,2.0,1.0,0.0,0.0,0.0,0
,,"자녀가 소비하는 컨텐츠를 어떻게 생각하는지는 부모마다 다를테고,",Statement,Information,,,,5.0,4.0,3.0,0
,,선생님 개인적으로는 어떤 설문도 그 트렌드를 잘 반영하진 못한다고 생각해요.,Statement,Evaluation,,,,4.0,4.0,2.0,-1
,,"가장 안전한 방법은 연령별로 소비해야 하는 컨텐츠에 대해 가이드라인을 국가에서 세워둔게 있을 테고, 의료기관에서 세운 게 있을 겁니다.",Statement,Information,,,,5.0,5.0,3.0,0
,,"최대한 많은, 신뢰도 있는 통계자료를 취합해 최대한 많은 사람들에게 설득력있는 기준을 세우는게 좋아보여요",Statement,Recommendation,,,,5.0,5.0,5.0,1
12.0,2024-08-13 12:11:57,"안녕 동건아, 너가 말해준 아이디어는 아동보호 서비스 기능을 제공하는 웨어러블 기기인것 같아.",Statement,Evaluation,,,,3.0,2.0,2.0,1
12.0,2024-08-13 12:13:38,혹시 이게 일반 시중에 팔리고 있는 웨어러블 기기와의 차별 점이 어떤것이라고 생각해?,Question,Comparison,5.0,5.0,4.0,,,,0
12.0,2024-08-13 12:16:21,"그런데 애플워치나 갤럭시 워치 같은 웨어러블 기기에는 이미 너가 말한 기능들이 존재하는걸로 알고 있어,",Statement,Evaluation,,,,6.0,5.0,3.0,0
12.0,2024-08-13 12:18:14,그렇다면 너의 아이디어는 같은 기능들을 조금더 아이들의 시각에서 흥미롭게 느껴지도록 만들면 좋을것 같다는 생각이들어.,Statement,Recommendation,,,,5.0,4.0,5.0,1
12.0,2024-08-13 12:18:15,예를 들어 아이들이 좋아할 만한 커스텀이 가능한 디자인이라던지 등의 아이디어가 더 추가되면 좋을것 같아,Statement,Recommendation,,,,6.0,5.0,6.0,1
12.0,2024-08-13 12:20:13,"좋아, 다만 너가 원래 해결하고자 했던 아동의 안전 문제도 중요하게 생각해야 할거야.",Statement,Evaluation,,,,5.0,6.0,4.0,1
12.0,2024-08-13 12:20:40,너무 엔터테인먼트 적인 요소에 치중하면 본질이 흐려질 수 도 있을거라 생각해.,Statement,Recommendation,,,,5.0,6.0,5.0,0
12.0,2024-08-13 12:25:30,"그런 방법들에는 지금 시중에 있는 제품들 처럼 웨어러블 디바이스의 스트랩을 소재 및 디자인을 다양하게 해서 선택할 수 있게 하던가,",Statement,Recommendation,,,,6.0,5.0,6.0,1
12.0,2024-08-13 12:25:32,"캐릭터를 집어넣을 수도 있을 것 같고,",Statement,Recommendation,,,,4.0,4.0,5.0,1
12.0,2024-08-13 12:29:02,다만 웨어러블 디바이스에서 성인처럼 사용하기 힘든 어린이들을 위해 더 단순하고 명료한 UI 구성 및 물리 버튼을 디자인해보는 방법들이 있을 것 같아,Statement,Recommendation,,,,6.0,6.0,6.0,1
12.0,2024-08-13 12:29:04,아이디어를 더 구체화하기 전에 target problem을 더 상세하게 적어보는건 어떨까?,Question,Generate Design,6.0,7.0,5.0,0.0,0.0,0.0,0
12.0,2024-08-13 12:30:12,"디자인에서 의사결정 과정에서 문제정의는 중요하거든, 여러개의 아이디어들 중에서 어떤 것을 선택하고 어떤것은 선택하지 않을지 고르는데 있어서 중요해.",Statement,Information,0.0,0.0,0.0,6.0,7.0,5.0,0
12.0,2024-08-13 12:31:18,그래서 나는 너가 적어준 것중 '기존의 웨어러블 기기들은 아동을 특별히 대상으로 한 기능이 부족하며' 라는 부분을 조금더 이유와 함께 적어보면 좋을것 같아,Statement,Recommendation,0.0,0.0,0.0,7.0,6.0,7.0,1
12.0,2024-08-13 12:35:16,우선 생각나는건 어떤 단어와 문장을 사용하는지야.,Statement,Recommendation,,,,5.0,4.0,5.0,1
12.0,2024-08-13 12:37:07,아이들은 성인들에 비해 어휘능력이 떨어지기 때문에 모든 표현들을 단순하고 명료하게 적어야해.,Statement,Recommendation,,,,6.0,6.0,6.0,1
12.0,2024-08-13 12:37:52,"두번째는 단순한 동작 방식이야, 횡 스크롤, 종 스크롤, 클릭 등 여러 액션을 사용하다 보면 아동들은 사용하는데 익숙해지기 어려워질 수도 있어.",Statement,Recommendation,,,,6.0,6.0,6.0,1
,,"마지막으로 생상이야, 강조하고 싶은 부분, 자주 사용하는 부분 등에 사용할 하이라이트 컬러들이 잘 구분되게 설정해야 할수도 있을것 같아",Statement,Recommendation,,,,5.0,5.0,5.0,1
,,너가 제공하려는 기능들을 정리해서 먼저 알려줘,Question,Low-Level,5.0,5.0,1.0,0.0,0.0,0.0,0
,,"그 종류와 성격, 그리고 개수에 따라 달라질 것 같아",Statement,Evaluation,0.0,0.0,0.0,5.0,5.0,5.0,0
,,GPS 추적과 마이크는 어떤 기능을 의미하는 거야?,Question,Definition,5.0,5.0,3.0,0.0,0.0,0.0,0
,,너가 생각해본 사용 예시와 함께 이야기해주면 좋을것 같아,Question,Example,5.0,5.0,3.0,0.0,0.0,0.0,0
,,"그럼 너가 말해준 기능들 중에 GPS 추적과 같이 항상 켜져있어야 하는건 화면에 항상 띄워주면 좋을 것 같고,",Statement,Recommendation,,,,6.0,5.0,6.0,1
,,응급 호출 버튼과 같이 모니터링 하는것이 아닌 것들은 바로 접근하지 않게 디자인 하면 좋을것 같아.,Statement,Recommendation,,,,6.0,5.0,6.0,1
,,특히나 응급 호출 버튼은 잘못 눌렀을때의 경우를 배제하기 위해 항상 화면에 띄우지 않으면 좋을것 같아,Statement,Recommendation,,,,6.0,5.0,6.0,1
13.0,2024-08-14 12:34:04,일상에서 이루어지는 행위를 이용해서 탄소배출을 줄이는 아이디어는 매우 좋구나!,Statement,Evaluation,,,,3.0,4.0,2.0,1
13.0,2024-08-14 12:40:56,그런데 조금 생각해보아야할 부분이 있어 보이는데 같이 얘기해보자.,Statement,Evaluation,,,,2.0,3.0,3.0,0
13.0,2024-08-14 12:42:31,우선 카드를 통해 학생을 인지하고 그 학생이 들어있는 방의 불과 에어컨을 연결해서 제어를 하기 위해서는 새로운 시스템을 도입해야할 것 같은데 이 부분이 현실적으로 가능할까?,Question,Generate Design,5.0,5.0,4.0,,,,0
13.0,2024-08-14 12:44:24,어떻게 생각해본 것이 있니?,Question,Generate Design,5.0,5.0,4.0,,,,0
13.0,2024-08-14 12:44:28,학생증 시스템이 어떻게 작동하는 것인지 먼저 알아야할 것 같은데,Statement,Evaluation,,,,5.0,5.0,4.0,0
13.0,2024-08-14 12:47:15,어떻게 작동하는 것인지 알고 있니?,Question,Low-Level,4.0,4.0,1.0,,,,0
13.0,2024-08-14 12:49:09,생각보다 사생활 보호가 안돼있는 시스템이네.,Statement,Evaluation,,,,5.0,4.0,3.0,-1
13.0,2024-08-14 12:53:02,그러면 이 개인정보에 기숙사 호수의 데이터를 추가하면 어쨌든 기숙사 호실의 데이터와는 연결할 수 있겠구나.,Statement,Information,,,,4.0,4.0,3.0,0
13.0,2024-08-14 12:54:30,그렇다면 반대로 에어컨과 불을 관리하는 것은 어떻게 이루어지는 것인지 알고 있니?,Question,Low-Level,4.0,5.0,2.0,,,,0
13.0,2024-08-14 12:54:32,"글쎄, 나는 중앙제어 시스템을 개인 데이터와 연결하고 조작할 수 있는 기술이나 경험이 없어서 이 부분에 대해서 기술적인 피드백을 해줄 수는 없어.",Statement,Information,,,,5.0,4.0,1.0,0
13.0,2024-08-14 12:58:59,"하지만 기숙사에서 개별 방의 온도를 각각 확인할 수 있다는 사실은 알고 있어서, 어쩌면 개별제어가 가능할 수 있을 것 같은데 이 기술적인 부분은 따로 확인하고 찾아봐야할 것 같아.",Statement,Recommendation,,,,5.0,5.0,5.0,1
13.0,2024-08-14 12:59:29,아이디어 면에서는 좋은데 다만 개인 정보가 실시간으로 학교에서 관리되어진다는 느낌이 들 것 같아서 학생들의 반발을 얻을 것 같다는 우려가 생겨.,Statement,Evaluation,,,,6.0,6.0,5.0,-1
13.0,2024-08-14 12:59:52,나도 기숙사 사는데 기숙사가 내 출입 상태에 따라 방의 상태를 제어한다고 생각하면 조금 부담스러울 것 같거든.,Statement,Evaluation,,,,5.0,5.0,4.0,-1
,,이런 경우에는 어떻게 설득할 수 있을까?,Question,Generate Design,6.0,6.0,5.0,,,,0
,,혹시 카드 출입증을 통한 제어 말고 다른 방법이 있을 수 있지 않을까?,Question,Generate Design,5.0,5.0,5.0,0.0,0.0,0.0,0
,,출입증을 활용하는 주 목적이 그 학생이 방에 있는지 없는지를 확인하는 용도라면 개인정보 없이 방에 사람이 있는지 없는지의 유무만 확인하고 제어를 할 수 있도록 하는 방법도 있잖아.,Statement,Recommendation,0.0,0.0,0.0,5.0,5.0,5.0,0
,,이런 방법을 사용한다면 이 아이디어의 핵심이 흔들릴까?,Question,Generate Design,5.0,5.0,5.0,0.0,0.0,0.0,0
,,어느 정도 큰 부분은 이야기가 된 것 같은데 더 짚어야할 부분이 있을까?,Question,Generate Design,5.0,5.0,4.0,0.0,0.0,0.0,0
,,더 피드백 해봐야하는 부분이 있을까?,Question,Generate Design,5.0,5.0,4.0,0.0,0.0,0.0,0
,,기숙사같은 경우에는 학교과 관리하는 기관이기도 하지만 학생들이 살고 있는 집의 역할도 하기 때문에 매우 민감한 부분이 될 것 같아.,Statement,Evaluation,,,,6.0,5.0,4.0,0
,,최소한의 관리권한은 어디까지 있는 것일까를 한 번 생각해봐야할 것 같아.,Question,Deep Reasoning,5.0,6.0,5.0,0.0,0.0,0.0,0
,,탄소 배출을 줄이는 것도 중하지만 학교가 강제로 시스템을 통해 관리하는 것이 아닌 학생들의 자발적인 참여를 유도하는 것도 방법이 될 수 있지 않을까?,Question,Generate Design,5.0,6.0,5.0,0.0,0.0,0.0,0
14.0,2024-08-13 8:42:55,문제 상황에 대해 구체적으로 접근해서 해결하려는 건 좋아.,Statement,Evaluation,,,,6.0,5.0,4.0,1
14.0,2024-08-13 8:45:02,그런데 이게 실제로 어떻게 구체화될지 잘 그려지지 않아.,Statement,Evaluation,,,,4.0,4.0,3.0,-1
14.0,2024-08-13 8:46:25,이런 부분에서 유저 시나리오를 잘 생각해봤어?,Question,Generate Design,5.0,6.0,5.0,,,,0
14.0,2024-08-13 8:46:26,"디자인적으로 생각해볼만한 문제이긴 한데,",Statement,Evaluation,,,,2.0,2.0,1.0,0
14.0,2024-08-13 8:48:06,너의 해결 방식은 정말 단순하게 해결에 초점을 맞춘 것 같아.,Statement,Evaluation,,,,3.0,3.0,2.0,-1
14.0,2024-08-13 8:48:43,이 시스템을 개인이 도입한다는게 가능할까?,Question,Generate Design,4.0,5.0,4.0,,,,0
14.0,2024-08-13 8:50:23,어떻게 생각해?,Question,Judgmental,3.0,3.0,2.0,,,,0
14.0,2024-08-13 8:52:17,동물 보호 단체와 협력하는 건 좋아.,Statement,Evaluation,,,,2.0,1.0,1.0,1
14.0,2024-08-13 8:53:52,"그런데 보통 동물 보호 단체는 경제적인 이득보다는 개인적인 비용을 들여 하는 경우가 많은데,",Statement,Information,,,,3.0,3.0,1.0,0
14.0,2024-08-13 8:53:54,너의 아이디어는 수익성이 목적이 아니야?,Question,Low-Level,3.0,3.0,1.0,,,,0
14.0,2024-08-13 8:55:08,너의 생각에는 수익성이 없는 디자인이 실현이 가능하다고 생각해?,Question,Deep Reasoning,5.0,5.0,5.0,0.0,0.0,0.0,0
14.0,2024-08-13 8:55:51,좋은 접근이야.,Statement,Evaluation,,,,2.0,1.0,1.0,1
14.0,2024-08-13 8:56:38,어떻게 수익성과 연계할지 생각해볼까?,Question,Generate Design,5.0,5.0,5.0,,,,0
14.0,2024-08-13 8:56:39,결국 우리의 문제를 명확히 정의해볼까?,Question,Generate Design,5.0,5.0,5.0,,,,0
14.0,2024-08-13 8:58:00,결국 문제는 반려동물 입양한 사람들이 책임감과 능력 부족이 있다는 것 아닐까?,Question,Generate Design,5.0,5.0,5.0,,,,0
14.0,2024-08-13 8:58:42,"이런 시스템도 좋지만, 내 생각에는 사용자들이 실제로 반려동물을 키우는 것과 유사한 상황을 경험해보게 하는 접근은 어때?",Question,Generate Design,6.0,7.0,5.0,0.0,0.0,0.0,1
14.0,2024-08-13 8:59:36,결국에 책임감 있는지 스스로 돌아보고 입양을 하게 된다면 문제해결이 되는 것 아닐까?,Question,Generate Design,6.0,7.0,5.0,0.0,0.0,0.0,1
14.0,2024-08-13 9:04:04,어떻게 생각해?,Question,Judgmental,6.0,5.0,3.0,0.0,0.0,0.0,0
14.0,2024-08-13 9:04:36,좋은 질문이야.,Statement,Evaluation,,,,1.0,1.0,1.0,1
14.0,2024-08-13 9:04:37,"나는 반려동물은 아니지만 작은 게임기에서 계속해서 내 캐릭터를 키우고 유지하기 위해 시간과 노력을 들이는 경험에서 행복도 얻고, 이게 실제 생물이라고 생각하면서 더 책임감을 느낀 적이 있어",Statement,Information,,,,7.0,7.0,1.0,1
14.0,2024-08-13 9:06:06,좋은 접근이야.,Statement,Evaluation,,,,2.0,1.0,1.0,1
14.0,2024-08-13 9:07:23,어떤 식의 경험이 좋을까?,Question,Generate Design,5.0,5.0,5.0,,,,1
14.0,2024-08-13 9:08:04,아이디어를 내봐,Question,Generate Design,4.0,4.0,3.0,,,,1
,,"게임에서는 키우던 동물이 죽거나 다쳐도 크게 다가오지 않을 수 있는데,",Statement,Evaluation,,,,5.0,4.0,3.0,0
,,어떤 식으로 유저가 몰입하게 해야할까?,Question,Generate Design,5.0,5.0,5.0,,,,0
,,단순한 푸시 알림보다는 더 좋은 자극이 필요할 것 같아.,Statement,Evaluation,,,,5.0,4.0,3.0,0
,,"추가적으로 실제로 반려동물을 키우다 보면 내가 다른 걸 하고 싶은 시간에 원하는 것을 못하고 시간적, 경제적 비용을 할애해야 하는 경우가 많은데, 이런 제약은 어떻게 줘야할까?",Question,Generate Design,6.0,7.0,5.0,,,,0
,,그렇다면 가상통화는 어떻게 벌지?,Question,Generate Design,5.0,5.0,3.0,0.0,0.0,0.0,0
,,그런데 실제로는 동물을 키운다고 해서 돈을 받지는 않잖아.,Statement,Evaluation,,,,5.0,5.0,4.0,0
,,게임 상에서 그러면 동물을 키워서 돈을 벌어서 그걸 동물한테 쓰는거야?,Question,Deep Reasoning,5.0,5.0,4.0,,,,0
,,현실과 괴리가 있지 않을까?,Question,Deep Reasoning,5.0,5.0,4.0,,,,0
,,좋은 것 같아.,Statement,Evaluation,,,,1.0,1.0,1.0,1
,,그렇다면 초기 자금을 동물을 잘 키우면 잘 관리할 수 있는건가?,Question,Generate Design,5.0,5.0,3.0,,,,0
,,점점 주제에서 멀어지는것 같네.,Statement,Evaluation,,,,3.0,3.0,2.0,-1
,,이런것 보다는 동물을 잘 키우지 못했을때 유저의 다른 경험에 제약이 가는 식은 어때?,Question,Generate Design,5.0,5.0,4.0,,,,0
,,인스타 사용시간 조절 어플 처럼,Statement,Information,,,,4.0,3.0,2.0,0
,,다른 어플 사용에 제한을 두는 건 좋은 것 같아.,Statement,Evaluation,,,,5.0,4.0,5.0,1
,,감정적 몰입 같은 경우에 나는 캐릭터가 2d 애니메이션 캐릭터에 사람들이 애정을 갖는 것처럼 실제로 몰입하게 되는 경험이 도움이 되지 않을까 생각해,Statement,Recommendation,,,,5.0,4.0,5.0,1
15.0,2024-08-16 6:36:19,내가 부모라면 아이들이 걱정되어서 해당 서비스를 써볼 것 같아!,Statement,Evaluation,,,,3.0,4.0,2.0,1
15.0,2024-08-16 6:37:29,충분히 니즈가 있는 서비스인 것 같아,Statement,Evaluation,,,,2.0,3.0,2.0,1
15.0,2024-08-16 6:38:31,그런데 아이들이 보기에 적절한 콘텐츠는 어떤 기준으로 선정할거야?,Question,Low-Level,5.0,5.0,1.0,0.0,0.0,0.0,0
15.0,2024-08-16 6:39:26,기존에 비슷한 서비스는 없었어?,Question,Low-Level,5.0,5.0,1.0,0.0,0.0,0.0,0
15.0,2024-08-16 6:40:03,있었다면 너의 서비스는 어떤 차별점을 가지고 있어?,Question,Generate Design,5.0,5.0,5.0,0.0,0.0,0.0,0
15.0,2024-08-16 6:41:12,부모님의 커스터마이징 기능은 어떻게 작용하는거야?,Question,Low-Level,5.0,5.0,1.0,0.0,0.0,0.0,0
15.0,2024-08-16 6:41:13,그런데 실시간 필터링이라고 했잖아.,Statement,Evaluation,,,,4.0,3.0,2.0,0
15.0,2024-08-16 6:42:38,"그러면 제공하는 동영상들을 제한하는 것이 아니라, 실시간으로 알고리즘으로 추천되는 동영상들을 제공하되 그것을 필터링한다는 것으로 이해했는데 그게 맞을까?",Question,Verification,5.0,5.0,4.0,,,,0
15.0,2024-08-16 6:43:35,일단 필터링의 정확도를 어떻게 높일수 있는지 생각하는게 좋을 것 같아.,Statement,Recommendation,,,,5.0,4.0,6.0,0
15.0,2024-08-16 6:44:16,아무래도 부적절한 동영상을 완벽하게 거르는 게 어려울 것 같아서.,Statement,Evaluation,,,,4.0,5.0,3.0,-1
15.0,2024-08-16 6:45:13,유튜브나 넷플릭스 자체에서 이런 기능이나 부적절 동영상에 대한 판단 기준이 있지 않아?,Question,Low-Level,4.0,5.0,2.0,,,,0
15.0,2024-08-16 6:46:13,나는 부모님이 필터링 기준을 커스터마이징할 수 있는 부분도 너의 서비스만의 차별점으로 중요할 것 같다는 생각이 들었어.,Statement,Evaluation,,,,6.0,5.0,4.0,1
15.0,2024-08-16 6:47:25,그렇다면 커스터마이징 기능에 대해 더 구체적으로 고안해봐도 좋을 것 같아,Statement,Recommendation,,,,5.0,4.0,5.0,1
15.0,2024-08-16 6:47:27,"응응 부모님의 입장에서 아이의 콘텐츠 시청에서 어떤 점이 걱정되는지 인터뷰를 통해 알아본다면,",Statement,Recommendation,,,,5.0,5.0,5.0,1
15.0,2024-08-16 6:48:09,너의 솔루션이 구체화되는데 도움이 되지 않을까?,Question,Generate Design,5.0,5.0,5.0,,,,1
15.0,2024-08-16 6:48:28,"요즘 아이들은 어떻게 유튜브나 넷플릭스를 시청하는지 모르겠지만,",Statement,Information,,,,3.0,2.0,1.0,0
15.0,2024-08-16 6:49:13,혼자 보는 경우도 있지만 친구들이랑 같이 보는 경우도 있으려나?,Question,Scenario Creation,4.0,5.0,4.0,,,,0
15.0,2024-08-16 6:49:14,"응응 부모님이 집에서 관리한다고 하더라도 친구들이랑 같이 부적절한 동영상을 보면, 의도했던 바가 다 없어지는 거니까",Statement,Evaluation,,,,6.0,6.0,4.0,0
15.0,2024-08-16 6:50:08,그런 경우들도 같이 고려하면 좋을 것 같아.,Statement,Recommendation,,,,5.0,5.0,6.0,1
15.0,2024-08-16 6:50:40,이런 부분들을 구체적으로 유저 인터뷰때 물어보면 좋을 것 같아!,Statement,Recommendation,,,,5.0,4.0,5.0,1
15.0,2024-08-16 6:51:24,응응 좋은 생각이야!,Statement,Evaluation,,,,1.0,1.0,1.0,1
15.0,2024-08-16 6:52:50,"그리구 동영상의 적절함도 중요하지만, 동영상을 많이 보면 문제가 되는 것도 중요한 것 같아",Statement,Evaluation,,,,5.0,4.0,3.0,0
15.0,2024-08-16 6:53:43,그런 부분까지 같이 관리해준다면 어떨까?,Statement,Recommendation,,,,4.0,4.0,5.0,1
15.0,2024-08-16 6:54:11,시간이 차단되었을 때 아이의 입장에서 동영상을 더 보지 못한 아쉬움이 가중되지 않도록 하는 게 중요할 것 같다는 생각이 들어.,Statement,Recommendation,,,,5.0,4.0,3.0,0
15.0,2024-08-16 6:54:13,응응 그럴 수 있다면 아이 입장에서도 재밌고 건강한 영상 시청을 할 수 있을 것 같아,Statement,Evaluation,,,,4.0,3.0,2.0,1
15.0,2024-08-16 6:55:12,그런데 왜 7세 이하 아동으로 타겟을 한정했는지가 궁금해,Question,Deep Reasoning,5.0,5.0,5.0,0.0,0.0,0.0,0
15.0,2024-08-16 6:55:51,아동이 이런 필터링을 어떻게 받아들일지가 나이에 따라 달라질 것 같다는 생각이 들어,Statement,Evaluation,,,,5.0,4.0,3.0,0
15.0,2024-08-16 6:57:15,응응 그것도 함께 알아본다면 더 실현가능한 서비스가 될 것 같아!!,Statement,Recommendation,,,,4.0,3.0,4.0,1
15.0,2024-08-16 6:57:27,관련 자료를 찾아본 적이 있어?,Question,Low-Level,5.0,5.0,1.0,0.0,0.0,0.0,0
,,관련 논문이나 리서치 자료가 있지 않을까?,Question,Low-Level,5.0,5.0,1.0,0.0,0.0,0.0,0
,,먼저 데스크 리서치부터 시작해보고 해결안되고 궁금한 지점을 찾아서 다른 방법으로 진행해보자!,Statement,Recommendation,0.0,0.0,0.0,6.0,5.0,6.0,1
,,"응응 지금 되게 많은 포인트를 한꺼번에 고려하고 있는데,",Statement,Evaluation,,,,4.0,3.0,2.0,0
,,"그중 가장 중요한 포인트가 무엇인지도,",Question,Deep Reasoning,5.0,5.0,5.0,0.0,0.0,0.0,0
,,리서치를 진행하면서 같이 고려하면 좋을것같아,Statement,Recommendation,,,,3.0,4.0,3.0,1
16.0,2024-08-15 6:08:47,Supervised learningd이 뭐야?,Question,Definition,5.0,5.0,1.0,0.0,0.0,0.0,0
16.0,2024-08-15 6:10:24,"음 내가 알기로는 기존에 이미 강아지, 고양이 언어 번역기가 있는 거 같은데",Statement,Information,,,,4.0,3.0,2.0,0
16.0,2024-08-15 6:11:27,이 아이디어가 가지고 있는 다른 차이점이 뭐야?,Question,Comparison,5.0,5.0,4.0,,,,0
16.0,2024-08-15 6:12:41,그렇다면 반려인이 반려견이 아플 때 빨리 병원에 데려가거나 하는 현실적 문제를 해결할 수 있어서 좋겟다,Statement,Evaluation,,,,5.0,4.0,3.0,1
16.0,2024-08-15 6:15:02,그런데 반대로 이 서비스를 썼을 때 사람이 강아지의 말을 배울 수 있다는 장점도 있지 않을까?,Question,Generate Design,6.0,7.0,5.0,0.0,0.0,0.0,1
16.0,2024-08-15 6:17:13,유튜브 영상중에 사람이 고양이한테 '맠-옹'이라고 소리내면 고양이가 자기를 부르는지 알고 깜짝 놀라는 영상이 있었거든.,Statement,Information,0.0,0.0,0.0,5.0,4.0,3.0,1
16.0,2024-08-15 6:17:15,뭔가 반대로 이런 인터렉션이 보완되면 쫌 더 차별화 되지 않을까?,Question,Generate Design,6.0,7.0,5.0,0.0,0.0,0.0,1
16.0,2024-08-15 6:18:12,그리고 이런 번역기가 만들어지면 강아지별로 특성이 어떤지도 파악할 수 있을 거 같아.,Statement,Evaluation,,,,5.0,4.0,3.0,1
16.0,2024-08-15 6:20:24,다견 가정에서 각 강아지의 특성을 잘 알게되면 강아지에게 필요한 애정표현과 특별 관리도 할 수 있을 거 같아,Statement,Recommendation,,,,5.0,4.0,4.0,1
16.0,2024-08-15 6:21:45,사람들이 강아지의 감정에 대해 더 잘 이해하고 가족 구성원으로 여기는 것을 도와서 세상의 모든 강아지들이 더 행복해지는 미래를 상상할 수 있을 거 같아.,Statement,Evaluation,,,,5.0,4.0,3.0,1
16.0,2024-08-15 6:21:48,근데 강아지가 받는 스트레스 역시 주인이 더 잘 알게 되니까 가끔은 마음 아픈 경우가 생길수도 있을 거 같아.,Statement,Evaluation,,,,4.0,4.0,2.0,-1
16.0,2024-08-15 6:23:35,강아지 밥을 주려고 출근을 해야 하는데 강아지가 너무 슬퍼하면ㅠㅠ 주인도 마음이 힘들 거 같아.,Statement,Evaluation,,,,4.0,3.0,2.0,-1
16.0,2024-08-15 6:24:39,오~ 좋은 생각이다,Statement,Evaluation,,,,1.0,1.0,1.0,1
16.0,2024-08-15 6:25:53,"그런 부가적인 놀이, 활동 추천 기능은 서비스에 어떤 식으로 녹일 수 있을까?",Question,Generate Design,5.0,5.0,5.0,,,,0
16.0,2024-08-15 6:25:55,추천되는 놀이들이 정말로 믿을만한지 전문가의 판단과 꿀팁 같은 것이 있으면 좋을 거 같아.,Statement,Recommendation,,,,6.0,5.0,5.0,1
16.0,2024-08-15 6:26:41,유명한 훈련사가 놀이를 하는 방법에 대한 유의점을 담은 영상이나 컨텐츠가 같이 첨부되면 좋지 않을까?,Statement,Recommendation,,,,6.0,5.0,5.0,1
16.0,2024-08-15 6:29:12,응 근데 그런 컨텐츠가 너무 길거나 현실적으로 불가능한 것들이면 주인이 또 부담을 느낄 수 있을 거 같아.,Statement,Evaluation,,,,5.0,5.0,4.0,-1
16.0,2024-08-15 6:30:48,그런 꿀팁들을 주인이 부담없이 확인할 수 있는 방법에는 무엇이 있을까?,Question,Generate Design,5.0,5.0,5.0,,,,0
16.0,2024-08-15 6:30:49,그런데 이 부가기능에 대한 이야기 보다 LLM을 썼을 때 생기는 고려지점에 대해 더 고려하면 좋을 거 같아.,Statement,Recommendation,,,,5.0,4.0,5.0,0
16.0,2024-08-15 6:31:21,이 프로젝트의 메인 아이디어는 번역이니까,Statement,Evaluation,,,,3.0,3.0,2.0,0
16.0,2024-08-15 6:31:27,강아지 음성에만 집중해있는데 부가적인 종류의 데이터를 얻을 수도 있을 거 같아.,Statement,Recommendation,,,,5.0,4.0,5.0,0
,,만약에 강아지가 너무 짖어서 성대수술을 하거나 하는 경우도 있으니까.,Statement,Information,,,,5.0,4.0,3.0,-1
,,그리고 강아지는 다른 동물에 비해 표정이 굉장히 다양해서 이런 것들도 활용해볼 수 있지 않을까?,Question,Proposal/Negotiation,5.0,5.0,4.0,,,,1
,,응 근데 이게 좋은 아이디어긴 한데 현실적으로 가능한 부분인지도 생각해보는게 좋을 거 같아.,Statement,Evaluation,,,,4.0,4.0,3.0,0
,,이런 상상들을 현실로 가져오려면 지금 기술이 어느정도로 발전했는지도 같이 생각해보면 좋을 거 같아.,Statement,Recommendation,,,,4.0,4.0,3.0,0
,,너 생각에는 실제 개발이 어느정도 가능한 거 같니?,Question,Judgmental,4.0,4.0,3.0,,,,0
17.0,2024-08-13 2:31:24,가족이 아동 학대나 방치를 한다는 상황인거야?,Question,Low-Level,4.0,4.0,1.0,0.0,0.0,0.0,0
