user_id,timestamp,sentence,categories,type,evaluation.timely,evaluation.relevance,evaluation.high-level,evaluation.specificity,evaluation.justification,evaluation.active,evaluation.sentiment
17.0,2024-08-13 2:32:38,학대나 방치 생활을 하는 아동이 갑자기 팔찌를 차고 있으면 가해자가 바로 알아차리지 않을까?,Question,Deep Reasoning,5.0,5.0,5.0,0.0,0.0,0.0,0
17.0,2024-08-13 2:35:07,학대나 방치 당하는 아동이 어떤 환경에서 생활하고 있는지 잘 파악해야 할 것 같아.,Statement,Recommendation,,,,5.0,5.0,5.0,0
17.0,2024-08-13 2:36:20,"그런 경우에는 학교를 다니지 않는 아이들도 있을 수 있을테고,",Statement,Information,,,,4.0,4.0,3.0,0
17.0,2024-08-13 2:37:34,신발에 넣는 건 야외에 나갈 때만 해당되는 아이디어인데,Statement,Evaluation,,,,5.0,5.0,4.0,0
17.0,2024-08-13 2:39:23,너가 정의한 타겟 문제는 아동 학대와 방치를 어디서나 인지하려면 실내에서도 가능한 아이디어야할 것 같아,Statement,Recommendation,,,,5.0,5.0,5.0,0
17.0,2024-08-13 2:41:01,귀걸이는 성별이나 나이대에 따라 적용이 어려울 수도 있을 것 같아.,Statement,Evaluation,,,,5.0,5.0,3.0,0
17.0,2024-08-13 2:41:10,옷에 부착하는 스마트 태그로 변경하는 건 좋은 것 같은데 어떤 기능을 넣으면 좋을까?,Question,Generate Design,5.0,5.0,4.0,,,,1
17.0,2024-08-13 2:42:56,경고 알림은 어디로 보내는 거야?,Question,Low-Level,5.0,5.0,1.0,0.0,0.0,0.0,0
17.0,2024-08-13 2:43:38,"아동 학대나 방치 상황이 가족이 가해자인지, 아니면 가족 이외의 다른 상황을 방지하기 위한 디자인인지 구별하면 더 좋을 것 같아",Statement,Recommendation,0.0,0.0,0.0,6.0,6.0,6.0,1
17.0,2024-08-13 2:45:06,스마트 태그를 옷에 부착하는 데 심박수 센서가 제대로 기능할 수 있을까?,Question,Low-Level,5.0,6.0,1.0,0.0,0.0,0.0,0
17.0,2024-08-13 2:46:26,나머지 기능은 가능한 것 같아,Statement,Evaluation,0.0,0.0,0.0,4.0,3.0,2.0,1
17.0,2024-08-13 2:46:32,그리고 아동이 직접 착용해야 하는 경우를 고려해서 쉽게 탈부착이 가능한 디자인이면 더 좋지 않을까?,Question,Generate Design,6.0,7.0,5.0,0.0,0.0,0.0,1
17.0,2024-08-13 2:48:25,"옷 바깥에 센서를 부착하면 심박수 모니터링이 불가능할 것 같은데,",Statement,Evaluation,,,,6.0,5.0,4.0,0
17.0,2024-08-13 2:48:51,그러면 이 스마트 태그를 옷 안쪽에 피부에 닿게 부착한다거나 이런식으로 설계하면 심박수 모니터링이 가능하지 않을까?,Question,Generate Design,6.0,6.0,5.0,,,,1
17.0,2024-08-13 2:50:36,근데 옷에서 탈착되면 즉시 경보 알림 기능은 실행이 어려울 것 같아...,Statement,Evaluation,,,,5.0,4.0,3.0,-1
17.0,2024-08-13 2:51:52,그렇게 되면 옷 한벌에 태그 한개가 부착되어야있어야하는 거 아니야?,Question,Low-Level,4.0,3.0,1.0,,,,0
17.0,2024-08-13 2:52:25,옷을 바꿔 입을때 태그도 옮겨야 하지 않을까?,Question,Low-Level,4.0,3.0,1.0,,,,0
17.0,2024-08-13 2:53:43,아니 그러면 즉시 경보 알림 기능이나 비정상적인 패턴을 감지하는 경우라고 말했는데 구체적으로 어떤 상황에서 경보 알림을 해야할까??,Question,Low-Level,5.0,5.0,1.0,0.0,0.0,0.0,0
,,구체적으로 어떤 상황에서 경보 알림을 해야할까??,Question,Feature Specification,5.0,5.0,1.0,0.0,0.0,0.0,0
,,태그를 강제로 제거하는 것과 옷을 바꿔입기 위해 제거하는 것을 어떻게 구별해야할까?,Question,Generate Design,5.0,5.0,5.0,0.0,0.0,0.0,0
,,비정상 상태를 정의하는 건 좋은데 심박수가 몇 이상이나 이하를 어떻게 정의해야할 지 고민이네,Statement,Evaluation,0.0,0.0,0.0,5.0,5.0,5.0,0
,,체육 활동 같은 걸 하게 되면 그때도 심박수가 높아질텐데 그런 상황과 학대 방치 상황을 어떻게 구별해야할까?,Question,Generate Design,5.0,5.0,5.0,0.0,0.0,0.0,0
,,사용되는 센서가 많아질 수록 전력이 필요할 것 같다는 생각도 드는데..,Statement,Evaluation,,,,4.0,3.0,2.0,0
,,동작 센서는 어떤걸 말하는거야?,Question,Low-Level,3.0,4.0,1.0,,,,0
,,동작 패턴 분석이라고 말했는데 학대 방치 상황에서 나오는 특정 동작들이 있을까?,Question,Generate Design,5.0,5.0,5.0,0.0,0.0,0.0,0
,,그걸 감지하면 학대 상황과 일상 생활을 구별하는데에 도움이 될 것 같아,Statement,Recommendation,0.0,0.0,0.0,5.0,5.0,5.0,1
18.0,2024-08-12 10:38:12,혹시 특별히 나한테 물어보고 싶은 게 있었니?,Question,Judgmental,5.0,3.0,2.0,0.0,0.0,0.0,0
18.0,2024-08-12 10:39:16,음.. 일단 실현은 가능할 것 같은데 그렇게 하려면 조금 더 아이디어가 구체적이어야 할 것 같단다.,Statement,Evaluation,,,,5.0,4.0,3.0,0
18.0,2024-08-12 10:40:09,혹시 서비스 디자인으로 생각하고 있는 거니?,Question,Low-Level,3.0,3.0,1.0,,,,0
18.0,2024-08-12 10:41:28,그래?,Statement,Evaluation,,,,1.0,1.0,1.0,0
18.0,2024-08-12 10:41:29,일단 좋은 것 같단다.,Statement,Evaluation,,,,2.0,2.0,1.0,1
18.0,2024-08-12 10:43:03,서비스 디자인이어도 민간 업체의 서비스인지 정책 디자인인지 그런 것부터 정하는 게 중요할 것 같단다.,Statement,Recommendation,,,,5.0,5.0,5.0,0
18.0,2024-08-12 10:43:50,혹시 생각해본 방향이 있을까?,Question,Low-Level,3.0,3.0,1.0,,,,0
18.0,2024-08-12 10:45:25,동건이가 결정하는 게 중요할 것 같아.,Statement,Recommendation,,,,3.0,3.0,3.0,0
18.0,2024-08-12 10:47:32,"잠깐, 아직 그 기능은 생각할 단계가 아닌 것 같아.",Statement,Evaluation,,,,5.0,5.0,3.0,0
18.0,2024-08-12 10:47:35,우선 그럼 정책 디자인으로 정하고 논의를 해보자.,Statement,Recommendation,,,,4.0,4.0,5.0,1
18.0,2024-08-12 10:49:30,이 서비스의 stakeholder들이 누가 있을지 생각해보는 게 먼저일 것 같단다.,Statement,Recommendation,,,,4.0,5.0,5.0,1
18.0,2024-08-12 10:50:42,혹시 생각해본 게 있니?,Question,Low-Level,4.0,4.0,1.0,,,,0
18.0,2024-08-12 10:50:43,그러면 그렇게 3가지 이해관계자를 고려하도록 하자.,Statement,Recommendation,,,,5.0,4.0,5.0,1
18.0,2024-08-12 10:52:13,"아무래도 가장 메인이 되는 것은 일반 시민들일테니, 이 사람들의 서비스 touchpoint를 먼저 계획해보는 게 좋을 것 같단다.",Statement,Recommendation,,,,6.0,5.0,6.0,1
18.0,2024-08-12 10:53:53,혹시 서비스 디자인에서 touchpoint가 뭔지 알고 있니?,Question,Definition,5.0,5.0,4.0,,,,1
18.0,2024-08-12 10:53:54,그래 맞아.,Statement,Evaluation,,,,1.0,1.0,1.0,1
18.0,2024-08-12 10:55:07,잘 이해하고 있구나.,Statement,Evaluation,,,,1.0,1.0,1.0,1
18.0,2024-08-12 10:55:21,그렇다면 일반 시민들의 서비스 터치포인트를 찾는 것도 쉽게 할 수 있겠구나.,Statement,Evaluation,,,,2.0,2.0,2.0,1
18.0,2024-08-12 10:55:49,"일반 시민들의 평소 이동과 관련된 journey를 나열해보고, 그 안에서 이 서비스의 터치포인트들이 뭐가 있는지 한번 작성해보면 좋을 것 같단다.",Statement,Recommendation,,,,5.0,5.0,5.0,1
18.0,2024-08-12 10:57:15,그래 아주 잘 했어.,Statement,Evaluation,,,,1.0,1.0,1.0,1
18.0,2024-08-12 10:57:16,각 터치포인트 별로 어떤 사용자 경험을 줄지는 동건이가 생각해야겠지.,Statement,Recommendation,,,,3.0,3.0,3.0,0
18.0,2024-08-12 10:57:50,예를 들어서 출발지 선택 같은 경우 어떻게 해보면 좋겠니?,Question,Generate Design,5.0,5.0,5.0,,,,0
18.0,2024-08-12 10:58:58,기존에 어떤 문제가 있을까를 생각해보면 쉬울 수도 있단다.,Statement,Recommendation,,,,3.0,3.0,3.0,0
18.0,2024-08-12 10:58:59,"그치, 그리고 지금 동건이의 메인 주제는 저탄소 교통을 장려하는 서비스이다보니,",Statement,Evaluation,,,,5.0,4.0,3.0,1
18.0,2024-08-12 10:59:23,그 부분이 잘 반영되는 게 가장 중요하겠지?,Question,Judgmental,5.0,5.0,4.0,,,,1
18.0,2024-08-12 11:00:05,그래 그런 식으로 다른 터치포인트들도 생각하면 된단다.,Statement,Recommendation,,,,3.0,2.0,3.0,1
18.0,2024-08-12 11:01:22,"고려해야 될 요소라면, 아무래도 사용자들에게 불편함을 선택하도록 하는 아이디어이다보니 그 부분이 강제되거나 억지로 하는 기분이 들지 않게 하는 게 가장 중요할 것 같단다.",Statement,Recommendation,,,,5.0,4.0,4.0,1
18.0,2024-08-12 11:01:37,그래서 단순히 탄소양을 보여주는 것만으로는 사용자에게 충분한 동기부여가 되지 못할 수도 있겠다는 걱정이 든단다.,Statement,Evaluation,,,,5.0,5.0,3.0,-1
,,"시각화를 아주 매력적으로 한다든지, behavior change 분야에서 자주 쓰는 tactics을 찾아봐도 좋을 것 같단다.",Statement,Recommendation,,,,5.0,5.0,5.0,1
,,동건이가 방금 말한 포인트나 리워드도 좋은 생각인 것 같단다.,Statement,Evaluation,,,,4.0,4.0,3.0,1
,,"다만, 너무 금전적인 보상 체계가 중심이 되지 않게 하는 게 좋을 것 같단다.",Statement,Recommendation,,,,5.0,5.0,5.0,1
,,내가 아까 말했듯이 기존에 잘 사용되고 있는 전략들이 뭐가 있는지 찾아보고 이 아이디어에 적용할 만한 것이 있는지 골라봐도 좋을 것 같단다.,Statement,Recommendation,,,,5.0,4.0,5.0,1
,,아니면 새롭게 디자인 아이디어를 내야겠지...,Statement,Recommendation,,,,3.0,3.0,4.0,0
,,우선 자료 조사를 해보면 어떨까?,Statement,Recommendation,,,,4.0,4.0,5.0,1
,,그래 혹시 또 궁금한 점 있니?,Question,Low-Level,3.0,2.0,1.0,0.0,0.0,0.0,0
,,"음, 동건이가 지금 업데이트한 것처럼 지도 서비스 디자인으로 아이디어를 좁히면 조금 더 구체적인 디자인 피쳐들을 생각해볼 수 있고, 그러면 더 명확한 경험을 제공할 수 있을 것 같단다.",Statement,Evaluation,,,,5.0,4.0,3.0,1
,,지금 생각중인 아이디어들을 더 구체화해서 알려줄래?,Question,Generate Design,5.0,5.0,4.0,,,,1
,,그래 일단 좋아.,Statement,Evaluation,,,,1.0,1.0,1.0,1
,,그래 일단 좋아.,Statement,Evaluation,,,,1.0,1.0,1.0,1
,,"아까부터 계속해서 강조하고 싶은 것은, '저탄소'라는 디자인 테마가 계속해서 잘 녹아들 수 있게 하는 것이란다.",Statement,Recommendation,,,,5.0,5.0,5.0,1
,,"일반적인 지도 서비스가 아니라, '저탄소 교통 이용을 장려'한다는 타겟 골을 가진 서비스라는 점을 계속해서 keep in mind하고 디자인해야 한단다.",Statement,Recommendation,,,,5.0,5.0,5.0,1
,,그 부분은 디자인의 핵심이 되기 때문에 내가 답을 주기보다는 동건이가 직접 생각하는 게 중요할 것 같단다.,Statement,Evaluation,,,,5.0,6.0,4.0,0
,,한번 생각해보고 내일 다시 만나서 논의하지 않겠니?,Question,Generate Design,6.0,5.0,4.0,,,,0
19.0,2024-08-15 10:40:02,이 지도 프로그램에서 핵심이 되는 동기는 절약한 탄소량이라고 생각해.,Statement,Evaluation,,,,5.0,5.0,3.0,1
19.0,2024-08-15 10:43:37,"그런데, 그 데이터를 교통 이용 시마다 표시해 주는 것 만으로는 동기부여가 부족하다고 생각해.",Statement,Evaluation,,,,5.0,5.0,3.0,0
19.0,2024-08-15 10:43:38,"그동한 저탄소 교통을 이용해 절약한 탄소량을 누적해서 표시해주거나, 이를 통해 달성할 수 있는 가상의 과제를 설정해 두고,",Statement,Recommendation,,,,5.0,5.0,5.0,1
19.0,2024-08-15 10:45:19,이 탭을 어플리케이션의 다른 메뉴에서 확인할 수 있도록 한다면 더욱 동기 부여가 강력해질 것 같아.,Statement,Recommendation,,,,5.0,5.0,5.0,1
19.0,2024-08-15 10:48:24,사람들이 주로 생각하는 저탄소 교통 이용의 효과는 아마도 환경오염 개선에 관한 것일거야.,Statement,Information,,,,3.0,3.0,2.0,0
19.0,2024-08-15 10:48:25,이와 관련해서 자신이 기여했다는 기분을 느낄 수 있게 해당 효과를 시각화하는 방법을 고려해 봐.,Statement,Recommendation,,,,4.0,4.0,5.0,1
19.0,2024-08-15 10:50:21,그렇다면 이 시각적인 데이터를 사용자의 프로필 혹은 애플리케이션 홈에서 나타낼 수 있는 친숙한 방법이 필요할 것 같아.,Statement,Recommendation,,,,5.0,4.0,5.0,1
19.0,2024-08-15 10:51:11,"예를 들어, 최근에 많이 사용되는 어플리케이션 중 duilingo라는 언어 학습 플랫폼을 참고할 수 있을 거야.",Statement,Information,,,,5.0,4.0,3.0,1
19.0,2024-08-15 10:52:36,"이곳에서는 몇일째 연속해서 학습이 이루어지고 있는지, 그리고 매일 얼마만큼의 학습을 하고 있는 등을 시각화해서 보여주거든.",Statement,Information,,,,5.0,4.0,3.0,1
19.0,2024-08-15 10:52:38,항상 주의해야 하는 점은 전문적인 데이터로 다가가지 않는거야.,Statement,Recommendation,,,,5.0,4.0,5.0,0
19.0,2024-08-15 10:53:56,"물론 탄소 절약에 대한 아주 세부적이고 다양한 시각화 및 분석을 한다면 이론적으로는 효과적인 서비스가 되겠지만, 대부분 이 서비스를 사용하는 사람들은 그 정도의 지식을 피곤하게 느낄 수 있어.",Statement,Evaluation,,,,5.0,5.0,4.0,-1
19.0,2024-08-15 10:55:31,"데이터를 부르는 용어를 쉽게 만들고, 시각화 방식 또한 직관적으로 만들면 이 플랫폼을 범용적으로 사용 가능하게 해 줄 거야.",Statement,Recommendation,,,,5.0,5.0,5.0,1
19.0,2024-08-15 10:55:32,말해준 점들이 잘 반영된 것 같아.,Statement,Evaluation,,,,3.0,2.0,1.0,1
19.0,2024-08-15 10:57:13,"그런데, 환경친화적인 대중교통의 사용량을 늘리려는 우리의 1차적인 목표에 더욱 다가가려면 개인에게 보상을 제공하는 것 외에도 사회적인 흐름을 만들어 나가는 것이 중요해.",Statement,Recommendation,,,,4.0,5.0,5.0,1
19.0,2024-08-15 10:57:55,"이벤트는 너무 많이 진행된 단계인 것 같고,",Statement,Evaluation,,,,5.0,4.0,3.0,0
19.0,2024-08-15 10:59:35,가장 원시적인 형태부터 시작해 보자.,Statement,Recommendation,,,,4.0,3.0,5.0,1
19.0,2024-08-15 10:59:36,친구 및 지인의 프로필에 표시되는 저탄소 교통 이용과 관련된 시각화 자료를 다른 사람이 볼 수 있게 하면 좋겠어.,Statement,Recommendation,,,,5.0,4.0,5.0,1
19.0,2024-08-15 11:01:00,이제 이렇게 한 뒤에 가상의 이벤트를 생각해 볼 수 있을 거야.,Statement,Recommendation,,,,4.0,3.0,3.0,1
19.0,2024-08-15 11:02:05,여기서는 기업과 같은 큰 그룹의 경쟁보다는 앞서 말한 친구 혹은 지인과 협력 혹은 경쟁을 하면서 저탄소 교통을 많이 이용하도록 장려하는 간단한 이벤트가 있으면 좋을 것 같아.,Statement,Recommendation,,,,5.0,4.0,4.0,1
19.0,2024-08-15 11:02:10,너가 말해 준 예시도 정말 괜찮지.,Statement,Evaluation,,,,3.0,2.0,2.0,1
,,"다만, 경쟁하는 형태의 이벤트 기획에서 가장 중요한 점은 경쟁에서 패배하더라도 나름의 어플리케이션 사용에 대한 동기를 얻는 것이라 생각해.",Statement,Recommendation,,,,4.0,5.0,5.0,1
,,"음, 아까 내가 말했던 것은 지역 커뮤니티나 회사 단위로 보호활동에 참여하게 하자는 것은 아니었어.",Statement,Evaluation,,,,6.0,5.0,4.0,0
,,오히려 그런 형태의 이벤트는 지양해야 한다고 생각해.,Statement,Recommendation,,,,5.0,5.0,4.0,0
,,그 정도로 큰 그룹을 움직이게 하기에는 현재 우리가 가진 motivation이 부족하거든.,Statement,Evaluation,,,,6.0,6.0,3.0,0
,,그 부분에 대해서는 다양한 온라인 게임에서 예시를 찾아 볼 수 있을 것 같아.,Statement,Recommendation,,,,4.0,3.0,4.0,1
,,어떻게 보면 사용자가 간단한 전략을 설계할 수 있게 유도하는거지.,Statement,Recommendation,,,,3.0,3.0,4.0,1
20.0,2024-08-14 10:36:08,"아동학대를 하는 가정이 있다면, 아동이 응급 호출 등을 하지 못하게 막을 수도 있을 것 같은데,",Question,Deep Reasoning,6.0,7.0,5.0,0.0,0.0,0.0,0
20.0,2024-08-14 10:38:03,어떻게 해결할 수 있을까?,Question,Generate Design,6.0,7.0,5.0,0.0,0.0,0.0,0
20.0,2024-08-14 10:39:23,오 장치가 강제로 제거될 때 신호를 보낸다는 아이디어도 좋은 것 같다!,Statement,Evaluation,,,,5.0,4.0,3.0,1
20.0,2024-08-14 10:41:01,그런데 마이크나 GPS를 이용하다보면 사생활이나 개인정보 문제가 생길 수도 있을 것 같아,Statement,Recommendation,,,,5.0,5.0,4.0,0
20.0,2024-08-14 10:42:14,"그리고 아동학대를 당해 응급 호출을 하는 상황은 굉장히 위급한 상황일 것 같은데,",Statement,Evaluation,,,,5.0,5.0,4.0,0
20.0,2024-08-14 10:42:16,"경찰 신고를 자동화 한다거나, 위치 정보를 제공하는 것처럼 더 빠른 대처를 위한 방안들이 필요할 것 같아.",Statement,Recommendation,,,,6.0,6.0,6.0,1
20.0,2024-08-14 10:43:11,어떤게 있을까?,Question,Generate Design,5.0,5.0,4.0,,,,0
20.0,2024-08-14 10:44:44,"내가 알기로 아동학대는 지속적으로 이루어 지는 경우가 많은 것 같더라고,",Statement,Information,,,,4.0,3.0,2.0,0
20.0,2024-08-14 10:45:25,"좀 더 빨리, 최대한 심각해지기 전에 아동학대를 판단할 수는 없을까?",Question,Generate Design,5.0,5.0,4.0,,,,0
20.0,2024-08-14 10:47:06,"음 신체적인 폭력의 경우에는 신체의 흔들림이나, 음성 등으로도 파악할 수 있을 것 같기도 해.",Statement,Recommendation,,,,5.0,4.0,5.0,1
20.0,2024-08-14 10:47:07,어떻게 생각해?,Question,Judgmental,5.0,5.0,3.0,,,,0
20.0,2024-08-14 10:48:05,"그런데 놀이터에서 노는 상황에서도 충분히 급격한 흔들림, 큰 소리가 날 수 있을 것 같은데..",Statement,Evaluation,,,,5.0,4.0,3.0,0
20.0,2024-08-14 10:49:25,만약 아동학대가 아닌 가정이 아동학대 의심을 받는 다면 사용자가 싫어할 것 같아.,Statement,Evaluation,,,,5.0,5.0,3.0,-1
20.0,2024-08-14 10:50:47,해결 방안이 있을까?,Question,Generate Design,5.0,5.0,4.0,,,,0
20.0,2024-08-14 10:50:48,"그리고 아동이다 보니, 어떤 기기를 착용하는 것 자체를 불편해할수도 있을 것 같은데,",Statement,Evaluation,,,,5.0,4.0,3.0,0
20.0,2024-08-14 10:51:42,"형태나 디자인, 소재 등을 고민해봐야할 것 같은데,",Statement,Recommendation,,,,5.0,4.0,5.0,0
20.0,2024-08-14 10:52:18,어떻게 생각해?,Question,Judgmental,4.0,4.0,3.0,,,,0
20.0,2024-08-14 10:53:17,"먼저 친근감이 제일 중요한 것 같고,",Statement,Recommendation,,,,3.0,2.0,3.0,1
20.0,2024-08-14 10:54:28,"착용성, 안정성도 고려해야할 것 같아.",Statement,Recommendation,,,,3.0,2.0,3.0,1
20.0,2024-08-14 10:54:55,그리고 강제로 제거할 때 신호를 보내기로 했잖아.,Statement,Information,,,,5.0,4.0,3.0,0
20.0,2024-08-14 10:56:13,"그러려면 평소에 계속 끼고 있어야할텐데,",Statement,Evaluation,,,,4.0,4.0,3.0,0
20.0,2024-08-14 10:56:51,"씻거나, 운동을 할 때 장치가 손상되지 않아야할 것 같아",Statement,Recommendation,,,,5.0,5.0,5.0,0
20.0,2024-08-14 10:57:47,음 아무래도 '강제'로 제거되었는지를 정확하게 판단하는게 젤 중요할텐데..,Statement,Evaluation,,,,5.0,5.0,4.0,0
20.0,2024-08-14 10:57:49,넌 어떻게 생각해?,Question,Judgmental,4.0,4.0,3.0,,,,0
20.0,2024-08-14 10:58:37,"너가 작성한 아이디어를 읽어봤을 때, 이 아이디어를 실현하는 과정에서 어떤 문제점이나 어려움이 있을까?",Question,Generate Design,6.0,7.0,5.0,0.0,0.0,0.0,0
20.0,2024-08-14 10:59:07,구체적인 실현 방안을 생각해보자,Statement,Recommendation,0.0,0.0,0.0,6.0,5.0,7.0,1
20.0,2024-08-14 10:59:11,"맞아, 비용도 고려해야할 것 같아.",Statement,Evaluation,,,,2.0,2.0,1.0,0
,,다양한 고성능 센서들을 부착하다보면 비용이 만만치않을 것 같은데..,Statement,Evaluation,,,,3.0,3.0,2.0,0
,,어떻게 하는게 좋을까,Question,Generate Design,4.0,4.0,3.0,,,,0
,,음 아 그런데 스트레스 지수는 어떻게 판단할거야?,Question,Instrumental/Procedural,5.0,5.0,3.0,0.0,0.0,0.0,0
,,이 아이디어에서 또 다른 문제점들은 없어?,Question,Generate Design,6.0,6.0,5.0,0.0,0.0,0.0,0
,,배터리 문제는 어떻게 해결할 수 있을까?,Question,Generate Design,6.0,7.0,5.0,0.0,0.0,0.0,0
,,충전하는 방식도 문제가 될 수 있겠다.,Statement,Evaluation,0.0,0.0,0.0,5.0,4.0,3.0,0
,,평상시에 계속 착용하고 있어야하니까!,Statement,Evaluation,0.0,0.0,0.0,4.0,3.0,2.0,0
,,음 사이즈 조절 기능도 필요할 것 같아.,Statement,Recommendation,,,,5.0,4.0,5.0,0
,,심박수 등은 헐거우면 잘 인식되지 않을 것 같은데?,Question,Deep Reasoning,5.0,5.0,5.0,,,,0
21,2024-08-15 0:44:01,동건이는 강아지를 키우고 있어?,Question,Low-Level,3.0,2.0,1.0,0.0,0.0,0.0,0
21,2024-08-15 0:46:21,강아지의 울음이나 짖는 소리를 시스템이 잘못 해석할 때의 문제들에 대해서 생각해본 적도 있을까?,Question,Deep Reasoning,5.0,5.0,5.0,0.0,0.0,0.0,0
21,2024-08-15 0:47:51,"그래서 아이디어 자체가 재미는 있을 것 같은데,",Statement,Evaluation,,,,2.0,2.0,1.0,1
21,2024-08-15 0:48:59,"정말 보호자들이 원할지,",Question,Deep Reasoning,5.0,5.0,5.0,,,,0
21,2024-08-15 0:49:52,그리고 보호자들이 원하더라도 동물들에게 좋은 방법인지 다시 생각을 해보면 좋을 것 같네,Statement,Recommendation,,,,4.0,4.0,4.0,0
21,2024-08-15 0:50:26,반려동물 목소리를 자연어로 번역하는 서비스 말고 생각해본 완전히 다른 아이디어도 있을까?,Question,Generate Design,5.0,5.0,5.0,0.0,0.0,0.0,0
21,2024-08-15 0:51:16,이 아이디어를 꼭 발전시키고 싶은 이유는 뭐야?,Question,Deep Reasoning,6.0,7.0,5.0,0.0,0.0,0.0,0
21,2024-08-15 0:51:17,동건이는 반려동물과 교감하기 위해서 주로 어떤 행동을 하곤해?,Question,Deep Reasoning,5.0,6.0,5.0,0.0,0.0,0.0,0
21,2024-08-15 0:53:21,"동건이 말로는 정확도가 중요하지 않겠다고 하지만, 내 생각에는 정확도가 정말 중요할 것 같아.",Statement,Evaluation,,,,6.0,6.0,5.0,0
21,2024-08-15 0:54:38,"사람의 언어를 번역할 때도 작은 실수하나가 큰 오해를 낳기 마련인데, 정확도가 낮으면 정말 많은 오해들이 생기고 강아지에 대한 인식이 바뀔 것 같아",Statement,Evaluation,,,,6.0,6.0,5.0,0
21,2024-08-15 0:55:11,그리고 애초에 강아지를 사람의 관점으로 이해하려는 것 자체가 보호자로서의 좋은 태도일지에 대해서 생각해보면 좋겠어.,Statement,Evaluation,,,,5.0,6.0,4.0,0
21,2024-08-15 0:58:31,그럼 지금까지의 피드백을 듣고 새로 떠오른 아이디어들을 브레인스토밍하듯 말해볼래?,Question,Generate Design,6.0,6.0,5.0,0.0,0.0,0.0,1
21,2024-08-15 0:59:00,"결국에는 문제의 핵심은 보호자가 반려동물의 마음과 상태를 이해하지 못하는 것에 있으니까,",Statement,Evaluation,,,,5.0,5.0,4.0,0
21,2024-08-15 1:00:06,3번째 아이디어를 제외해서 다른 아이디어 중에서 하나를 골라볼래?,Question,Generate Design,5.0,5.0,4.0,,,,0
21,2024-08-15 1:01:06,"강아지가 불편하지 않은 방식으로 모니터링을 하는 것이 중요할 것 같은데,",Statement,Evaluation,,,,5.0,4.0,3.0,0
21,2024-08-15 1:01:07,혹시 생각해본 아이디어가 있을까?,Question,Generate Design,5.0,5.0,4.0,0.0,0.0,0.0,0
21,2024-08-15 1:02:37,"웅 하나의 디자인을 만들다기보다 강아지들도 선호를 가질 수 있어서,",Statement,Recommendation,,,,4.0,3.0,4.0,0
21,2024-08-15 1:04:02,다양한 컨셉을 제안해보는 것도 좋을 것 같아,Statement,Recommendation,,,,3.0,3.0,4.0,1
21,2024-08-15 1:04:37,"건강 중에서 사실, 무엇을 모니터링하냐에 따라서 다를 것 같네.",Statement,Evaluation,,,,5.0,4.0,3.0,0
21,2024-08-15 1:06:07,동건이는 어떤 부분을 가장 궁금해하고 있어?,Question,Low-Level,4.0,3.0,1.0,,,,0
 ,,그리고 이 부분을 설정하기 위해서는 단순히 아이디어뿐만 아니라 자료조사가 많이 필요할 것 같다는 생각이 드네,Statement,Recommendation,,,,4.0,5.0,4.0,0
,,"심가수, 체온, 활동량 정도는 쉽게 측정할 수 있어서 걱정할 필요는 없을 것 같아.",Statement,Evaluation,,,,6.0,5.0,4.0,1
,,그럼 지금까지 정리된 아이디어를 말해볼래?,Question,Concept Completion,6.0,6.0,5.0,,,,1
22.0,2024-08-14 0:34:08,좋은 아이디어인것 같아,Statement,Evaluation,,,,2.0,1.0,1.0,1
22.0,2024-08-14 0:34:56,그러면 이 아이디어는 아이들을 위한 필터링 서비스 인거지?,Question,Verification,5.0,5.0,3.0,,,,0
22.0,2024-08-14 0:35:44,그렇다면 아이들이 시청하는 콘텐츠를 관리 할 수 있는 수단이 필요하다는 거구나,Statement,Evaluation,,,,4.0,3.0,2.0,1
22.0,2024-08-14 0:37:21,동건이가 제시한 아이디어에서는 지금은 적절한 콘텐츠만 노출 시키고 나머지는 차단되는 아이디어인데,Statement,Evaluation,,,,5.0,4.0,3.0,0
22.0,2024-08-14 0:37:22,"관리를 하는 측면에서 보면 보상이나 다른부분도 적용하면 좋을것 같아,",Statement,Recommendation,,,,4.0,4.0,5.0,1
22.0,2024-08-14 0:40:05,예를 들면 특정 시간에는 학습 관련한 영상이 나오고 쉬는 시간에는 만화가 나온다던지,Statement,Recommendation,,,,5.0,5.0,5.0,1
22.0,2024-08-14 0:41:26,"내가 생각할때는 이 서비스를 실질적으로 사용하는 유저는 부모님이기 때문에, 필터링 서비스를 제어하는 앱 같은 경우에는 부모님을 대상으로 디자인 되어야할것 같아",Statement,Recommendation,,,,6.0,6.0,5.0,1
